selftext,subreddit,title
Why are socialism and communism associated with racial and religious minority support ? I have heard BLM described as communists countless times. I have also heard the Charlottesville counter protesters described as communists by T_D. ,communism,Question about communism and race
,communism,For comrades in usa
,communism,"A half a century since the demise of SDS: SDS’s sorry fate was a big blow to the anti-war movement. The experience, however, serves as a lesson on getting too far ahead of the people."
,communism,Homegrown Outcasts: North Koreans in Japan
,communism,"The Real News did a 12 part interview with Alexander Buzgalin. Talks about growing up in the USSR, the fall of the Soviet Union, etc."
"Yo.

I think mainstream social media is unsafe to use. Here is an article I wrote about it for your consideration.

[https://bootlicker.party/posts/a-denunciation-of-mainstream-social-media/](https://bootlicker.party/posts/a-denunciation-of-mainstream-social-media/)",communism,An Article I Wrote for My Party's Public Internal Bulletin About Social Media
"[https://redpavedroad.wordpress.com/2018/05/17/lenins-most-important-lesson-imperialism/](https://redpavedroad.wordpress.com/2018/05/17/lenins-most-important-lesson-imperialism/)

This was the most recommended topic for clarification in my study group - This may help a few of you.",communism,Lenin's Theses on Imperialism summarised
"When I was 12, i discovered politics and the world behind it. At first all seemed to be ""like a football match"", like my parents always said, a team against another one. At the time, a new political parry grew in popularity, and I supported (no matter what they did) the party because it looked very leftist.

Then, when I was 13, I disvovered communism, not as something that was good, but rather as a simple dictatorship (as Franco's or Mussolini's), due to the famous 100 miLliON deAThs By CoMMUnisM. But I kept researching about the topic, while I was defending the other political party.

And, finally, when I was 14, I understood communism as an ideology that exist to help the poors of the world, the proletariat, by taking the power by violence from the bourgeoisie. This was also the year I finally read The Communist Manifesto, and about Che Guevara and Fidel Castro.

I am looking forward to read more leftist theory.

Thanks for all of this, comrades.",communism,A personal history with communism.
,communism,The effect of the US blockade on Cuba and it's internet. Only Venezuela and Jamaica have links
,communism,In Dedication to a Girl at a Skating Rink in the Beautiful City of Pyongyang
[https://redpavedroad.wordpress.com/2018/02/19/the-science-of-marxism/](https://redpavedroad.wordpress.com/2018/02/19/the-science-of-marxism/),communism,Beginners Guide to Dialectic Materialism.
,communism,NYC-DSA Endorses Cynthia Nixon for Governor
,communism,The Truth About The Cuban Missile Crisis
"Incredible book. I stumbled upon it randomly, but as always Parenti explains things clearly with simple terms. I'm only at the beginning, and already the author condemns the friendly relationship between Nazi Germany and other powers.

If you don't know about this stuff yet, or know people who think fascism is going to solve our problems, make them read this book.

I found a scan online, but I'm not sure how allowed that is. Edit: I'm just saying, google for the book and look near the top.",communism,"If you know people who are turning towards fascism, make them read Parenti's Blackshirts and Reds"
"Hey. I'm making this post mostly because I've been thinking about this stuff for more than a year and have had no real meaningful and open dialogue with anyone except a select group of friends. About a year and a half ago, I went from a moderate Liberal with some pretty mild leftist ideals, to starting to hold more outright socialistic beliefs. At first it didn't phase me, I just continued to grow as my own person and evolving my beliefs. I'd say about six months into my gradual and slow transformation, I realized I no longer could call myself a liberal, because frankly Liberal policies made me kinda disgusted. It was a weird realization, mostly because the only person i knew at the time who was a socialist was a friend of mine several states away who was also a die hard anarchist, not really aligning with my beliefs. I should mention I'm in my senior year of High school now, in a pretty conservative state. This realization came almost exactly a year ago though, and i didn't really explore it much besides a few jokes with friends about how I loved the USSR.

The main reason i didn't explore if I was a Communist a year ago was my girlfriend. She was a hardcore liberal, like absolutely 100% liberal. honestly, not even that much of a liberal as she held no real, substantial views, except one thing, Donald Trump is bad, Democrats are good. So, for the past year, I sort of just explored my political identity and beliefs on my own. I taught myself as much as i could realistically about Marxist theory, all without tripping people's alarms. I talked with my best friend about Soviet policy because, like me, he is a huge history buff with a big hard on for Soviet history during WW2. I would say the final nail in the coffin, the thing that made me finally realize I was just a Socialist, were, ironically, fucking memes. It's weird to say, but the thing that made me actually commit to reading more and more Marxist literature and accepting that i was just a fucking Communist, was the fact there are so many fucking absolute morons. I can't fucking tell you how many times I've been put in this weird position of trying to convince people the Nazis were bad on a meme page that posted a meme about the Red army. I remember one specific instance, around November of last year, where i read *Marxism and The National Question* when i got into an argument with some neo-fascist reactionary asshole about how Hitler actually didn't want to kill all Jewish and Slavic peoples, but Stalin hated minorities 100%. After that, i was on little reading spree. I started reading PDF's of Das Kapital, The Communist Manifesto, and Lenin's Imperialism.(Keep in mind, i've only read all of the Communist Manifesto, I intend to finish the other literature it's just i tended to not have time when i started them) Arguing with reactionary holocaust deniers and moral relativists that declare the Soviets to be the REAL bad guys did more to push me to describing myself as a communist than any personal introspection, not because i didn't genuinely hold these beliefs beforehand, but because it scared me how those around me would react. Only until i was faced with literal fascists did I accept that i was a Socialist. At first i just described myself as a super left leaning social democrat, but that felt disingenuous so i stopped. Now, i avoid labels and just focus on the substance of what I believe. 

This post is mainly for myself. It's kinda me putting a minimal version of my ideological journey over the course of the past nearly two years. Also, if you guys could give me some suggestions in terms of literature and authors, that would be really helpful. Id' like to think I've developed a fairly decent understanding of theory but I DEFINITELY need more practical literature and shit.

Thanks, appreciate it.",communism,"Hello, I have some stuff I need to get off my chest."
,communism,"100,000 Russians rally in communist-organized protests against pension reforms"
"Who is Kautsky and what did he do?

How and why does Lenin criticize him?",communism,Kautskyism
,communism,New sub r/Avante - Left-wing discussions/jokes in Portuguese/Galician
"There have been a lot of questions and discussions among communists online about the sex industry lately, so I thought I’d make a short post summarising what I believe to be the correct Marxist answers to various basic questions on the subject. The main purpose of this post is to help educate anyone who is new or unsure about the subject, to combat some reactionary ideas, and for me to link or refer back to when responding to questions on r/communism101. In this post I’ve used a few slightly edited versions of comments I’ve made on previous threads about this topic (just mentioning it in case anyone thinks some parts of this post sound familiar). 


**What is the Marxist perspective on sex work in general?**

Sex work is objectively rape in the vast majority of circumstances. Here is a simple explanation of why:

Sex work = wage labour 
and
Wage labour = coercion 
therefore
Sex work = coercion. 
Coerced sex = rape 
therefore
Sex work = rape. 


**What about those who are in a good financial position and choose sex work because they enjoy it?**

Firstly, there are very, *very* few of these people; certainly far fewer than liberal “feminists” whose goal is to normalise the sex industry would have you believe. Secondly, they’re part of the labour aristocracy, and the labour aristocracy is not our priority. No communist thinks what these people are doing is wrong or that they should be shamed for it; we simply don’t believe that their opinions or desires should be our primary focus when discussing the sex industry. Our primary focus as communists should always be on the exploited majority, not the privileged minority. We don’t argue that some privileged members of the labour aristocracy “love their jobs” or “choose” to do them when other forms of wage labour are criticised, do we? So why do we do this when the sex industry is criticised?


**But keeping sex work criminalised is harmful to sex workers.**

Yes, of course. No communist thinks sex workers should be arrested or punished; that’s obviously reactionary and misogynistic. The debate is between supporters of full legalisation and supporters of the Nordic model. I won’t go into this debate here; it’s a separate subject. 


**What about porn? What do communists think of that? What do you think of “feminist porn” which has become a trend lately?**

It’s highly exploitative and often misogynistic, racist and homophobic in the most disgusting ways. Sure, you can probably find morally acceptable “feminist porn” somewhere, and sure, erotic content could probably exist in some form under communism, but that isn’t our concern right now. We don’t care about reassuring liberal “communists” that they can find “ethical porn” or that they can still get all their sexual desires met under socialism. We care about opposing the sex industry under capitalism and helping the people who are victimised by it. Anyone whose immediate reaction to this viewpoint is anything along the lines of “but not all porn is like that, you know” or “but we will still have some kind of porn under communism, right?” is a reactionary who is more concerned about their own sexual satisfaction than about the millions of people, mainly women and girls, who are victimised by the sex industry. 


If anyone has any criticisms or anything you think I should add, please let me know. I am open to discussion. ",communism,Marxist views on the sex industry
"Propaganda is not meant to be negative, I just couldn't think of another word. ",communism,What are your favorite communist propaganda posters?
,communism,DSA: Don't Endorse Cynthia Nixon… or any Democrats. Ever.
"After being attacked in feb 2018 and nearly killed by a racist, muslim antifascist organizer and co-founder of bay area intifada Jabar is in need of financial support to until disability kicks in - a 4 month wait. in the meantime jabar is drowning in debt and was just recently diagnosed with severe ptsd, bipolar disorder and possibly mania from the trauma of the attack.

please consider donating, upvoting and sharing the links:

gofundme: [https://www.gofundme.com/islamophobic-hate-crime](https://www.gofundme.com/islamophobic-hate-crime)

cashme: [https://cash.me/$ruptures](https://cash.me/$ruptures)

venmo: [https://venmo.com/ruptures](https://venmo.com/ruptures)

follow on twitter: [https://twitter.com/brwnrage](https://twitter.com/brwnrage)",communism,Muslim leftist in need of support after violent Islamophobic attack
[https://www.jacobinmag.com/2018/07/communist-party-philippines-sison-duterte](https://www.jacobinmag.com/2018/07/communist-party-philippines-sison-duterte),communism,The Fate of the People’s War AN INTERVIEW WITH JOSÉ MARIÁ SISON
"So, I'm starting college next year. Since I've been in middle school, I've been interested in linguistics and I've always thought that I would go to school for it. But, this past year, I've gone from democratic socialist to complete communist. This is where the problem is. I love linguistics. It may seem boring but it's just so calming and interesting to me. But, I've also somewhat fallen in love with the idea of activism, especially communist, anti-imperialist activism. I don't want to give up on either one. I'm just wondering if any of you has any advice about what to do. Is there a way to merge both?",communism,Careers and degrees
,communism,Are you a Cool Kid or an Organizer?
"The PCI was a pretty powerful party in Italian politics beginning very shortly after they broke from the Socialist Party of Italy. They played an important role in the Resistance during WW2, and became probably the largest Communist Party in Western Europe during the Cold War. Reading just some basic histories of the PCI really struck me that they, throughout their history, seemed to do as much as possible to avoid violence, direct action or anything resembling a proletarian revolutionary movement.

During the rise of Mussolini, the formation of the Arditi del Popolo and similar militant anti-fascist squads wasn't supported by either the PSI or the PCI, at least officially. Definitely members of the parties participated but Bordiga wasn't supportive of antifascism (something a lot of leftcoms still do today). The leadership of the PCI did not support militant anti-fascism before World War 2, basically. This isn't exactly unheard of; [some of the KPD leadership that later got expelled was collaborating with the NSDAP in the 30s while communists in the street fought Nazis](https://libcom.org/library/investigation-red-brown-alliances-third-positionism-russia-ukraine-syria-western-left) and the PSI basically signed a peace treaty with Mussolini.

It wasn't until World War 2, under different leadership, that the PCI began an underground resistance working with other Italian non-leftist resistance.

Years go by, PCI grows and grows and has a lot of local influence. They have some disagreements with Soviet policy and actions, and post-1969 are basically an anti-Soviet party. But things really heat up during the Years of Lead. Eastern Bloc-backed Red Brigades are engaging in an urban guerrilla campaign, again something not out of place for the times (Weathermen in the US, RAF in Germany with actions in Scandinavia, Angry Brigade, Official IRA/Provisional IRA/Irish National Liberation Army, the ETA in Spain, Japanese Red Army and the later United Red Army, whatever that splinter group from the RCP was called). The PCI condemned them, iirc collaborated against them and later the Red Brigades attacked PCI leaders and kidnapped a Christian Democrats member which killed the attempted coalition.

The later history of the PCI is basically splits, watering down Eurocom to social democracy and then just giving up in 1991. 

I guess what's interesting to me is that the PCI was a massive party which early on recieved massive Soviet aid and experienced three different insurrectionary campaigns in its history. Yet in all three times it wasn't really supportive of them. It condemned the anti-fascist movement and played a role in keeping the Italian left divided. Then, it only really resumed operations officially in 1944, pretty late into WW2. Then finally, it actively worked against the Red Brigades.

More than any other Communist Party I can think of the PCI put a lot of effort into not being revolutionary. It did a lot of cool stuff in terms of reforms but I really cannot think of another party that worked harder at not being a militant party. In its historical context, it's not like revolution wasn't possible: worldwide revolts and guerrilla campaigns were ongoing; the Soviet Union was still a major political power (regardless of their official politics); the PCI had a *massive* base in Italy and control over many localities; fearing coups, members of the PCI were apparently trained by the Stasi and KGB; the Years of Lead saw a plethora of far-left guerrilla movements in Italy with some popular support, not limited to the Red Brigades, across the left spectrum from anarchists to autonomists to hardline MLs.  

Why do people think the PCI took this strong parliamentary or nonviolent position? What does say about the PCI or its various leaders? 

note: I'm not Italian or an expert in Italian history. If I have something wrong please correct me. ",communism,Why did the Communist Party of Italy repeatedly denounce militancy?
"Specifically, the very restrictive copyright, where no one may redistribute and modify the work without permission.",communism,What do you think about copyright?
,communism,Trump Advised by Kissinger to Cozy Up With Russia to Contain China
,communism,Missing Pages of Malcolm X's Autobiography Found
,communism,"Castro seeks to do away with the old guard as a way to preserve socialism, analysts say"
民警李建国之反邪教篇 UP主: 共青团中央 http://www.bilibili.com/video/av27773073,communism,Great anti cult video by Chinese Communist Youngth League which focus on attracting young people.
,communism,The most pathetic attempt at whitewashing ever.
,communism,"Cuba: Castro Denounces US 'Siege' on Cuba, Venezuela, Nicaragua"
"PLEASE SPREAD THE MESSAGE. YOUR HELP IS NEEDED IN BRINGING ATTENTION TO THE EVENTS AND DEMANDS.

Rebels incarcerated in prisons across the nation declare a nationwide strike in response to the riot in Lee Correctional Institution, a maximum security prison in South Carolina. Seven comrades lost their lives when prison officials turned their backs on a riot they provoked. We are demanding humane living conditions, access to rehabilitation, sentencing reform and the end of modern day slavery.

On the web:

https://incarceratedworkers.org/campaigns/ http://prisonstrike.com

On Twitter:

\#August21 \#PrisonStrike \#AbolishPrisons",communism,"Action Alert: Nationwide Prison Strike, Aug 21, 2018"
"I'm reading chapter 3, and Lenin, slightly cryptical (but probably obvious at the time and to those more knowledgeable) says 

&gt;This merchant has a much deeper and more ""Marxian"" understanding of imperialism than a certain disreputable writer, generally held to be one of the founders of Russian Marxism, who believes that imperialism is a bad habit of a certain nation...

Who is he referring to?",communism,Questions from Lenin's Imperialism
"I'm 15 yo. My city is very small and does not have any communist/socialist organizations as it seems (I do not live in the US), specially for young people, and most people are very anti-communist. I've been reading some books but I really wanted to get practical, since I feel like theory itself will not change much. Should I wait until I go to college in another city to join an organization? Should I try to find some comrades and start something? Any suggestions will be appreciated.",communism,being useful as a teen
Do any of you have any good strategy for this? What points do you bring up? I’m trying to see if I can get a few of these people to come more to our side but I don’t know how best to approach it ,communism,Converting liberals/DemSocs
"I remember a source that show the distribution of  income between wage income (working people) and income based on capital.

I made a few search and could find the following:

[https://blogs.imf.org/2017/04/12/drivers-of-declining-labor-share-of-income/](https://blogs.imf.org/2017/04/12/drivers-of-declining-labor-share-of-income/)

Does any comrade may have some others sources or information to share on this?",communism,Looking for a source on split between wage and capital income
,communism,How well does the Labor Theory of Value predict equilibrium prices(when supply and demand are at equilibrium)?
"Sorry if this isn't the right place for this.

Currently I'm writing an essay on the causes of the October Revolution, and my argument is that its success was cause, above other factors, by popular support. I'm in the planning phase currently and have found an abundance of evidence supporting this idea in the context of the industrial working class, which made up (I think) about 25% of the population. However, my argument sort of falls apart if it was only supported by the workers and not the peasants that made up the largest portion of the population. So I was wondering if anyone has any sources to suggest that the Bolsheviks, or at least the October Revolution itself had peasant support? Of course the SRs were the traditional peasant party, but in *10 days that shook the world*, John Reed suggests in the final chapter that Lenin organised some kind of alliance? I would just use that as my source but its quite vague and confusing, so I'm wondering if anyone here can help me out. Thanks.",communism,Peasant support for Bolsheviks?
,communism,July 26 - National Day of the Rebel in Santiago de Cuba (with video)
,communism,Behold capitalism at its greatest! /s
,communism,"65 years ago today, Fidel Castro led an assault on the Moncada Garrison, the beginning of the 26 July Movement. After the 1 January 1959 Revolution, the Garrison was turned into a school, the “Ciudad Escolar 26 de Julio”, and part of the building is now a museum."
"I’m only 15.  A middle class American who enjoys a good standard of living. I attend a great school with great teachers. However, nothing infuriates me more than the murder of innocent minority groups (Especially LGBT and Black People). I hate seeing innocent workers being exploited by the richest of the rich. I feel the President, Donald Trump, is the most foolish and unqualified person to lead a powerful nation. I truly believe in equality for all peoples, (not equality as America describes it, where women  earn less and there are literally KKK rallies.) I collect national flags and am desperate to attend an anti-fascist march flying the red banner of the Soviet Union, as I believe because I hate fascists and white supremacists more than anything, I feel I agree with many of a communist’s. Points of view. Is communism right for me?",communism,Am I a communist?
,communism,"teleSUR: The brutal occupation of #Kashmir, like the occupation of #Palestine, is another example of a right-wing government occupying sovereign territories and committing massive human rights abuses"
,communism,Communist Party of Turkey: We call on all our friends and comrades to stand with the Greek people!
,communism,Lenin On Decaying Capitalism
,communism,"Spain does U-turn on Cuba and Venezuela in favor of dialogue. Unmentioned in this report is the fact that the EU abandoned its pro-US ""Common Position"" on Cuba almost a decade ago."
,communism,Nicaragua Protest Violence: The New Face of Imperialism
,communism,What was life like under communism? Any good YouTube documentaries you recommend?
"I recently fully embraced my identity as Marxist (I'm from Italy and my grandfather fought with the Resistance, so at first it kinda felt as a way to make him proud). Even though I've been reading some essays etc, I couldn't find any novel set in a Communist-inspired world/whatever, so I'd like you to recommend me some. 

Thanks!",communism,Marxist novels?
,communism,"Biggest rise in UK poverty since Margaret Thatcher was in power, experts claim"
"I remember learning about the Vietnam War in 7th grade from the perspective that Vietnam is to blame... not once did they mention the only reason America was at war was communism or that America was bombing innocent civilians before they had even declared war. It’s astonishing that teachers don’t teach about wars revolving around communism from both perspectives, like when learning about WW2 we learned why Germany was in the war and its motivations but never learned that for the Cold War or Vietnam War other than, “they had communism so the us had to fight.” The same goes for communism itself... we are taught about capitalism and feudalism and totalitarianism but learn nothing about communism other than that it’s “bad”...  did this happen at anybody else’s school or was it just mine.",communism,America’s Delusion of the Vietnam War
,communism,New Book: Torkil Lausen – the Global Perspective
,communism,"All Soviet Statistical Yearbooks from 1921 to 1990 which contain data on Soviet national income, productivity, wages, living standards, etc."
,communism,Why communism appears to be gaining favour in South Africa
,communism,"This call is for a two-week national strike beginning on Aug. 21, the anniversary of George Jackson’s assassination, and extending until Sept. 9, the anniversary of the Attica Prison Rebellion in 1971. The call has been taken up inside from coast to coast, and across at least 17 different states."
,communism,"All East German Statistical Yearbooks from 1956 to 1991 which contain data on East German national income, productivity, wages, living standards, etc."
,communism,From inter-imperialist war to global class war: Understanding distinct stages of imperialism
,communism,[x-post r/socialism] Don't Purge the Radicals: A Lesson From History
