selftext,subreddit,title
,communism,Transcript of Xi Jinping's keynote speech at the opening ceremony of the 2018 Beijing summit of the Forum on China-Africa Cooperation - worth reading in full
"Hey comrades, I went looking for the website for Pravda, the struggling socialist publishing house in Missouri and it seems to have disappeared. Does anyone have any news or updates as to what has been happening with them? I don't want to see them go under, and they have clearly been struggling to keep the lights on so to speak.  Thanks in advance comrades.",communism,Pravda media website gone?
,communism,China announces huge debt relief program for countries in Africa - no strings attached
"i've struggled with intense physical and mental disabilities all my life. though i can contribute to some party activities (discussions, banner making and what have you) i still find most of the actual direct work my contingent does too difficult or in some cases impossible. i was wondering if anybody here (particularly other disabled comrades) has any suggestions on how to feel like i'm a good addition to the party instead of feeling like i'm dragging them down?",communism,disabled comrades?
,communism,2018 Main Political Report — Resolution on the International Situation | FRSO: Freedom Road Socialist Organization
,communism,The use of the buzzword “National Security” is justifying the unjustifiable: possible military invasion of Venezuela; possible economic war with China.
,communism,Demands of the Sep 5 Indian Workers &amp; Peasants Rally Against BJP Government.
"I'm taking a class on the history of the Soviet Union, and this is the required reading. Has anyone here read this? What is your take on Figes and his work? I have read the first few chapters, up to the February revolution. I'd like to share my opinion so far after reading what my comrades have to say.",communism,"""Revolutionary Russia: A History (1891-1991)"" by Orlando Figes"
,communism,"Torkil Lauesen Answers Bromma, on The Global Perspective"
"Hello Comrades; I'm writing an essay on the rulers of Russia from 1855-1945 form my history A-level, and was wondering if anyone on this sub could recommend any Historical sources about the Soviet secret police under Lenin from a Marxist perspective. As you'd expect, the sources we are recommended in class are all massively bias to a western, bourgeois perspective, and I'd like to inject some balance into this essay, so I'd really appreciate your help.",communism,Marxist Historical Sources on the Cheka
,communism,Why So Little Has Changed Since The Financial Crisis
,communism,21st Century societal organization in the post-capitalist world
"I don't know if this belongs here, in that case I will delete it, but I'm in College studying to be an English teacher and this semester every English class is gonna teach politics  and I'm the only communist in the class (or the only outspoken one) and I find it so draining to discuss every single class because no one shares my opinions, and before a class I investigate about the topic we're going to discuss (we have discussed Cuba, Venezuela and soon we will discuss DPRK) and every class I'm saying that those sources are biased and not telling the whole story and there's classmates taunting me because of my beliefs. I don't want to fight any more and honestly I don't want to go to class anymore. Should I keep my mouth shut?",communism,Does anyone else feel the same?
"In 1925, Konstantin Rodzaevsky left the Soviet Union for Manchuria (The old name given to a large region to the North of China, on the Sino-Soviet border). He had left his native Blagoveshchensk for the city of Harbin where he decided to join the local law society and went under the tutelage of other Russian emigres, especially one Professor N.I. Nikiforov. 

[With Nikiforov as his prefector, Rodzaevsky formed the Russian Fascist Organisation](https://www.jstor.org/stable/259654)

Six years later, he became the Secretary General of the newly formed Russian Fascist Party, adopting a yellow bannered Swastika as its symbol. Yellow bannered in honour of his associates, who were members of the Imperial army of the Russian empire and then soldiers in the anti-Communist white army.

He translated many fascist German texts into Russian in a bid to try and unify the two groups, Nazi Germany and fascist Russia, against Communist Russia. Hilariously, one of the völkisch tracts not translated into Russian was Mein Kampf, mostly because Hitler repeatedly referred to Russians as 'untermensch' and the fact that his statements that Germany's lebensraum was to be found in the Soviet Union presented problems for the Russian Fascists. Rodzaevsky wrote to Hitler, asking him to amend Mein Kampf, and upon receiving no reply, finally did translate Mein Kampf into Russian in 1936 with the offending passages removed

Modeling themselves on the Italian Blackshirts, Rodzaevsky's fascists also wore black attire and were armed by the Japanese Imperial Army, to act as a minor buffer against the Soviet Union.

He served in the [Asano Detachment](http://www.chinaww2.com/2016/09/27/russians-in-the-service-of-the-japanese-emperor/),  a group most infamous for carrying out acts of sabotage against the Soviet Union, as they were too small and weak to carry out any high file acts of war. 

They created links to multiple blanket organisations around the world, one of the most prominent being in New York City. One prominent contact was the Russian Fascist [Anastasy Vonsiatsky](https://en.wikipedia.org/wiki/Anastasy_Vonsiatsky), who was arrested by the FBI for pro-nazi activities, but was unsurprisingly released earlier and died a naturalised US citizen.

Vonsiatsky made a very interesting statement: [""The Russian National Revolutionary Party, of which I am the leader, does not support either Germany's or Japan's ambition for hegemony in Europe or the Far East. The Germans and the Japanese have never made clear their attitude toward a replacement of the present Stalinist rule by a Russian National Government. The sole aim of our organization is to return Russia to a free people with a government elected by the people, of the people and for the people. Our intention is to form in Russia a truly DEMOCRATIC government. Our Party is not anti-Semitic. Our Party has no membership dues; it is financed solely by voluntary contributions from its members and sympathizers. It is not subsidized by any FOREIGN POWER or foreign individuals. Our organization is BANNED in Germany and Japan. Only in the United States can we enjoy freedom of action and thought within the laws of the country. I HEREWITH STATE EMPHATICALLY THAT THE ACTIVITIES OF OUR ORGANIZATION ARE AGAINST THE PRESENT SOVIET GOVERNMENT ALONE AND THAT IN NO WAY WHATSOEVER DOES IT ACT AGAINST THE CONSTITUTION OF THE UNITED STATES OR VIOLATE ITS LAWS WHICH WE LOYALLY SUPPORT.""](https://books.google.ie/books?id=eZ91V_t8sksC&amp;pg=PA102&amp;lpg=PA102&amp;dq=The+Russian+National+Revolutionary+Party,+of+which+I+am+the+leader,+does+not+support+either+Germany%27s+or+Japan%27s+ambition+for+hegemony+in+Europe+or+the+Far+East.+The+Germans+and+the+Japanese+have+never+made+clear+their+attitude+toward+a+replacement+of+the+present+Stalinist+rule+by+a+Russian+National+Government.+The+sole+aim+of+our+organization+is+to+return+Russia+to+a+free+people+with+a+government+elected+by+the+people,+of+the+people+and+for+the+people.+Our+intention+is+to+form+in+Russia+a+truly+DEMOCRATIC+government.+Our+Party+is+not+anti-Semitic.+Our+Party+has+no+membership+dues;+it+is+financed+solely+by+voluntary+contributions+from+its+members+and+sympathizers.+It+is+not+subsidized+by+any+FOREIGN+POWER+or+foreign+individuals.+Our+organization+is+BANNED+in+Germany+and+Japan.+Only+in+the+United+States+can+we+enjoy+freedom+of+action+and+thought+within+the+laws+of+the+country.+I+HEREWITH+STATE+EMPHATICALLY+THAT+THE+ACTIVITIES+OF+OUR+ORGANIZATION+ARE+AGAINST+THE+PRESENT+SOVIET+GOVERNMENT+ALONE+AND+THAT+IN+NO+WAY+WHATSOEVER+DOES+IT+ACT+AGAINST+THE+CONSTITUTION+OF+THE+UNITED+STATES+OR+VIOLATE+ITS+LAWS+WHICH+WE+LOYALLY+SUPPORT.+ANASTASE+A.+VONSIATSKY.+Thompson,+Conn.+July+4,+1940&amp;source=bl&amp;ots=n6XqjLFuC4&amp;sig=TVZZh-2aDv_RIsniVJ9wKfBgXKI&amp;hl=en&amp;sa=X&amp;ved=2ahUKEwid28Pj2J_dAhVlAsAKHW2GAzMQ6AEwAHoECAsQAQ)

Rodzaevsky and his fascist followers attended the anniversary of the founding of the Japanese empire and honoured Emperor Hirohito with praise for his anti-Soviet efforts.

Hirohito's forces used the Russian Fascists to [kidnap 'disloyal' White army Russians for use in experiments in Japan's infamous unit 731](https://books.google.co.uk/books?id=t8sdihXN47wC&amp;pg=PA305)

Rodzaevsky installed a [giant flashing neon swastika at the Russian club in Manzhouli](https://upload.wikimedia.org/wikipedia/commons/9/9a/RFP_Manchouli_Swastica.jpg), just three kilometres from the Soviet Border, in a bid to rub into the faces of the Soviet leadership that they had yet to catch him and that they had fascists on another of their doorsteps. 

The German Reich Ministry of War's physchological warfare lab created pamphlets urging Red army soldiers to overthrow the ""Jew Commissars"", the pamphlets were supposed to [be spread by the Russian Fascist Party](https://en.wikipedia.org/wiki/War_crimes_of_the_Wehrmacht)


Notoriously anti-semitic, Rodzaevsky published numerous pamphlets calling for the destruction of Jews wholesale and wrote extensively in his party paper ""Nash Put"" on 'The Jewish Problem'

Rodzaevsky demanded the Japanese assist him in his attempt to overthrow the Bolsheviks, but they relegated him to sabotage acts.

Towards the end of the war, Comrade Soldiers of the Worker's and Peasant's Red Army advanced on his position. Like the coward he was, Rodzaevsky adopted National Bolshevism in a desperate bid to save his life, praising Stalin as ""The unknown leader"" he had envisioned who was [""capable of overturning the Jewish government and creating a new Russia...by the will of fate, of his own genius, and of millions of toilers, Comrade J.V. Stalin, the leader of the peoples""](https://www.jstor.org/stable/259654?seq=1#page_scan_tab_contents)

The Soviets promised him freedom and a job in one of the newspapers, and Rodzaevsky eagerly relented. 

Once back in Soviet Russia, the Bolsheviks immediately captured him and executed him. Whilst imprisoning many of his co-conspirators.

Post his return, other National Bolsheviks like Nikolai Ustrialov returned and were not met with execution, but mistrust due to their past associations. 

On National Bolsheviks as a whole, Lenin [condemned them in his ""On The Intelligentsia""](https://en.wikipedia.org/wiki/Intelligentsia)",communism,On the Russian Fascist Party of the 1930's and 40's.
,communism,Israel drafts a law to jail anybody flying Palestinian flag.
,communism,EXPOSED! 'Nazi' Azov Battalion receives Armaments from ISRAEL - Fort Russ
I have already read the manifesto and will start reading Lenin soon. ,communism,Any suggestions for good communist literature?
"I've been thinking about this a lot lately, and the only way I can come up with is by looking at how they tend to blame an issue on a demographic based off of something that isn't money (IE Hitler blaming the Jews, Trump blaming refugees and immigrants). 
Anybody got any other ideas/ ways on this?",communism,Basic ideas/ steps on identifying a nazi/ nazism subtext?
,communism,Dutch resistance members celebrate when they hear the news of Adolf Hitler's death. May 1945.
"Though I am an avid follower of much of Marxism and Communism, I don't really have a lot of data at my fingertips that I can point to during a debate/argument with someone. Not to mention it would be very helpful just to read up on and become versed in Marxist and Communist economics. I know this may sound like a stupid question since I'm sure there is a lot of data out there. I've found a few socialist review journals which should help, but I just want to hear from you guys. Thank you for your time.",communism,Where can I find credible research data and studies that proves Communism can work well?
,communism,Indian Farmers &amp; Industrial Workers to Hold a Joint Protest Against BJP Government on 5 September 2018
,communism,#August21 Solidarity Event in Tallahassee on 09/04
,communism,Stationary Plane Leaves American Patriots Breathless
,communism,"On this day, Ho Chi Minh passed away."
"I was researching how the USSR treated Jews and I came across Molotov's wife Polina Zhemchuzhina. She argued for a semi-autonomous region for Jews in Crimea. She was apparently arrested for these views however I was looking for a better source then wikipedia. Any research on how Jews were treated in the USSR will be gratefully accepted by the way, thanks. ",communism,Does anyone have any unbiased info on Polina Zhemchuzhina?
,communism,Declassified docs reveal how Pentagon aimed to nuke USSR and China into oblivion
"With respectable I mean academic or of comparable quality (i.e. no Grover Furr or conspiracy theorists). I'm looking for relatively broad overviews of the USSR and analyses of its downfall/overthrow. I'm looking for critical historical works, not propaganda. 

I have already read *The Stalin Era* by Strong and *Blackshirts and Reds* by Parenti (both of which I liked) and am currently reading *Origins of the Great Purges* by Getty.

I'm considering reading something by Kotkin since he seems rather sensible (doesn't think Stalin was some psychotic sociopath) and also *Ten Days that Shook the World*. Though the latter is hardly a critical history, it's always good to read some eyewitness accounts (which is why I'm also considering to read some anti-communist accounts for good measure). 

Anyway, sorry for the long post, but I would really appreciate any suggestions!",communism,Could y'all recommend me some respectable literature on the USSR?
,communism,American prisons are barbaric. The national prisoners’ strike is a righteous response to those horrendous conditions.
,communism,Second September 1945: National Vietnamese Day.
,communism,US military blocks proposed railway linking North and South Korea
From what I found the USSR was planning on becoming a member of the axis but then didn't.,communism,Can someone please explain Soviet relations with the third Reich and the axis in WWII.
/title,communism,Any good podcasts you guys would recommend?
,communism,"They've been denying it for years, but succinct proof has finally surfaced that the US funded Yeltsin's campaign against the Communist party in the 1996 elections."
"Sorry to post again but I want to read about imperialism and colonialism in Africa and if anyone could point me towards good literature on it, that would be greatly appreciated",communism,Anything on imperialism in Africa?
,communism,Nazis on the march
I’ve been hearing about alt right demonstrations against refugees? What’s going on? Has there been an anti fascist response?,communism,Any German comrade care to explain the protests?
"Would it be fair to classify people who make their living off of gambling as lumpenproletarians?

They don't sell their labour to make a living even though they otherwise would, they invest all their time and energy in an inherently anti-social activity which does not benefit society in the slightest or produce anything of value, they live parasitically off of ordinary working-class people who provide gambling companies with their profits in the first place. Come the revolution, they'll be useless.

I would say they're lumpen.",communism,Are gamblers lumpenproletarian?
"Lenin and Trotsky both explained how Russia, despite being the most backward of the major capitalist countries, could launch a successful proletarian revolution before the advanced countries in Europe - and in 1917, this did indeed happen. There is an explanation for this when we look at it from a dialectical point of view. As Trotsky explained, Russia's very backwardness created the material conditions that allowed for the Russian proletariat to seize power before the proletariat in the West, as the bourgeoisie (the class meant to develop capitalism) was too weak and small to play a progressive role, and too tied to the interests of the landlords and the autocracy, as well as foreign capital, to have any interest in promoting democracy or an independent, national form of capitalism. Furthermore, the fact that Russia was forced to rely on ideas and technology imported ready-made from the West meant that it could expend all of the effort that would otherwise have been spent on organically developing capitalism on simply improving the ideas and technique imported from the West. With the newest innovations and technology came the newest political ideas - i.e. Marxism - which found an audience among the small but militant proletariat. Because it developed so quickly it did not have time to be corrupted by right-wing liberal reformists in the trade unions like, say, the British proletariat.

However, I am yet to come across a complete dialectical explanation for why America, the most advanced capitalist country, despite its advanced nature, is also the most conservative, the most backward, the most regressive concerning the sphere of political ideology and religion (which is, of course, a form of ideology). It has never developed a mass workers' party, with both political parties being dominated by the interests of Capital. Most people believe in some sort of deity, and, until recently, most were also regular church-goers. Megachurches filled with thousands and thousands of people are headed by self-proclaimed ""men of God"" that try to mix religion with business and justify the selfish and materialistic nature of capitalism with reference to the Bible. Significant minorities hold openly racist views, and at least one of the two major parties is filled with openly racist or fanatically religious politicians holding office.

I will try and answer my own question, based on my own understanding of Marxism and American history. America, having been for much of its history the most prosperous capitalist nation, has never felt the need for large-scale socio-economic reform of the kind that European countries were forced to undergo to appease the increasingly militant proletariat. In the last chapter of Capital, Marx talks about how America was so vast that the colonists were able to have their own small plots of land. In this situation, there was no development of a large proletarian class for many decades - indeed, the colonial authorities had to artificially create one in order to allow for the development of capitalism. Only the Civil War allowed for full-scale proletarianisation to take place in America, once the backward Southern agrarian bourgeoisie which relied on slave labour had been defeated. Even then, for much of the nineteenth-century, U.S. workers were relatively prosperous thanks to deflation and the fact that the increasingly prosperous American capitalists, thanks to their increasingly large profits, could afford concessions through increasing real wages. It was really only during the Great Depression that the working-class of America became restive to the point of nearly adopting communism and forming an independent workers' party, but the victory of America in WWII and the destruction of the other capitalist economies thanks to the carnage of war allowed for years of boom, during which working-class Americans enjoyed unheard of prosperity.

The American people long deluded themselves that their prosperity was not thanks to their unique set of material conditions - being a large country with a large population and lots of natural resources - but because of their cultural superiority. America, more than any other nation, is saturated with bourgeois ideology. ""Rugged individualism"" and the entrepreneurial spirit are given credit for America's prosperity. Anglo-American liberalism and the Protestant work ethic are seen as key to understanding America's position as the wealthiest capitalist nation in the world. America is still the most religious nation in the Western Hemisphere. A country which has sent a man to the moon, produced the most marvellous feats of science and technology, has developed wonders greater than the pyramids of Egypt, is still populated by millions and millions of people who believe in the myths of the Old Testament, in UFOs and the moral evils of abortion. The American people are the most ignorant, uneducated, close-minded, conservative and reactionary-minded people in the entire capitalist world. I do not say this to insult them, but as a matter of objective fact.

Since the 1970s and the introduction of neoliberal economics of course, the lot of working-class Americans has collapsed dramatically, and inequality has never been higher. Just as in the years of the Great Depression, millions of working-class people have lost all illusions in the capitalist system. The prosperity of the 50s and 60s is not coming back, ever. American capitalism is permanently broken. Another New Deal is out of the question - the capitalist class simply cannot afford it. Obama's piecemeal reforms have resulted in nothing good for the American working-class.

Young, working-class Americans are leaving the church, rejecting the superstitions and backward views of their parents and grandparents. They are becoming increasingly left-wing. The working-class is more militant and more left-leaning than ever before in American history. Bourgeois ideology is losing its power. Never before has the hold of religion been weaker - every other year some Charismatic preacher gets hit by scandal. Snake-oil salesmen like Joel Osteen and Creflo Dollar - which have made a fortune from combining apologia for neoliberalism with Christian teaching - the so-called ""prosperity gospel"" - are being shown up as frauds, conmen and scum.

So, that's my explanation for why America is still so backward in some aspects and yet so progressive and advanced in others. There is hope yet, though.",communism,Why is America the most advanced capitalist country yet also the most religious?
"Until I was 6 I grew up in a trailer and my mom was a single nurse. A lot of my family would work retail, at warehouses, construction, house painting, etc, all working-class jobs pretty much, but I've never felt compelled to be a communist just because of my personal experience. Many of my family and in-laws were racist, and especially in the case of my in-laws who were either unionzed labor aristocrats ([readsettlers.org](https://readsettlers.org)) or petty bourgeois. I think it made me understand it as a necessity, that labor is a power itself, and that individualism/atomization is a harmful phony idea.",communism,What's your class background?
,communism,"RIP Alexander Zakharchenko, the head of the Donetsk People's Republic who lead the fight against fascism in Ukraine"
"I'm looking for documentaries and videos preferably on YouTube about British imperialism past and presenot other resources on it. The only things I've found are filled with propaganda so I'm unsure what to watch.

Also, anything on Maoism and it's history and Russia would be cool

Sorry if this seems like a shitpost

Edit: also, I'm trying to get into reading so any decent books on the above topics and also the modern events that are skewed by Western reporting",communism,Struggling to find trusted documentaries
,communism,a Comment I wrote about the Chinese Question
,communism,#MeTooUrbanNaxal #ArundhatiRoy
,communism,Reddit bans non-Americans for posting legitimate news that makes American look bad.
,communism,"Happy birthday to the commander of the anti-Imperialist Hezbollah, Sayyid Hassan Nasrallah."
,communism,Marxist eBooks • r/marxistebooks
,communism,"Reddit just banned a few users on account of ""Iranian Interference"". Seems wired to me."
,communism,China's GDP growth versus carbon intensity - an astonishing achievement of socialist planning (from a Nature Geoscience paper)
"Just opened up this book which is an analysis of imperialism and how core capitalist countries no longer rely on military force and colonialism, even though they still do, but increasingly are able to extract profits from workers in the Global South through market mechanisms and by favoring places with lower wages through labor arbitrage.

I’m having a difficult time grasping it, there’s a lot of economic terms I’m not familiar with and a lot of data on each page which seems to be overwhelming at times.

Anyone have some helpful summaries or guides on this book that could help me get through it?",communism,Imperialism in the 21st Century by John Smith
"Hey hey hey 

So I was reading this book I picked up at the library published by an anonymous French communist group called The Invisible Committee, titled *Now*. In it, the authors advocate for activism in the form of “destitution” as opposed to “constitution.” In other words, creating our own means of production and refusing to participate in the system as opposed to seizing the existing means of production and setting up a workers’ state. It draws primarily from contemporary French examples of activism and protest, but I got the impression that it was trying to paint itself as applicable elsewhere. Has anyone come across this work or group before? What are your thoughts on destitution? ",communism,Question about destitution
,communism,Bromma Review of The Global Perspective
,communism,DN Update on 2018 Nationwide Prison Strike
,communism,The thoughts of Chairman Xi
,communism,A Terrible Normality by Michael Parenti
