selftext,subreddit,title
"I was tired of having to debate this on platforms that couldn't allow long messages, so I decided to make my essay here. There will be common arguments answered at the bottom. I know most communists are okay with punching Nazis, so this is aimed to new comrades and those who don't want violence in the streets.

Suddenly it occurs to me that this could be construed as inciting violence. I am not, I am only making the philosophical argument for not punishing such an act.

##Why it is not reprehensible to punch fascists

###What fascism really is

The purpose of this essay is not to explain fascism thoroughly, there are several good articles on the web already. What you need to know is that fascism promotes a certain social order that claims to put its people first, but only if they act as the State wants them to act (the social order is also traditionalist and based on false observations, but that's another topic). To that end, nothing is off limits to the fascists.

Everyone not behaving correctly can and will be killed. Understandably, this includes minorities. Racial minorities but also religions, sexual orientations, ill and disabled people are targeted too because, to the fascists, they cannot be part of the new social order. This is a very real component of fascism, because fascism is not democratic and does not care for personal freedoms. It is impossible to convince the masses to abandon their freedoms and democracy and give it all to a totalitarian dictator. However, if you blame minorities for the troubles of the country, it becomes increasingly easier to justify the need for someone to ""put things back in order"".

It would be also be impossible to convince non-fascists to outright kill minorities in the early stages of a fascist presence. People do not want to commit genocide just like that. This is why such minorities are first vilified and you'll sometimes hear fascists say that they should be deported, or, as tolerant as fascists can be, that they shouldn't be systematically persecuted (make no mistake, fascists will still individually persecute minorities even if the State does not). In truth, the end goal is always to get rid of undesirables. Mussolini did not believe Hitler's racial purity rhetoric because Northern Italians were white but Southern Italians were not (which highlights the artificiality of race), but that did not prevent him from persecuting Slovenes.

One is only tolerated by the so-called social order until they are no longer useful. During the night of the long knives, Hitler got rid of many fellow Nazis who helped secure his victory. George Strasser, a ""left-wing"" Nazi who helped organize strikes and unions, was killed then and there. Röhm, the leader of the SA, was also purged. He was homosexual, which was punished in the Third Reich, but the whole of the SA was purged alongside him. Therefore, even good fascists that fulfil their duty to the nation will be killed if they step out of line. Minorities have it worse in that their killing is systematic, i.e. not based on individual acts but simply on the act of existing.

Therefore, fascism is an abhorrent ideology that truly wants to kill people. It is impossible to play on words, it is impossible to say that things will be different ""this time"". Fascism requires this component of vilifying a common enemy, of calling back to a great time in the nation's history. If you talk to fascists, you'll see they all think very poorly of at least certain minorities, if not any person who doesn't look and think like them.

This is also why fascists are not a caricature. If you keep looking for the fascist that is a supremacist, racist against everyone else, and wants to kill all minorities that don't conform to his narrow view, you will never find him. What you will find however are fascists who call people degenerates for being homosexual or transgender, who want an ethnostate (a country with only people of one skin colour, which does not exist anywhere), and who want to deport minorities because they cause issues.

**We must stop seeing fascism as this narrow ideology that must absolutely conform to all of several criteria.** Anyone who has fascist tendencies is at risk of becoming fully fascist, and at risk of rallying actual fascists.

###Debating fascists is a waste of time

The alternative to outright being hostile (not necessarily violently) to fascists is debating them, publicly, and tearing down their arguments. Since the end of WW2, there have been no new arguments in favour of fascism. All of them have already been debunked. What exactly do you want to debate?

Fascists don't care about debating. Anyone who holds beliefs this strongly are not open to having their mind changed by a debate. Sartre said it himself in a famous quote:

&gt; Never believe that anti-Semites are completely unaware of the absurdity of their replies. They know that their remarks are frivolous, open to challenge. But they are amusing themselves, for it is their adversary who is obliged to use words responsibly, since he believes in words. The anti-Semites have the right to play. They even like to play with discourse for, by giving ridiculous reasons, they discredit the seriousness of their interlocutors. They delight in acting in bad faith, since they seek not to persuade by sound argument but to intimidate and disconcert. If you press them too closely, they will abruptly fall silent, loftily indicating by some phrase that the time for argument is past.

In essence, the fascist does not care about arguments. His ideology is not based in rational facts and logic, it is based on blind hate. You are wasting time, hours of your day, to make a point that everyone already knows is true. The burden of proof is not on the fascist, he will point in the general direction of a societal issue, say ""look at what's happening"" and that's his whole argument. You will have to collect statistics, you will have to read articles, you will have to be careful with your words. If you say a slur in your argumentation, even by mistake and even if the rest of your argument is solid, the fascist will jump on it and say that even you use slurs, therefore you shouldn't prevent them from using slurs either.

By debating their hatred, **minorities have to prove their humanity**. You cannot ask a minority to debate a fascist openly, for the fascist wants them to die. By debating fascists, you are giving them a public platform to spread their ideas and you are legitimizing their views. If you invite a fascist to a public debate, you are saying to him ""what you have to say is interesting, please tell us about it"". Whereas denying them their platform sends a clear message: you are not welcome here, renounce your views.

What good will be your arguments when the fascists take power? You will be the first purged because you are opposition. Would you go up to Hitler during his election speech and tell him he is wrong? It is already too late.

###Violence is not the first answer

The common argument for debating fascists is that we are in a civilized society and violence is brutish. We are better than savages and solve our issues by talking. This is a paradox, because fascists will strip away your civilised society. They want to kill people, therefore they are violent. They will destroy democracy and free speech, therefore they do not believe in it, yet they use it (Richard Spencer for one admitted to this). They may not be violent _now_, and they may not want to destroy democracy _now_, but it is in their aim -- as I argued in the first chapter.

With that said, violence should not be the first option one jumps to when confronting a fascist. Violence is a tool to tell them once and for all that their hatred is not tolerated in a civilised society. This violence exists to protect peace.

Do _you_ have to punch Nazis? No. You don't have to put yourself in danger either. But you should openly oppose fascism through all means that you are comfortable with. To ignore fascism (as a reporter urged people to do in Portland last Saturday, for example) is to give it the conditions to flourish. If no one shows up to counter their rallies and they all spend an afternoon in the park, it sends the message that fascism is allowed just like your picnics in the park are.

There exist limits to free speech everywhere and some ideas are not allowed. Some groups have to fight for recognition too, such as homosexuals who had to prove their humanity, to say gently, and still have to today. But homosexuals do not want to kill people for being heterosexual. They do not hate heterosexual couples on the basis of their sexual orientation. They do not want to outlaw heterosexual marriage and make a nation only for themselves.

Yet, fascism is not outlawed in public. Until it is, it falls into the hands of the people to do what the police will not do.

Does the possibility of abuse exists? Yes, but it exists everywhere. Courts often sentence innocent people to death all around the world. Disregarding current and historical events, my argument is that **violence should be reserved when all else fails, in self-defence, and only in a proportionate amount**. Debating, as we know, is already a failed strategy. Violence however does not mean to kill. It does not mean to gang up on a person on the ground (which fascists did not long ago, there is video evidence). It does not mean using a gun against fists. It means, literally, to be violent.

If we want to answer the question ""who should violence be reserved to?"", it is simply **for those who would, given the chance, kill another human being or make their life unbearable on the basis of their identity**. As was said in [The philosophy of Antifa](https://www.youtube.com/watch?v=bgwS_FMZ3nQ), if you are a fascist, you can renounce your beliefs and stop being a target. But if you are a minority, the target of fascists, you cannot renounce anything. You cannot stop being black, you cannot stop being Jewish. You will never be acceptable enough that they will leave you alone.

##Common counter-arguments

(all of which I have heard)

&gt; If you punch nazis, how long until you punch anyone you don't agree with?

Abuse can exist everywhere and it is not proven that this particular context attracts more abuse. Still, violence should only be used against those who want to kill people for their identity. Believe me, fascists would punch you personally if they had the impunity to do so.

&gt; This person only said that women should make babies and cook, does that mean I should punch them?

No. You should, if you are in a position to, take the chance to ridicule them for their regressive views and not just shrug and move on.

&gt; Antifa are the real fascists!

Fascism has a definition. Being violent is not being a fascist. In that case, all armies are fascist, even the soldiers who fought against fascism.

&gt;But people who punch fascists are hypocrites because they don't want to be punched back!

They know the risks. They understand that they may be punched or killed in return. Which is why you shouldn't start being violent if you are not comfortable with violence! We are okay with that.

&gt; All speech should be free, I disagree with limiting any form of speech.

Fascists want to remove free speech. One shouldn't be allowed to abuse free speech to promote the destruction of free speech.

&gt; Therefore, one shouldn't be able to use violence to promote the end of violence?

Self-defence is a right that must be upheld. In the strictest sense, one is allowed to be violent towards an imminent violent threat. In a broader sense, it is justified to be violent against people who would be violent against you or people you know. The response is proportional to the threat. Just like conspiring to murder is a crime, conspiring to persecute minorities should be dealt with.

&gt; Would you target a black/Jewish/etc fascist?

This one tries to show the hypocrisy of wanting to protect minorities while targeting minorities. Anyone who espouses fascist views should be stopped. Their skin colour, religion or other trait doesn't matter. There was an argument because a black member of TPUSA was targeted recently, with people saying that the anti-racist liberals are now targeting black people. Firstly, there are different groups on the left and not all of them defend minorities through and through. It doesn't make a difference what the slave master looks like to the slave being abused.

&gt; In public rallies, they don't talk about white supremacy or anything like that.

They know nobody would take them seriously. They start by talking about the ""great displacement"", or how things were better when there were less immigrants, then people are more ready to listen. Hitler didn't start by saying ""we should kill people for the glory of Germany"". It was a gradual shift of public perception that started at ostracising and segregating minorities.

Additionally, there is evidence that many of those protesters have fascist ties, such as swastika tattoos or later being identified to their social media accounts and finding supremacist messages.

&gt; Fascists have no power, they only have small numbers, what's the big deal?

Vote for them then, if they're not dangerous. If left unchecked, they will grow bolder and eventually you will have no choice on the ballot but to vote for one. Should we start organizing resistance only then?

&gt; Communists want to kill people too, you're not any better

We want to kill the concept of the bourgeoisie. Individuals are not targeted by communists (but individuals are targeted by racially-motivated murderers today). It is not in our ideology to get rid of people (through death, deportation, whatever), but we understand that the bourgeoisie will never willingly surrender their assets. Those who accept our demands will be left alone. As I wrote at the end of the essay, you will never be white enough for the supremacist. You will never be Christian enough. If you agreed to renounce your Slovene citizenship and become Italian, you would never be Italian enough. You would still be ""tainted"" by being Slovene. But if you are bourgeois, or the target of communists, you can accept to surrender everything and join the proletariat in the new society. This is what separates us from fascists.",communism,Why it is not reprehensible to punch fascists
,communism,Practical Notes Concerning Service Workers: Productive and Unproductive Labor
"I've been flipping through some old English-language primary sources and was surprised to find that, once upon a time, it seemed at least somewhat commonplace for Lenin to be referred to by the name ""Nicolai Lenine"" (with a number of spelling variations such as ""Nikolai"", ""Lemine"", etc.). This convention seems to date only up to the end of the 1920s. Some examples:

https://cdnc.ucr.edu/cgi-bin/cdnc?a=d&amp;d=SU19210614.2.106

https://www.loc.gov/item/88183351/

https://books.google.com/books?id=Frc0AQAAMAAJ&amp;pg=RA3-PA14&amp;lpg=RA3-PA14&amp;dq=nicolai+lenine&amp;source=bl&amp;ots=U0MXr_YDqV&amp;sig=Yx-tqMF0hi7M-iXxzNZiQG1x2pk&amp;hl=en&amp;sa=X&amp;ved=2ahUKEwiYkPm5guHcAhWE7FMKHWUNAvAQ6AEwDHoECAMQAQ#v=onepage&amp;q=nicolai%20lenine&amp;f=false

Does anyone know why he was referred to by this name, and why/when the more familiar ""Vladimir Lenin"" became widely adopted?",communism,"Why was Lenin once known in English sources as ""Nicolai Lenine""?"
,communism,"ARGENTINA: 38 Senators Ignore Mass Mobilizations, Vote to Maintain Unsafe and Illegal Abortions"
"Preferably a book, but films/docs/online sources are good too. Ideally something covers from at least the early 20th century till at least the 70s. ",communism,"Good, Marxist history that covers the entire Chinese revolution?"
,communism,Excellent Russian Book that goes into Detail of the Soviet Economy under Stalin
Why or why not?,communism,Do you think the borgeoise should have the chance to peacefully surrender their assets and comply with the government instead of immediately being arrested?
"Does anyone know anything about this party? Any members in here?

https://partyofcommunistsusa.org/",communism,Party of Communists USA
,communism,THE USSR. How the Soviet economy was organized
,communism,Lenin On The Hatred Of The Bourgeoisie
"I’ve always leant very much to the left in my politics and I’m looking to learn more about communism. I’d like to learn more about the history but also the modern day side of things 

If anybody could recommend a few documentary’s for me that would be great. Books too although I don’t have much time to read these days as I spend most of the time being a slave to my employers",communism,Documentary recommendations?
,communism,Thoughts on CPUSA?
,communism,Any good books out there written by or about women soviet soldiers?
,communism,"Anyone know any good histories of the Iranian Left? I'm interested in the various pro-Soviet, Maoist and Guevarist elements etc."
,communism,"Book review of ""China's Global Strategy - Towards a Multipolar World"" by Jenny Clegg"
