selftext,subreddit,title
"Hi everyone!

I just finished rereading the communist manifesto, and I'm currently getting stuck into some essays about historical materialism, and it's given me some questions about feudalism.

I understand that capitalism is the gradual refinement of relations of production into classes which either own or operate the means of production, the bourgeoisie and proletariat, and that this was facilitated by bourgeois revolutions against the previous ruling classes like the aristocracy.

But, understandably, Marx and others tend to focus on capitalism, so the extent of my knowledge about feudalism is pretty much just that it's what came before that.

My questions are:

What relations of production characterise feudalism, for Marx?

What social classes are important in feudal society?

What preceded feudalism, and how did feudalism emerge?

Thanks for your help!",communism,Materialist views on feudalism
,communism,"Do Not be Distracted by Rising Imperialists, the U.$. is Still the Enemy!"
,communism,"PragerU: ""A Nation of Immigrants"" RESPONSE"
"Hey everyone! 

Recently I’ve been trying to read Das Kapital to educate myself a bit more, but I’ve been having trouble getting through it thanks to my ADHD. I had the idea to search for audiobooks to help with it, and I found a free resource. I just wanted to post it here in case any comrades wanted to listen as well.

[Audiobooks here.](https://www.marxists.org/audiobooks/archive/marx-engels/capital-vol1/index.htm)",communism,Audiobooks for fellow comrades with ADHD or similar conditions
,communism,What current practices of the PRC uphold its socialist origins?
,communism,Major prison strike spreads across US and Canada as inmates refuse food
"So, I've been a socialist for quite some time and I've switched schools of thought quite a number of times. I've been a Marxist for a few months and while I believe we should strive for the idea of communism through revolutionary means, I've been having issues with the way a lot of the community follows every doctrine to a T, even outside of their political life. For instance, many people object to practicing spirituality because it ""conflicts with dialectical materialism"". This is fine, but I've found this mentality to be common to a fault. I often find myself leaning towards MLM due to its resistance against such mentalities, but at the same time, there seems to be an element of ""worshiping"" dialectical materialism and the concept of the party. Anyone else encounter this or feel this way?",communism,Issues with dogmatism within Marxism
,communism,"On this day in 2008, the US massacred 90 Afghan civilians (mostly women &amp; children) gathering for a memorial service in the village of Azizabad. The US conducted continued air strikes on the village for 3 full hours; killing 60 children as they slept in their homes. Then lied about it."
"Hello Comrades, my friend asked me about this event. I said ""i don't know"" and started looking for sources. Only sources i found are from  bourgeois media. Could you tell me some Marxist critique or history narrative about this event?",communism,Novocherkassk Event/Massacre/Uprising Question
,communism,BSA endorses Bernie in the weirdest way
,communism,A Documentary on the Life of Leon Trotsky
,communism,Inside America's Meddling Machine: The US Funded Group that Interferes in Elections Around the Globe
,communism,Prison labor is modern slavery. I've been sent to solitary for speaking out | Kevin Rashid Johnson
,communism,An urgent appeal to raise funds for Ramona Africa’s health care-Workers World.
,communism,Washington Post editorial calls for revival of CIA funding for art and artists like during the Cold War
,communism,US Sanctions Shut Down ‘The Empire Files’ with Abby Martin
"I just picked up a book called, ""Children of Mao - Personality development and political activism in the Red Guard Generation"" and I was wondering if any of you have heard of it, and what you think about it",communism,Questions about a book
,communism,"Communists need not apply. ""When Dr. Bill Ellenberg applied for a position teaching English at the school, he discovered that, in addition to being well-versed in literature and composition, he also needed to be a confirmed non-communist."""
,communism,Was Nazism Socialism? (TheFinnishBolshevik Response to TIK)
,communism,"Study shows diminished but ‘robust’ link between union decline and rise of inequality, based on individual workers over the period 1973-2015, using data from the country’s longest-running longitudinal survey on household income."
,communism,Boots Riley Shout Out To The 2018 Prison Strike!
,communism,"Picture: James Connolly addressing 8000 people at Union Square, Manhattan, New York City on May Day, 1908."
,communism,"KKE slams Tsipras over his celebrations for the supposed ""end of austerity"""
,communism,What should feminists say about the Ronell case?
,communism,"On this day in 1998, Bill Clinton committed a major act of terrorism by ordering a cruise missile attack on Sudan’s Al Shifa factory, which produced 90% of the country’s pharmaceuticals. The factory's destruction resulted in the deaths of tens of thousands from treatable diseases"
,communism,Theses on Bourgeois Democracy and the Dictatorship of the Proletariat
"Здравствуйте товарищи,

I’m looking for a few good books on the history of the USSR that are not from a capitalist perspective and I’m not really sure where to start. ",communism,Good books on the history of the USSR?
,communism,"The classic story that left-wing &amp; anti-war forces spit on Vietnam veterans &amp; called them ""baby killers"" is a myth, created AFTER the war by the Pentagon to make service members feel alienated from the movement."
,communism,AJ Picks up #PrisonStrike
,communism,"Fidel Castro Plaza is being built in the central Vietnamese province of Quang Tri, one of the ones visited by the historical leader of the Cuban Revolution when he was in 1973 in this Southeast Asian country"
,communism,NATIONWIDE PRISON STRIKE BEGINS
"i heard about this book a couple years ago, long before i was ever a marxist, and eventually i saw the movie adaptation. i forgot about it for a couple years and then about a week ago i just randomly remembered about it. so i bought the book and i read it, and i was able to experience the story again as a marxist, and now that i have the  story really stands out much more. 

the book is about a man who was hit by a artillery shell in combat and he some how survived, but barely anything was left behind. Joe can no longer hear, see, taste, smell, talk, and on top of that he lost both his arms and legs. he basically just sits in a hospital bed and everyone around him thinks he is completely comatose. in reality Joe is conscious of everything, and the book just goes about him figuring out what had happened and where he is. 

the book was written by Dalton Trumbo in 1938 as an anti-war novel. the whole book is filled with a lot of things that Trumbo is trying to say, but as i kept reading i noticed his approached seemed kind of marxist. so i looked up more on Trumbo and turns out he was a member of the american communist party, and one of the ""hollywood ten"". Dalton wrote the book in the social realist or socialist realist style, or in other words he wrote the book to focus on the struggles and troubles of the working class. the very strong message that Dalton pushed throughout the whole book is that the ""little guys"" (proletariat) fight wars for the ""big guys"" (bourgeois), and the ""little guys"" are never connected to the war, they gain nothing out of it, yet they are the ones who die. at one point in the book he describes it as a slave ship, the workers slave away in the depths of the ship rowing never knowing where they are rowing too as the bourgeois sit above in the sunlight steering the rowers to their demise. the very last page of the book Dalton cried for the ""little guys"" to take the guns they were given and take the patriotic slogans and to turn on the actual threat, the ""big guys"". 

im curious, have any comrades read this book before or seen the movie? ",communism,have any of you read or watched Johnny Got His Gun?
,communism,South African Farmland Redistribution Has Begun
,communism,International Press on the Prison Strike!
" inspired by the heroism and patriotism of those who fought for a free, independent, sovereign, democratic and of social justice country, forged in the sacrifice of our predecessors;

for the aborigines who resisted submission;

for the slaves who rebelled against their masters;

for those who awakened the national conscience and the Cuban desire for homeland and freedom;

for the patriots who in 1868 initiated the wars of independence against Spanish colonialism and those who, in the last impulse of 1895, led them to the victory of 1898, which was taken away by the intervention and military occupation of Yankee imperialism;

for those who fought for over fifty years against imperialist domination, political corruption, lack of popular rights and freedoms, unemployment and exploitation imposed by capitalists and landlords;

for the members of the vanguard of the generation of the centenary of the birth of Martí, who nourished by his teaching led us to the popular revolutionary victory of January 1959;

for those who, with the sacrifice of their lives, defended the Revolution contributing to its definitive consolidation;

for those who massively fulfilled heroic internationalist missions;

for the epic resistance and unity of our people;

**guided** by the ideology and the example of Martí and Fidel, and the social-political ideas of Marx, Engels and Lenin;

**determined** to carry forward the triumphant Revolution of the Moncada and Granma, the Sierra and the Girón, which, supported by the closest unity of all the revolutionary forces and the people, conquered full national independence, established revolutionary power, carried out the democratic transformations and initiated the construction of socialism;

**aware** that, in the construction of socialism, the leadership of the Communist Party of Cuba, born of the unitary will of the organizations that contributed decisively to the triumph of the Revolution, and national unity, constitute fundamental pillars and guarantees of our political, economic and social order;

**identified** with the postulates exposed in the concept of Revolution, expressed by the Commander in Chief Fidel Castro Ruz the 1st. of May of the year 2000;

**we declare** our will that the law of the Republic be presided over by this deep yearning, finally achieved, of José Martí: ""I want the first law of our Republic to be the cult of Cubans to the full dignity of man"";

**we adopt** by our free vote, by referendum, the following Constitution.""

And that's the proposed preamble of the new Cuban Constitution. Brought me to tears, so I knew I had to share.",communism,"""WE, CUBAN PEOPLE"
,communism,The True Story of Che Guevara - Marxist revolutionary allied with Fidel Castro.
"How do you or your comrades who have social anxiety or who are autistic contribute? What sorts of party work do you/they engage in? 

What special considerations can neurotypical comrades make? 

What might you need in terms of support that you are not getting? 

What do you imagine your role would be when revolutionary struggle heats up?

I would like to limit this discussion to cadres with experience in organizations to whatever degree possible.",communism,Social anxiety and autism in revolutionary organizations
,communism,Kim Il Sung decorating Yasser Arafat.
,communism,"Anti-fascists outnumber, outlast and drown out Patriot Prayer, Proud Boys in Seattle"
,communism,China vows to end extreme poverty by 2020
,communism,Class Traitor culture.
,communism,"Over a 40 year period CEO pay has increased 1,070% while workers have experienced an 11% increase (adjusted for inflation). Eviscerating collective bargaining laws a significant contributor."
,communism,From the Romanian Market
,communism,"Boots Riley (Frontman of The Coup, writer/director of Sorry to Bother You) shares his thoughts on Spike Lee’s latest move BlacKkKlansman (spoilers)"
,communism,Huge collection of Chinese communist posters (from the 20s onwards)
"Aside from the obvious ones by Communists, such as Guerrilla Warfare by Chairman Mao and the one by Che that goes by the same name. ",communism,What military books/writings do you think every Communist should read?
"Since Greece just recently exited the assistance program, I was wondering what the true circumstances around it are.

Obviously, the problem stems from the existence of money, at least in the capitalist sense, but why did it occur to begin with? Does it have anything to do with the country's fascist regimes in the past acting as a burden?

How will this affect Greek fascist parties, as well as the leftist groups? Will it increase class consciousness, or will it drive people to blame it on the influx of Syrian refugees?",communism,What's the Communist Take On the Greek Bailout?
,communism,Erm Hold On BBC. Something You Aren’t Telling Us
"I have considered myself to be a ML for almost half a year now, and I think it’s time for me to organise. (The reason I haven’t yet is that I wanted myself to be sufficiently informed on socialism before joining a party). Anyway, I’ve been looking for some danish ML parties and I’ve gotten multiple results, so I would like to hear if any Danish comrades have any experience with any of the communist parties?",communism,A question for the Danish comrades
,communism,"""U.S. trade embargo has cost Cuba $130 billion, U.N. says"""
"It seems like such an obvious foil to the ""Muh Holomodor"" argument - a time when a natural disease affecting potato crops was exacerbated by English interference into a general famine in which 25% of Irish people either perished, or fled their homeland.  
English laws imposed on Ireland insisted the island remain a net *exporter* of food, even as people were starving in the streets! As one contemporary writer put it:

&gt;I have called it an artificial famine: that is to say, it was a famine which desolated a rich and fertile island that produced every year abundance and superabundance to sustain all her people and many more. The English, indeed, call the famine a ""dispensation of Providence""; and ascribe it entirely to the blight on potatoes. But potatoes failed in like manner all over Europe; yet there was no famine save in Ireland. The British account of the matter, then, is first, a fraud; second, a blasphemy. The Almighty, indeed, sent the potato blight, but the English created the famine.

^Thnx ^Wikipedia

There are very plausible charges that the potato disease was *deliberately capitalized upon* by England with the goal of depopulating the island, that English could more effectively exploit her colonial holding without the burden of having to deal with the locals.

It seems this incident bears striking resemblance to the accusations made of the Holomodor, yet when it's capitalist England doing the deliberate starvation thing, they get a pass. Why not bring it up more often?",communism,Why don't we talk more about the Great Irish Famine?
,communism,"Vox: National Prison Strike, Aug 2018"
,communism,The Publisher of Verso Books is Mad that Losurdo's book on Stalin is getting translated into English
"It's about [coal mining in West Virginia](https://youtu.be/sw97_9fKMiY).

I struggle to understand how these people can so happily resign themselves to dying for the corporations, how they can be such willing slaves.

They work for billionaires, they vote for billionaires, and they seem content to be exploited and worked to the bone every single day until they die.

I'm as infuriated by their acceptance of the status quo (and their abandoning of worker collectivization) as I am by the people exploiting them.

I don't even know where to start fixing this problem. The woman they interviewed in the middle of the documentary is far and away the only sane person in the entire video.

What could you even do to help people like this; who don't seem to want help?

(Also, fuck the people in that church for abusing animals.)",communism,I watched this infuriating documentary on YouTube.
,communism,Website Promised Free Anti-Antifa Shirts. Alt-Right Signed Up. It Was a Trap.
,communism,Report on armed resistance from Turkey/Kurdistan
,communism,"Start saving up comrades, you’re gonna want a copy of this (assuming you’re American)"
"Recently I learned about many posters similar to what we have with advertisements, except instead of promoting a product and trying to get your wallet, they promoted healthy lifestyles. They’d simply say things like “hey going to the library is pretty cool, books are important” 

I really loved looking at them, but it just depressed me even more about how malicious a lot of advertising is in a capitalist society. Imagine instead of constantly being coerced into a brand or product everywhere you looked, you’d be reminded how to genuinely love your best and healthy life ",communism,Soviet era “ads”
,communism,"'Black National Minorities, Working Class &amp; the RCG' (BRCL, 1985) - I'd love to hear fellow Brit's thoughts on this as I think it's an excellent and still relevant critique of the mainstream Left's failure to understand the nature of national oppression and liberation within Britain."
"I see comrades say libertarianism to fascism is such a big trend and almost a meme amongst communists. I don't understand why, could someone explain to me in a more nuanced way. Thanks. ",communism,What's up with libertarian to fascist route?
,communism,It’s sad that this happens.
,communism,CPI Leader Narayana Exclusive Full Interview || CPI Party Central Secret...
,communism,"Cuban, Korean Officials Discuss Brotherhood, Bilateral Bonds"
"Do they take a position on this matter, or is this too impractical an abstraction, considering current circumstances?",communism,Does the Chinese government believe in the withering away of the state?
,communism,26 year old dies from rationing insulin due to sky rocketed prices. This is the reality capitalists desire.
"Like 'A People's History' type thing or something? 

Hell, any good book on the period/subject you can recommend would be welcome, just looking for something subversive and looking more closely at class.",communism,Can anyone recommend some good marxist/leftwing looks at Ancient Greece/Ancient Greek History
,communism,Karl Marx ‘zero-euro’ bill becomes German souvenir hit with 100k sold
,communism,On the ongoing struggle against a rightist line in Serve the People
,communism,Does anyone here know of any good online communities for transgendered communist? I've found most on reddit are either full of liberals or anarchist.
,communism,Russia = Bad | White Man's Turban
I'm a Christian and a communist and I wonder how others explore religion while being communists.,communism,Are there any other religious communists here? How do you parse being both a believer and a communist?
"I have read a lot lately about the propaganda apps that the Communist Party of China has created and I wanted to ask if anyone knows about them. Is it possible to download these apps in Europe? Also, are they available for Android or iOS only?",communism,Communist Party of China apps
Is it different from communism? Are there any books to get a good primer on this?,communism,What is third worldism in a nutshell?
"Curious to see who everyone's favorite socialists are. 

I have a soft spot for Tito, not really my favorite though. If i had to pick I would probably say Lenin or Sankara, Lenin because of his contributions to socialist theory and his legitimate success in leading Russia through the civil war. Sankara because of his struggle against the French imperialists and just general greatness",communism,Favorite Revolutionaries
"Hiya, prob gonna be moving to Ireland for a few years in the near future, while I'm there I was thinking I might as well get organised in some fashion. So far the two organisations I've found that I like the sound of are the CPI and the Workers' Party. Just wondering if there's any major, glaring issues with either of these that I've missed. Thanks!

EDIT: I'm also now looking at the IRSP ",communism,Question for Irish comrades
,communism,Dandakaranya: 25 years of people's struggle
,communism,"Netanyahu: ""Hitler didn't want to exterminate the Jews"""
"I believe I understand how they are paid: using deductions from the total social product. How do we determine how much to deduct for this? Or more specifically, how have socialist countries determined what is a fair amount to take out for schools, doctors, etc.? In the Critique of the Gotha Programme, Marx says their pay would “grow in proportion as the new society develops”. But what does this mean practically? 

If you have any materials on how socialist countries determined how much to pay teachers, doctors, garbage collectors, and anything we today would consider a “public sector” job, I will be greatly appreciative!",communism,"How is the pay of teachers, health workers, etc., what we would consider today the public-sector, be determined in a socialist economy?"
,communism,Has Cuba Turned Capitalist?
,communism,The schoolboys on a field trip in Yemen were chatting and laughing. Then came the airstrike
"Is there a living wage in Cuba or do you have to actively work to acquire money? If there is a living wage is work incentivised with higher income?
",communism,Wages in Cuba
Anyone have any good recommendations for both modern political communist podcasts and ones more focused on history? I need some new listening material.,communism,good podcasts?
,communism,Post-modernism: A Romantic Petty-Bourgeois Exercise Dumping Rationality and Practice
,communism,a response by the Irish Marxist Leninist to TIK's recent video
,communism,"Israeli, Palestinian support for two states hits record low"
,communism,TeleSUR English Removed From Facebook for the Second Time
I’ve heard floating around that unions ‘force’ nonunion members to pay for political candidates who are usually democrat. I was wondering if this is true and what fellow comrades thoughts on the matter are.,communism,Unions and Politicians
"I'm based in Minnesota, and it isn't a view that would be very popular here, but after a lot of reading and soul searching, I've settled on identify as a communist, and wanting to advocate for communism.

I sense it is still very much frowned upon in the US (illegal?), but what are some steps I could take to advocate?",communism,I've recently realized communism makes the most sense to me. What more can I do?
"Clearly the US backed comprador government is failing. 

[https://www.rt.com/op-ed/435943-afghanistan-taliban-us-forces/](https://www.rt.com/op-ed/435943-afghanistan-taliban-us-forces/)

The Taliban seem committed to driving out all US forces. Are they a progressive force?",communism,What's going on in Afghanistan?
,communism,"Happy 92nd birthday, Fidel! Venceremos!"
,communism,Another one: Israel kills 22 years old volunteer medic Abdallah Qatati during Gaza protests
,communism,a good video about what is happening in cuba right now
,communism,It hurts my soul
,communism,"Two Koreas Plan Third Summit of Kim, Moon in September"
,communism,In 30 Russian cities people rise Soviet flags at the administration buildings. That action is reaction to recent pension reforms.
,communism,What is your view of Abdullah Öcalan and the PKK?
,communism,Mohammad Al-Houthi Holds US Responsible for Children School Bus Massacre
"I remember a couple months back reading about a new magazine called ""Forward! Popular theory"" which was published by Pravda, being interested and buying a subscription.
I got the first issue, but I haven't heard anything about them since, and now it seems like their twitter account and website are down or disabled? Does anyone know what happened to them?",communism,Forward magazine?
,communism,Here's the Video of Schoolchildren Just Moments Before Being Massacred by U.S.-Backed Saudi Bombing
,communism,"Rest peacefully and in power Samir Amin (1931-2018), an Egyptian Marxist economist who introduced the very term of Eurocentricism and who studied and wrote about Marxist economics for 50 years. We’ll miss you ♥️"
,communism,Nazis in the comments trying to spin the suicide of Richard Russel into a white genocide narrative
,communism,A group of communists are symbolically raising the soviet flag in a Krasny Yar village in Astrakhan region and declare the restoration of Soviet power in the district
"“I dissuade Party members from putting down people who do not understand. Even people who are unenlightened and seemingly bourgeois should be answered in a polite way. Things should be explained to them as fully as possible. I was turned off by a person who did not want to talk to me because I was not important enough. Maurice just wanted to preach to the converted, who already agreed with him. I try to be cordial, because that way you win people over. You cannot win them over by drawing the line of demarcation, saying you are on this side and I am on the other; that shows a lack of consciousness. After the Black Panther Party was formed, I nearly fell into this error. I could not understand why people were blind to what I saw so clearly. Then I realized that their understanding had to be developed.”
Huey P. Newton",communism,"Huey Newton of the BPP about engaging the masses, something that shouldn’t be limited to Black Leftists but how all Leftists should conduct ourselves towards the masses"
