selftext,subreddit,title
,democrats,"Fox News has had “Russia expert” Robert Driscoll on the air multiple times to provide analysis of the Mueller investigation and Russia-related issues, and never once did they mention that Driscoll is the attorney representing alleged Russian spy Maria Butina."
,democrats,Jerry Falwell Jr. says Sessions has lost evangelical support
,democrats,"Bruce Ohr Fought Russian Organized Crime. Now He’s a Target of Trump. --- In nearly three decades at the Justice Department, Mr. Ohr has made a career of supporting and facilitating important cases that targeted Russian organized crime. Now he is a target of President Trump."
,democrats,The Democratic Party’s Biggest Outside Group Is Launching an Ambitious Ballot Research Project
,democrats,Brett Kavanaugh threatens Supreme Court Legitimacy
,democrats,Federal Court Again Throws Out North Carolina’s Congressional Districts; New DIstricts *May* Have to Be Redrawn Before November 2018 Election
,democrats,"sam: ""hey i’m a member of mollie’s family and we are not so fucking small-minded that we generalize a whole population based on some bad individuals. now stop being a fucking snake and using my cousins death as political propaganda. take her name out of your mouth."" -- Candace Owens: ""Leftists..."""
,democrats,"Trump’s Contempt for the Law Will Be His Downfall: The president can keep crying “witch hunt,” but it won’t stop the evidence against him from mounting."
,democrats,The Shameful Black Pastors Who Sucked up to Trump
,democrats,Flag at White House Lowered to Half-Staff Again After Backlash
,democrats,Milwaukee pushes bid for 2020 Democratic Convention
,democrats,"Meanwhile, on Fox News... 😏"
,democrats,Hillary Clinton: People are mobilizing across the country today to #StopKavanaugh. Find an event near you
"Anyone else been converted by the Trump era from an R to a D? 

I personally was always somewhat moderate but I absolutely cannot remain a member of a party that does not hold this traitorous lying gasbag for a President accountable. ",democrats,Any ex-republicans?
,democrats,O’Rourke: Texas should lead the way on true criminal justice reform [Opinion]
"The subject of impeachment is one of, if not the, most debated issues for democrats heading into the midterms. For the purpose of argument, I'll assume the Democratic Party's primary goal is the removal of Trump from office as quickly as possible. 

The party leadership appears to have taken the position that I will define as strategic. They believe, based on Bill Clinton's experience, that a failed attempt at impeachment will backfire, prolonging Trump's term. Consequently, they are choosing to focus on convincing voters to vote for opponents of Trump which would both signal Trump's unpopularity and legitimate the threat of impeachment.

I believe a competing set of arguments exists which i will define as civic. This can be broadly summarized as the (correct) belief that Trump is a clear and present danger to the republic and congress should constrain the president in any manner necessary up to and including impeachment and reform and prosecuting and reforming political and bureaucratic institutions that knowingly behaved criminally during or leading to the Trump presidency. Those in the civic camp would argue that a congressional candidate that does recognize the existential threat of a Trump presidency and campaign on their desire to impeachment is neglecting their patriotic duty at the expense of partisanship.

I think we should try to find a compromise between these two groups that will get to impeachment fastest. I think voters want both strategists and civics. I think the democratic party and its candidates need to determine a way to identify themselves as pro-impeachment without undermining their positions through demonstrations of partisanship.

IMO politicians should work to convince their constituents that Trump is a clear and present threat to the republic from an objective basis. This should be treated like climate change. We have to work to prove incontrovertibly that Trump is currently doing irreparable damage to the United States and must be removed from office as soon as possible for the good of the country and the world.

What do you think is the best compromise between the strategists and the civics?",democrats,On Impeachment: Strategy vs Civics
,democrats,"(((Harry Enten))): ""I try to read every poll, and I have no clue where this is from. Can someone help me?"" -- Donald J. Trump: ""Over 90% approval rating for your all time favorite (I hope) President within the Republican Party and 52% overall. This despite all of the made up stories by the Fake..."""
,democrats,"Michigan Democrat leaders: Don’t bet on ‘blue wave,’ build it."
,democrats,McCain vs. Trump: a tale of two Americans
,democrats,Manafort Engaged In Unsuccessful Plea Talks With Mueller To Avert DC Trial
,democrats,White House flag at full-staff after SHORT McCain tribute
,democrats,Poll: Only a quarter of Democrats back push to abolish ICE
,democrats,Donald Trump's Worst Nightmare May Come In The Form Of Rep. Elijah Cummings
"**PragerU's video about Immigration is the worst, poorly researched and stereotypical right view on Immigration. So I thought, with sources and ACTUAL research the REAL FACTS about Immigration.**  

The United States cannot dis-allow immigration. With a poor education system, H1B and EB visa holders are essential for growth (1). Even with STEM (which is still failing), the soft-nationalist view that Immigration is just ""unneeded space."" They gave the number of Immigrants to the US, and implied that they are useless. But in reality, not only are they productive and better workers, they CREATE jobs for the American people. This is true amongst the tech sector especially: with the Silicon Valley practically created by Immigrants and the H1B visa (2). Infact, the US economy is SUFFERING from restrictions on visas (3)! And while Trump claims an ""economic victory"" because the economy has hit the highest points in history (which is true, but unstable and not because of Trump), he needs to learn that immigrants are actually NEEDED to keep America ""great"". 

&amp;#x200B;

""They turk er jobs!"" - South Park 

&amp;#x200B;

1:  [https://www.timesrecordnews.com/story/opinion/2018/01/02/immigration-reform-necessary-national-security/996099001/](https://www.timesrecordnews.com/story/opinion/2018/01/02/immigration-reform-necessary-national-security/996099001/) 

2:  r/http://kevinyshih.weebly.com/uploads/5/5/8/7/5587146/mopss_sep_27_2017.pdf 

3:  [https://blakesblog.com/2017/02/the-assured-cost-of-clamping-down-on-h-1b-genius-visas/](https://blakesblog.com/2017/02/the-assured-cost-of-clamping-down-on-h-1b-genius-visas/) 

&amp;#x200B;",democrats,My Thoughts on Immigration
,democrats,"Pompeo hasn’t been straight with us on North Korea: We’ve gotten zilch for our concession on military exercises and for elevating and flattering Kim. This is what happens when you flatter a narcissistic, ignorant president."
,democrats,"Just as President Trump was openly pondering the possibility of lifting sanctions against Russia, Microsoft revealed it has uncovered yet another Russian intelligence operation aimed at assaulting America's democratic institutions and, it appears, at helping Trump."
"Charles M. Blow has given us a fantastic Op-Ed in today's NYT called ""Opera of Demons"". 

By using very intelligent analogy Mr. Blow told us what we wanted to hear. 

He said what we're witnessing right now all over the American is nothing but a devilish opera staged by Trump and his leeches.

Charles also told us that ""Trump has created a series of odd bedfellows.""

With the same Op-Ed, the writer has given us an up to date account of the strange drama being played out in our court rooms where one after another of Trump's confidantes are jumping in the pit after taking Mr. Mueller's bait to implicate their co-conspirator in a high crimes and misdemeanor scenario.

Some ugly Americans on Trump's side like Rudy Giuliani is trying to con the entire country by saying ""Truth isn't truth.""  He doesn't know that we know better.

But there is one good thing to this opera where some of the con artists have decided to switch their designated roles and implicate their president Trump. 

Adding to Charles's description of the ""Opera of Demons', I like to add that only if Trump ever read the red colored Bible his mother gave him at age ten, he could gain an important knowledge from an early age of his life, that is ""Every sin brings its own consequences.""

Being born in a racist family and leading a totally corrupted lifestyle in an opulent atmosphere, Trump bred into corruption himself.

A thoroughly racist Trump grew up in a house where his father Fred was always putting his own prejudiced views in his young son's head by always saying to a young Donald, ""Never show any compassion for the downtrodden"" which in Fred Trump's world meant only the minorities in general, Black folks in particular.

So here we've a man, who had said right after his inauguration,""I want to be the president of all the Americans"", is deliberately running the most divisive administration ever.

And as each day brings a new revelation, our 'illegitimate' president is trying to tell more BS to the rest of the American people who've already seen ample examples of what 'hogwash' really means.

We Americans on the left knew right away on hot day in June 2015 about what type of candidate this proclaimed 'birther' would be. 

But the rest of America didn't realize then what type of Mafia boss their future president would be. 

With the upcoming depositions by three of his 'confidants' Trump is going to taste what many mafia bosses like ""The Teflon Don"" John Gotti Jr, found out when his underboss Salvatore ""Sammy the Bull"" Gravano turned into a turncoat himself to implicate his boss in 1991 in New York. 

Trump better watch out since he is like one of those mob bosses with lots of underbosses like Michael Cohen et Al who grew up in the same neighborhood near Queens, New York where John Gotti Jr and Sammy the Bull grew up.

But what's so amazing is that as per the latest poll, 65% of the Americans are saying Trump is not an honest man. 

On the contrary only a few Republicans are saying otherwise.

So in this 'Opera of Demons', only one man can save America from a criminal president. And his name is Robert S. Mueller.",democrats,"Maybe the spirit of John McCain will free 'We the People' from a devil called Trump. Hope the better Angels will shine a light against this ""Opera of Demons"" that Trump and his leeches are playing right now in our courtrooms."
,democrats,The Republican Party is truly rotten if Rep. Duncan Hunter wins reelection
,democrats,Hillary Clinton Plugs Anti-Kavanaugh Rallies
,democrats,Leaked Republican spreadsheet proves GOP is expecting a bloodbath in November -- and the White House isn't prepared
,democrats,"Gillibrand blames do-nothing Congress for mass shootings, other woes"
,democrats,GOP circulating spreadsheet ahead of midterms listing potential Dem probes
,democrats,"John Kerry on Twitter: ""My statement on the passing of Senator John McCain:"""
,democrats,Data shows Democrats must call out Republican politicians’ race-baiting to win voters of all races
,democrats,"Joe Biden on Twitter: ""John McCain was many things – a proud graduate of the Naval Academy, a Senate colleague, a political opponent. But, to me, more than anything, John was a friend. He will be missed dearly."""
,democrats,People Across the Country United to Protest Brett Kavanaugh
,democrats,Democrats Could Sue to Force Special Election for John McCain’s Seat
"In ""John McCain, a scarred but Happy Warrior"", the editors of NYT has given a very glowing picture of a man who was a 'war hero' first.
 
Next John McCain was a terrific statesman who won many of our hearts on the left by voting against gutting the Obamacare and replacing with a terrible 'Trumpcare' bill infuriating Trump and his own Republican stalwarts.

So now since he died after battling a long and protracted brain cancer at age 81, we find something that never happened in the history of this great country. A sitting president is not invited to attend the funeral of 'the Maverick' of a man called Senator John McCain.

Why ?

Only because of Trump's loud and ugly mouth which denounced the heroics of a war hero by saying "" I don't care for soldiers who're captured. Period !""

With that very stupid and unpatriotic statement Trump might've secured his nomination through the votes of his equally moronic supporters but he lost a huge battle in the hearts of majority of the Americans like us who still consider John McCain as one of our most respected and true war heroes.

Although it is true that a young 25 year old John McCain's plane got shot down over the river in Vietnam with the artillery battery provided by Russia but what separates Senator McCain from millions of American war heroes is his refusal to walk out of those torturous Vietcong prisons run by nothing but total barbarians and nomads.

Yes, it was his refusal to leave his fellow U.S. prisoners behind that scarred his body and soul for almost 60 years from inhuman physical tortures inflicted upon him by those Devil's followers. 

We also know that he was tortured more for his refusal to leave that hellhole early because those guerrilla soldiers thought they couldn't get their comrades back because of him.

We all heard the story that captured Vietcong soldiers in our care were supposed to be released by the U.S. military in exchange for McCain's release from the jungle tent of Vietnam where all our great soldiers were kept. 

We should also never forget that in those jungle prisons where Senator McCain was kept, our other great POWs were whipped and slashed while in captivity. And not to forget that their body parts were sliced open like cattle.

There are recorded evidence that those animal like Vietcong guerrillas did the same thing to U.S. soldier prisoners what they did to their bullocks and pigs. Those barbarians used to chop those animals alive for their meals.

So for Trump to dehumanize a man who gave a major part of his life for America, is totally inhuman.

As we all know Senator McCain, he'll pardon Trump from heaven but we as true Americans shouldn't.",democrats,"Trump should say sorry to Senator McCain's soul for dehumanizing our war hero while he was alive. It's quite fitting that the ""Maverick""'s family didn't invite Trump to attend his funeral in the Capitol and his burial at Arlington cemetery."
,democrats,Hillary Clinton: McCain leaves 'a legacy of service and courage'
,democrats,"Barack Obama on Twitter: ""Our statement on the passing of Senator John McCain:"""
,democrats,"Russian state media touts the secret hotline between the White House and Moscow: Russian state media released news articles, reporting that President Trump’s residence at the White House has a direct hotline to Moscow, utilizing exclusively Russian-made encryption equipment."
,democrats,Trump rejected plans for a White House statement praising McCain
,democrats,"John McCain was an American hero, a man of decency and honor and a friend of mine. He will be missed not just in the U.S. Senate but by all Americans who respect integrity and independence. Jane and I send our deepest condolences to his family. -Bernie Sanders"
"Not sure if this is a right sub for but this chant originated in my head early last week and I haven't been able to get it out. I'm hoping by sharing it here I can get it out of my head and share it with some like-minded redditors.

The win and Republican or supposed to rhyme but it may be a regional accent because I pronounce Republican like ""Re-pub-lick-in""",democrats,"Don't let the Russians win, Don't vote Republican"
,democrats,"Editorial: EPA is no longer protecting environment, our health"
,democrats,Zephyr Teachout for attorney general: A standout in the Democratic field
,democrats,O'Rourke holds moment of silence after McCain's death
,democrats,"Impeach Trump: why Republicans, not Democrats are talking up the prospect | By one count the president has nine impeachable offenses to his name but the politics of removing him from office are complicated"
,democrats,"Beto O'Rourke says ""nothing more American"" than to stand up or take a knee for your rights"
,democrats,Schumer wants Senate building named for McCain.
,democrats,"Criminals don’t follow laws anyways, so what’s the point?"
,democrats,"Vicente Fox Quesada on Twitter: ""Where do I chip in? Those walls are vetting higher and thicker."" -- Andy Kindler on Twitter: """""
,democrats,Schiff: Senators' signals on replacing Sessions 'not something' John McCain would ever say
,democrats,"This Day in Trump History: Remember the letter from Trump's personal doctor? Which said Trump's ""laboratory test results were astonishingly excellent""? The doctor later said Trump hovered nearby when he wrote it -- then finally admitted Trump dictated it. Literally no scam is too small for Trump."
,democrats,Brazile: GOP talking about impeachment more than Dems
,democrats,"Trump has spent 150 days, or 25 percent, of his presidency at Trump golf courses"
,democrats,"‘Negativity and nastiness’: Dems fret over rowdy Arizona House primary [AZ-2, Tuscon]"
,democrats,Scoop: Republicans secretly study their coming hell
,democrats,Trump is Making the Confederacy Great Again: How Donald Trump Transformed the Party of Lincoln into the Party of the Confederacy.
,democrats,"Sen. John McCain, American 'maverick' and Arizona political giant, dies at age 81"
,democrats,What Will Mueller Do? The Answer Might Lie in a By-the-Book Past
,democrats,"Melania’s Dad, a New American Citizen with a Record in Yugoslavia’s Secret Police Files: At a time when people are being denied U.S. citizenship because of their pasts, the case of Viktor Knavs—and his record in Yugoslavia’s secret police files—is an interesting one."
,democrats,Arizona GOP Senate candidate Kelli Ward accuses John McCain of dying to push 'negative narrative' about her
,democrats,Dan Rather: What Robert Mueller Knows About Manafort and Cohen Will Make This Week 'Pale In Comparison' -- “Look at how many people have either pled guilty or in Manafort’s case been found guilty.”
,democrats,"Rick Wilson on Twitter: ""If you were looking for the goddamn abyss of Trumpian depravity, go read the comments on the Breitbart article about McCain ending his cancer treatment. The garbage that run that site lack a shred of decency and those commenters are human filth."""
"I’m a high schooler and I want to read about various political and economic ideologies. I’ve already found books on capitalism, socialism, communism, libertarianism, and conservatism. For some reason though, whenever I try to find books on liberalism it’s just conservatives criticizing it. Can you guys recommend essentially an introduction to liberalism? Any help would be appreciated.",democrats,Any books on liberalism/progressivism?
,democrats,"Robert Mueller Might Have 'Quite Ugly' Information on Donald Trump's Unreleased Tax Returns, Bush's Ethics Lawyer Says"
,democrats,Republican candidate accused of fraudulently helping an independent candidate gather signatures in hopes of splitting Democrat votes
,democrats,"Trump managed to botch a photo-op with Ohio kids by coloring his American flag wrong: Unlike the flag of the Russian Federation, there are no blue stripes in the American flag."
,democrats,The Full-Spectrum Corruption of Donald Trump: Everyone and everything he touches rots. A party that once spoke with urgency and apparent conviction about the importance of ethical leadership has hitched its wagon to the most thoroughly and comprehensively corrupt individual ever elected president.
,democrats,"Hillary Clinton: .@SenJohnMcCain lived a life of service to his country, from his heroism in the Navy to 35 years in Congress. He was a tough politician, a trusted colleague, and there will simply never be another like him. My thoughts and prayers are with Cindy and his entire family."
,democrats,John McCain Dead at 81
,democrats,Here Are The 52 Trump Investigations That Democrats Plan If They Win The Midterms
,democrats,"Jon Cooper 🌊 on Twitter: ""BREAKING: A total of five GOP sources have now confirmed to @TheDemCoalition that GOP Reps Nunes and Rohrabacher are both under federal investigation. GOP staffers have been instructed to stay away from them. Listen to @Funder’s #DworkinReport on it below."""
,democrats,"Daniel Dale: ""A casual quote in a story describing a Trump supporter who says he supports Trump because he's keeping America safe... """"I think this is precisely the issue in many stories about Trump voters - the focus is often on economic struggles and other self-professed reasons for supporting..."""
,democrats,How the New York attorney general can take down the president
,democrats,Democrats Strip Superdelegates Of Power In Historic Reform Vote.
,democrats,"Football Players Are Protesting Police Violence, Not the Anthem: There are consequences to mischaracterizing the reason players aren’t standing. Most of those players are black men. They have lived with the reality of police brutality their whole lives."
,democrats,"In 'historic' move, Democrats strip superdelegates of power"
,democrats,Growing list of Democrats call to delay Kavanaugh hearings
,democrats,Michael Cohen May Be More of a Threat to Trump Than Manafort
,democrats,How to take part in 'Unite for Justice' protests and #StopKavanaugh
,democrats,"Rudy Giuliani on Twitter: ""Just a few days before 60 day run-up to 2018 elections. If Mueller wants to show he’s not partisan, then issue a report on collusion and obstruction. They will show President Trump did nothing wrong. Then we will have to admit you were fair. And we will."""
,democrats,Democrats strip superdelegates of power in picking presidential nominee
,democrats,RIP McCain
,democrats,The President Appears to Have Colored His American Flag Wrong
,democrats,"Jeet Heer on Twitter: ""I'm enjoying the new Republican meme that Al Capone got a raw deal"" -- Media Matters on Twitter: ""Dana Loesch: Democrats are “trying to Al Capone the president”"""
,democrats,"How's that swamp draining going? -- During his run for the presidency, Trump vowed again and again to ""drain the swamp"" and rid our government of corruption, waste, and insider-dealing. Trump is not the man to clean up Washington. He's too much of a mess himself."
,democrats,Beto O'Rourke's remarks on John McCain
,democrats,The three illegal acts that may have helped Trump win the presidency: The hush money. The hackers. The trolls.
,democrats,"Why Democrats want to talk about policy issues: Pelosi is right that Democrats are talking about what voters care about most — health care and the economy. Moreover, Democrats are on the right side of the issues as far as voters are concerned."
,democrats,Houston makes big play for 2020 Democratic convention
,democrats,DNC adopts gender nonbinary language
,democrats,Republicans who opposed pre-existing condition protections backtrack as midterms near: GOP senators say their new bill protects people with pre-existing conditions. It doesn’t.
,democrats,'Owned by the Russian mob': Trump biographer explains how the president's first 'fixer' Roy Cohn set him up with the mafia
,democrats,"Josh Dawsey on Twitter: ""Trump has told White House aides he does not regret saying McCain is not a war hero. He tells advisers that McCain has a vendetta against him and that he wishes he’d step down. He doesn’t plan to say a laudatory word about the ailing senator."""
,democrats,Why Conservatives Can't Ignore Successful European Social Democracies
,democrats,Double standards
,democrats,"After a rough week, Trump fumes about Cohen, Mueller, and Sessions on Twitter"
,democrats,Election handicapper moves 10 races toward Dems
,democrats,Is Donald Trump above the law?
,democrats,CBS News Changes Headline for Report on Beto O’Rourke Defending Protesting NFL Players After Criticism
,democrats,TPUSA Members Quit in Protest of ‘Exploiting’ Mollie Tibbetts’ Death: Iowans in the right-wing campus org resigned after accusing Candace Owens and Charlie Kirk of seeking to ‘exploit’ a student’s murder to suit an anti-immigrant ‘political agenda.
,democrats,Arizona Senator John McCain has passed away at the age of 81
,democrats,R.I.P. McCain
,democrats,Indicted Republican congressman bravely threw his wife under the bus on national television
,democrats,Spiro Agnew Lawyer: Trump Must Resign ‘If He Has Any Interest’ In Saving Family from Mueller
,democrats,The Greatest Disappointment of the Trump Presidency: The institutional fabric of the United States has proven more tenacious and resilient in responding than many feared. The Republican Congress has not.
,democrats,Fox News' Neil Cavuto Shreds Donald Trump: 'The Problem Is You'
,democrats,Could Stormy Daniels and Karen McDougal Have Cost Trump the 2016 Election? Only .03 percent of the electorate needed to be persuaded.
,democrats,Iowa murder suspect lived on land owned by GOP fundraiser: A top Republican fundraiser whose firm works for several prominent immigration hardliners is the partial owner of the land where the Mexican man accused of killing Iowa college student Mollie Tibbetts lived rent-free.
