selftext,subreddit,title
"Obviously this is deeply concerning, as this is a judge who will potentially preside over decisions regarding our corrupt president. Trump is on the record saying he would only select judges who will dismantle Roe V Wade. Kavanaugh is also on the record saying he does not believe a sitting president can not be indicted. Kavanaughs stance on that alone, should be enough to put a stop to his confirmation because it’s then a conflict of interest when a decision regarding Trumps obstruction of justice ends up in front of the Supreme Court. We know this prick wouldn’t recuse himself. All these issues aside, why is the party of law and order not releasing a few hundred thousand documents relevant to his confirmation hearings? It’s ludicrous. 

It also seems like Collins and Murkowski are trying to get themselves to a ‘yes’ vote. What the actual fuck is going on with this? Its like even the ones who aren’t in the Trump ass kissing inner circle are still complicit in this charade. 

Crazy to me how Merrick Garland gets snubbed because of McConnell and now the Criminal in Chief is about to get his 2nd pick confirmed.  Terrifying that these are lifetime appointments and both these guys are only 50. ",democrats,What are the odds of Kavanaugh getting confirmed?
,democrats,Dem senator: Confidential documents would 'strongly bolster' argument against Kavanaugh's nomination
,democrats,President Trump's Description of What's 'Fake' Is Expanding
,democrats,"Tom Nichols: ""This, the corrupting influence of Trump into every corner of the party, is why the party has to be voted against root and branch, and sent into the wilderness for now."" -- Max Boot: ""Graham took a seat on the couch of “Fox &amp; Friends,” President Trump’s favorite show, and sealed his..."""
,democrats,"Matthew Dowd: ""“Today is only one day in all the days that will ever be. But what will happen in all the other days that ever come can depend on what you do today,” President Obama said, quoting Ernest Hemingway’s For Whom the Bell Tolls, John McCain’s favorite book. Let us live this day fully"""
,democrats,"Trump ally furious over treatment of Ivanka and Jared at McCain memorial: “I find it contemptible that the McCain family couldn’t seat them in a better, more respectable section.”"
,democrats,Former McCain aides praise memorial service as 'America's rebuke' to the 'meanness and cruelty' of Trump
,democrats,"How Omarosa secretly taped her victims: Omarosa taped nearly every conversation she had while working in the White House, including ones with ""all of the Trumps."" Omarosa did this with a personal phone, almost always on record mode."
,democrats,"From Criminal Convictions to Ethical Lapses: The Range of Misconduct in Trump’s Orbit -- Since President Trump’s inauguration, numerous campaign and administration officials have been convicted of or pleaded guilty to crimes. Others violated federal ethics rules."
,democrats,Are Trump supporters evil or just wrong?
,democrats,"What could possibly go wrong when Trump goes to Texas? -- Trump’s presence might give local media the excuse to run all those clips of Trump calling Cruz “Lyin’ Ted,” or of Cruz calling Trump a “pathological liar.”"
,democrats,Remember when Trump was going to make American infrastructure great again?
,democrats,"Stormy Daniels on Twitter: ""Finally an award show that sheds light on sexist assholes in politics! See you in October, NYC!! #TEAMSTORMY #GoldenProbes2018"""
,democrats,Kris Kobach will now have to campaign while under investigation by a grand jury
,democrats,"Government Inaction Puts World on Track for 'Catastrophic' Climate Change, U.N. Warns"
,democrats,Prisoners Strike against Major Injustices In American Judicial System
,democrats,GOP Lawmaker Tweets Out Reporter’s Number After Questioning on Membership in Racist Facebook Group: AP reporter Ryan Foley emailed Iowa Rep. Rod Blum‘s press aide asking about the Congressman’s involvement in the “Tea Party” Facebook group that regularly posts racist posts.
,democrats,Dems vow rules overhaul to empower members if House flips
,democrats,"Donald Trump Played Golf During John McCain's Funeral: As of August 25, the president had spent more than a quarter of his presidency at one of his own golf courses."
,democrats,Hallquist sees fundraising boon after clinching nomination
,democrats,"Texas Democrats question why GOP congressman spent $50K in campaign funds on books, collectibles and Civil War memorabilia: Texas Democrats are demanding an investigation into Republican Rep. John Culberson."
"In an Op-Ed in today's NYT ""Straining to Keep Faith with America"" Bret Stephens has trashed Trump in no uncertain terms by adding this in his piece ""John McCain knew that we are better than Trump.""

To that I like to add my own thoughts saying that maybe, I emphasize the word ""maybe"" again to say that maybe a healthy Senator McCain could put a stop to a marauding president called Trump. 

But with the Republican Senator John McCain's death, there is nothing that can stop Trump from destroying each and every American values that this country developed over two centuries plus more.

Even a Republican president Ronald Reagan's description of America was much different from Trump's vision.

By quoting a phrase from Jesus's Sermon on the Mount, Reagan declared that our country is like ""a shining city on a hill"".

But since Trump took over the presidency, every Americans are ""straining to keep Faith with America"", the country they love dearly unlike Trump and his followers who only think of what they can get. 

Even Democratic president John Kennedy's words on his inauguration on January 20th, 1961, ""Ask not what your country can do for you_ask what can do for your country"", have no sway over the minds of these fake ""swamp cleaners"" like Trump. 

Trump is more interested in finding how much money he can milk from his presidency than giving some of his assets to the countrymen who were really struggling everyday to keep their faith on America.

Their struggles to keep faith on our institutions are four hundred times more now than before Trump took office on Jan 20th, '17.

That is the reason why we've to feel sorry for John McCain's permanent absence from an institution, mainly the Senate where he grilled each and every Trump's appointees and his cabinet members to hit hard at Trump's illogical policies.

Trump on the other hand didn't have the decency to go to McCain before his death or to his wife and families now to apologize saying, ""I should've never said that I don't care for people like you who got captured at war. As you know I didn't go to Vietnam for my bad foot. But I really appreciate your pains and sufferings due to terrible tortures at the hands of the Vietcong guerrillas. I'm really sorry that you endured those tortures for five plus years just to keep our country safe. May God bless your soul.""

Am I really dreaming that Trump would say those kind words and apologize to John McCain or his wife Cindy or his children or to all our POWs ?  Not in a million years ! No way .",democrats,"Today on Senator McCain's funeral,only one living president is not invited : Donald Trump. Till this day he didn't apologize to McCain's family or the POWs for trashing all those members in uniform who were captured and tortured by our enemies."
,democrats,"Daniel Dale on Twitter: ""Trump at a campaign fundraiser: ""China is ripping us off. Japan's ripping us off. Mexico's ripping us off. Canada's ripping us off. The whole world is ripping us off. There's nobody that's not ripping us off."""""
,democrats,"Sahil Kapur on Twitter: ""The president estimates that the 2019 federal employee pay raise he's scrapping would've cost $25 billion. For context, his tax law is projected by CBO to cost the Treasury an average of $190 billion each year for the next decade."""
,democrats,"Trump: Well Over Half of Women Want President to Be Impeached, Says Poll"
,democrats,"Republicans give millions to the rich while shortchanging park rangers and postal carriers: It is as if Republicans are trying to lose midterms by a mile. The administration announced two initiatives: Deny federal workers a 1.9% raise and index capital gains to inflation, saving the rich billions."
,democrats,"John McCain’s Funeral Was, Among Other Things, The Ultimate Revenge on Donald Trump"
,democrats,Steve Schmidt scalds Ivanka and Jared appearance at McCain memorial: They stand for 'everything he was against'
,democrats,Parkland student rips Rubio for complaint about Neil Armstrong movie: Where was this energy after school shooting?
,democrats,Can’t we stop them? They’re everywhere now and no ones doing anything! Our western governments are comprised so you have to try to stand up!
,democrats,"Kavanaugh won't commit to recusal from Trump, Mueller-related matters: At his Senate confirmation hearings next week, Supreme Court nominee Kavanaugh is not expected to offer any commitment to recuse himself from cases involving investigations of President Trump."
,democrats,"Michael Ⓜ️ on Twitter: ""When The President arrived at Aretha Franklin’s funeral, she was met with a standing ovation."""
,democrats,Democratic House candidate Abigail Spanberger suffers the kind of election year smear John McCain would recognize [VA-07]
,democrats,"Marco Rubio and the Right’s Bogus Attacks on Ryan Gosling’s Neil Armstrong Movie ‘First Man’ -- The Florida senator accused Damien Chazelle’s moon-landing film, which just premiered in Venice, of being unpatriotic. He couldn’t be further from the truth."
,democrats,"Trump admin withholds 100,000-plus pages of Kavanaugh docs"
,democrats,CNN’s Douglas Brinkley: ‘Disrespectful’ for Trump to Tweet During McCain Memorial Service
,democrats,"Ted Lieu: ""This testimony from @FBI official Bruce Ohr suggests the Kremlin has leverage over @realDonaldTrump. I call on @HouseJudiciary Chair @RepGoodlatte to immediately release the Ohr transcript. GOP should also hold a public hearing for Ohr to tell the American people what he knows."""
,democrats,"McCain’s last stand for unity highlights Obama, Bush, Biden"
,democrats,Ethnicity not a factor in Elizabeth Warren’s rise in law
,democrats,Meghan McCain Rebukes Trump in Powerful Eulogy for Her Father: Ms. McCain’s speech contrasted her father’s legacy with the “opportunistic appropriation” and “cheap rhetoric from men who will never come near the sacrifice he gave so willingly.”
,democrats,"JΞSŦΞR ✪ ΔCŦUΔL³³º¹ on Twitter: ""What a disgusting bitch."" -- Ann Coulter on Twitter: ""Been channel surfing today, and I'm picking up subtle hints that John McCain might be unwell. Pls advise."""
,democrats,DeVos: I won't take action over schools buying guns with federal funds
,democrats,"And the polls are close??? C’mon, Texas!"
,democrats,"Trump trolls American workers with his Labor Day message: The White House issues a statement praising workers and unions, despite a record of depressing wages, threatening jobs, and weakening unions."
,democrats,Is Donald Trump just a liar or has he lost his grip on reality?
,democrats,Kirsten Gillibrand &amp; Kamala Harris Are Taking On The U.S.' Shockingly High Maternal Mortality Rate
,democrats,"Agents Tried to Flip Russian Oligarchs. The Fallout Spread to Trump. -- Between 2014 and 2016, the F.B.I. and the Justice Department unsuccessfully tried to turn Mr. Deripaska into an informant. Two of the players in the effort were Bruce G. Ohr and Christopher Steele."
,democrats,Cindy McCain lays a wreath at The Vietnam War Memorial
,democrats,In the TAX PLAN they put in: An abortion law reclassifying life at conception. A clause to drill oil in Alaska’s arctic wildlife preserve. Pulled the mandate for the ACA. 13 million lose insurance. We won’t forget: 2018 is gonna be a massacre.
,democrats,"Trump’s poll numbers take a dive. How worried should the GOP be? -- Trump built his campaign around “Crooked Hillary,” and then launched an administration second to none in conflicts of interest, self-dealing, and convictions and plea deals."
,democrats,"Daniel Dale: ""I’d said I wasn’t going to say anything about my source for the quotes Trump made off the record to Bloomberg. However, I don’t want to be party to the president’s smearing of excellent, ethical journalists. So I can say this: none of the Bloomberg interviewers was my source.""""Trump.."""
,democrats,Crime Families LOVE Trump
,democrats,"Trump Doubles Down on Indulgent—and Failing—North Korea Policy: China, Russia, and both Koreas have declared open season on America. The Trump administration has since the summit watched Beijing and Moscow with impunity violate U.N. rules and U.S. money-laundering laws."
,democrats,"Steve Schmidt: Bush, Obama Came Together at McCain Memorial to ‘Rebuke This Vile and Low Moment’ in Country"
,democrats,"Jeff Flake on Twitter: ""Decency Wins"""
,democrats,"Glenn Kessler: ""on the same day he canceled raises for 2 million working-stiff federal workers? Dem ad makers must be licking their chops"" -- Erik Wasson: ""Trump tells Bloomberg he's considering using exec powers to index capital gains to inflation, a massive tax break for long-term investors"""
"News article: https://www.huffingtonpost.com/entry/susan-collins-brett-kavanaugh-roe-v-wade_us_5b8963d5e4b0511db3d7d20d?jz8

It’s becoming clear that Trump nominated Kavanaugh at least partly to protect himself and his personal and family corruption from investigation. From shady deals with the Saudis that could be benefitting his personal business empire to arranging alleged payoffs for women, Trump is doing whatever he can to escape scrutiny.

Only the Senate can stop him, and the most important swing vote to #stopkavanaugh is Maine Senator Susan Collins.

Collins previously promised to “fix” the health insurance market, which would save access to health care for millions of Americans.

Instead, with a vote to confirm Kavanaugh she would let Trump destroy health care access for people in Maine and across the country, and help shield Trump from investigation. 

Be A Hero PAC started a fundraising effort to kick start an opponent to Collins if she votes for Kavanaugh:

https://www.crowdpac.com/campaigns/387413/either-sen-collins-votes-no-on-kavanaugh-or-we-fund-her-future-opponent

Will you pledge $20.20 now? You will ONLY be charged if Susan Collins votes for Kavanaugh.",democrats,HuffPo: Don't Count On Susan Collins To Save Roe v. Wade &lt;--- we're working on that
,democrats,"Andrew Hammond on Twitter: ""The George W. Bush/Michelle Obama interactions are always the best"""
,democrats,‘Whoever wins South Carolina will be the Democratic nominee’
,democrats,Betsy DeVos; For Profit Colleges Rise Again
,democrats,Ocasio-Cortez mocks GOP for 'corny' attacks on Beto O'Rourke
,democrats,Corruption probe looms over Democrat’s historic campaign for Florida governor
,democrats,Trump starts tweet storm during McCain funeral
,democrats,‘Totally dishonest’: Trump asserts only he can be trusted over opponents and ‘fake news’ -- “When Donald Trump is starting to raise the specter of trying to fiddle with search engines and saying that they are rigged — this raises alarm bells in me as a scholar of authoritarianism.”
,democrats,Trump wonders why China was not involved in NAFTA - The NORTH AMERICAN Free Trade Agreement
,democrats,DCCC surpasses online fundraising total from 2016
,democrats,"The answer to GOP dog whistles? Democrats should talk more about race, not less. - The Washington Post"
,democrats,Scott Walker Charged Taxpayers For Flight to Campaign Ad
,democrats,"Race, socialism define first day of Florida campaign for governor"
,democrats,"Meet Mariah Parker, One of the Young, Radical Women of Color Rescuing the Democratic Party"
,democrats,"The Trump Administration Is Keeping 100,000 Pages Of Brett Kavanaugh's Records Secret: The ""White House, after consultation with the Department of Justice, has directed that we not provide these documents."""
,democrats,Lawyer was told Russia had 'Trump over a barrel' -- DoJ lawyer Bruce Ohr says a former British spy told him two years ago Russian intelligence believed it had Donald Trump “over a barrel”. Ohr also learned a Trump campaign aide met with higher-level Russian officials than the aide had acknowledged.
,democrats,Why You’ve Never Heard of Al Gore’s Own ‘Trump Tower Moment’
,democrats,"Three men unfit to eulogize John McCain: You had to control your gag reflex watching Vice President Pence, Senate Majority Leader Mitch McConnell (R-Ky.) and House Speaker Paul D. Ryan (R-Wis.). In singing his praises they demonstrated just how small, how weak they are."
,democrats,"Just Hours After Ordering Pay Cut for Millions of Public Workers, Trump Proposes $100 Billion Gift to Richest 1%: He ignores the law, governs for the top one percent, and doesn't give a hoot about the rest of us."""
,democrats,I Went to Kentucky’s Last Abortion Clinic
,democrats,NYT columnist: 'More outright white nationalists than black people' in Trump administration
,democrats,Bruce Ohr Is One of the DOJ’s Top Russia Crime Fighters: Is that why the president wants him fired?
,democrats,Trump jokes that Sarah Huckabee Sanders is 'having a nervous breakdown' over his behavior toward John McCain after his death
,democrats,Brand New. Just went up.
,democrats,‘A New NFL’: Trump Wants to Make Google The Next Front in The Culture Wars -- Top economic adviser Larry Kudlow says an “interagency review” process examining Google’s platform will be “put through” soon.
,democrats,"'The story goes so far back': new film attempts to untangle Russiagate -- Active Measures, a documentary featuring Hillary Clinton and John McCain, is a comprehensive and at times frenetic analysis of Trump’s relationship with Russia"
"Help elect a **worker to represent workers** in the New York State Senate!

[Meet Amanda](https://cdn.flipsnack.com/widget/v2/widget.html?hash=fzt5wm551&amp;bgcolor=EEEEEE&amp;t=1535773034)

*Amanda has built a platform based on* [healthcare, jobs, and justice](https://cdn.flipsnack.com/widget/v2/widget.html?hash=fzt5wm551&amp;bgcolor=EEEEEE&amp;t=1535773034)—a bold and humane agenda that will sweep up a broad range of support from numerous communities, a coalition that is representative of everyone who calls the 58th home.

[VOLUNTEER](https://secure.ngpvan.com/bYBDF1nqbEWx9q_1iIR9IQ2)

[DONATE](https://secure.actblue.com/donate/amanda-serving-the-people-1)

​

[Introducing Amanda Kirchgessner, Candidate for NY Senate District 58. Human welfare over corporate welfare. Period.](https://reddit.com/link/9c16qd/video/pi0r80gjvkj11/player)

​

[VOLUNTEER](https://secure.ngpvan.com/bYBDF1nqbEWx9q_1iIR9IQ2)

[DONATE](https://secure.actblue.com/donate/amanda-serving-the-people-1)",democrats,Workers Need Representation! Amanda Kirchgessner for New York State Senate
,democrats,"Don't Count On Susan Collins To Save Roe v. Wade: The Maine senator greenlighted Brett Kavanaugh before Trump nominated him, a source close to her staff said."
,democrats,Trump Saves Planet from Alien Attack
,democrats,"Trans industry: Kids can be transed WITHOUT ""gender dysphoria""!"
,democrats,"If Gillum Can Turn Out Obama’s Coalition Again, It Could Be a Game-Changer"
,democrats,LBJ on the GOP
,democrats,"County GOP official called NFL players who kneel ""baboons."" “Tired of these over paid ignorant blacks telling me what I should believe in. """
,democrats,A neuroscientist explains how Trump and his media allies stir up paranoid delusions in vulnerable people
,democrats,"Billionaire [Tom Steyer], unions have a plan to tip California’s closest congressional races"
,democrats,"Poll: 60 percent disapprove of Trump, while clear majorities back Mueller and Sessions -- President Trump’s disapproval rating has hit a high point of 60%. Nearly half of Americans, 49%, say Congress should begin impeachment proceedings that could lead to Trump being removed from office."
,democrats,"The Real Reason Russia Is Rooting for Republicans in the Midterms: State-controlled media joke about abetting Trump and believe his tough talk on sanctions is just a ploy. If the Republicans win the midterms, they say, he’ll come around."
,democrats,Republicans 'cherry-picked' Russia probe documents to quiz U.S. official: Democrats -- The Democratic lawmakers said Republicans appeared to have violated House rules because they failed to share the communications between Ohr and Steele in 2016 and 2017 with the minority party.
,democrats,"""A few months ago, it hit where West Virginia is, on a per capita basis, one of the most successful (gross domestic product) states in our union."" — Donald Trump on Tuesday, August 21st, 2018 in a rally in Charleston, W.Va."
,democrats,"Trump's approval rating among black voters is a whopping 3 percent: Non-white respondents overall largely disapprove of Trump, with 78 percent saying that he's handling the presidency poorly."
,democrats,"The Truth Behind the GOP's ""Southern Strategy"""
,democrats,Racist robocalls hit Florida with black minstrel-style voice mocking Gillum
,democrats,Alexandria Ocasio-Cortez is being held to a higher standard than men: Male politicians aren’t told to put training wheels back on after a fact check.
,democrats,"Trump ""Fired Up"" @business ""Bloomberg"""
,democrats,Trump Says Democrats Can’t Impeach Him Because He’s Doing a ‘Great Job’
,democrats,"Photo of young, cool Beto O’Rourke activates the never-ending culture wars"
,democrats,John Kerry won't rule out 2020 White House run
,democrats,"New York’s attorney general says Trump Foundation bankrolled political campaign, pursues lawsuit"
"My dad is jumped on the Trump train hard. So hard, that he honestly believes that Trump is the reincarnation of Lincoln.  He's a loyal viewer of Fox News. He is able to rattle off facts and figures about the Trump presidency because of how much he watches Fox. We got into a fairly heated discussion this past weekend about what Trump has done so far in his presidency. My dad asserts that the tariffs to our allies have been great for the economy, because he thinks that countries like Canada have been screwing America over in trade for decades. He also loves Trump's hard-line stance on immigration as he feels loose borders drain our social service dollars, which hurts our economy. I believe that these things are false, but I'd like to be armed with facts and sources the next time we have a conversation. 

  

He also doesn't care about how Trump acts ""unpresidential"". I believe that he's doing real harm to the world order we've helped craft post-WWII. He thinks that Trump is ""who he is"" and we have to support him because he's doing real good for the country.

  

Reddit, please help me factually disagree with my father about all the ""wonderful"" things Trump is doing for our country.",democrats,"How can I have a fact based conversations with my dad, a Trump supporter?"
,democrats,Florida GOP gubernatorial nominee was admin of racist Facebook group
"Anyone you can list me that is worth looking into? I tend to measure a candidate mostly off voting records, and legislature introduced. 

As a moderate independent who leans liberal on social equality, immigration reform, and political finance contributions, but leans conservative on firearm regulation, and some financial / tax issues, I'm interested in hearing what candidates you prefer. ",democrats,Candidates in 2018 and 2020
,democrats,"This Is Fascism, Pure and Simple: The Trump administration is now denying passports to American citizens. This sounds terrifying familiar."
,democrats,"Democrat blisters indicted California Rep. Duncan Hunter as an ""embarrassment"" in new ad"
,democrats,Progressives Are Excited About Andrew Gillum. Does He Really Have a Shot?
,democrats,Trump's Popularity Is Still Rock Solid Because He's Still Hurting Brown People
,democrats,"Fiddler on Twitter: ""In Richmond, Virginia. The former capital of the Confederacy. Freaking sweet."" -- Jason Kamrason Twitter: ""What a beautiful sight."""
,democrats,Michael Avenatti rips Trump as 'C-class mobster' after National Enquirer affair reveals more about Trump's 'criminal enterprise'
,democrats,"Trump finally realizes that he confessed to obstructing justice on TV, claims that Lester Holt altered their interview"
,democrats,"Jessica Taylor on Twitter: ""And here's the ""Lock her up"" chants at the Indiana rally (reminder that Trump's campaign chairman actually is locked up right now)"""
,democrats,MSNBC analyst Natasha Bertrand explains how National Enquirer scandal 'substantiates' two key parts of Steele Dossier
,democrats,Florida GOP gubernatorial nominee was admin of racist Facebook group
,democrats,"Voters don’t buy ‘No collusion!’ -- Trump’s ranting and raving have not befuddled those outside his core base of support. No matter how many times he hollers, “Witch Hunt!” most voters think “collusion.”"
,democrats,Trump declared the economy the best ‘EVER.’ Now he says federal employees won’t get raises because of economic problems.
,democrats,Ron DeSantis is an admin of a Facebook group that promotes racism and deep-state conspiracies.
,democrats,The Kavanaugh Files
,democrats,From the Grassroots to the Ballot Box: How Gubernatorial Candidate Andrew Gillum Won in Florida
,democrats,"Nancy Pelosi on Twitter: ""Trump promised that working families were the focus of the #GOPTaxScam. But eight months later, we’ve seen corporate profits surge (driven by massive windfalls from the tax scam), while the real wages earned by America’s families have stagnated. #WorkersDeserveMore"""
