selftext,subreddit,title
,democrats,"Republicans will make this election all about race. And the 2020 election, too. -- What’s more, this is the only kind of campaign it can run as long as Trump is president and dominates the party."
,democrats,Hillary Clinton’s Server And China: Here’s What We Know And Don’t Know: Many of the claims are baseless and lacking proof. -- UNVERIFIED: Clinton’s email server was hacked FALSE: Former FBI lawyer Lisa Page told Congress that China hacked Clinton’s server
,democrats,Why Do The People Who Hate Government Need It The Most?
,democrats,Emotional Joe Biden remembers John McCain as 'a brother' at memorial service
,democrats,"Beto O'Rourke on Twitter: ""Josh said this election will be the first he's voted in since 1992. Honored that he'd join us tonight in Midland and that he'd be a part of what we're doing across Texas."""
,democrats,Please be sensitive to our snowflake president's need for safe space
,democrats,The simple but ingenious system Taiwan uses to crowdsource its laws
,democrats,"Joe Biden’s heartfelt eulogy for John McCain: Like the man who delivered it, Joe Biden’s eulogy for John McCain was funny, open and self-deprecating. His words were nearly operatic in their emotional arc."
,democrats,Advisers worried what Dem-controlled House means for Trump
,democrats,Post-primary poll shows Dem Gillum leading GOP DeSantis in Florida's gov race
,democrats,"Opinion | In My Iowa Town, We Need Immigrants"
,democrats,Republicans can’t even agree to take a segregationist’s name off a building
,democrats,"A Colorado Senator Slammed Trump's Anti-Pot Committee: “The Trump administration has further eroded any credibility it has on this issue,” said Democratic Sen. Michael Bennet. “I am deeply concerned by this intentional effort to mislead the American people,” said Bennet."
,democrats,"Trump, who is both stupid and a liar, tweets a faked internet video to blast Google"
"In his Op-Ed piece called ""The Commander of Fear"" Charles M . Blow has taken Trump to the task with another sentence saying, ""Trump's magical mixture is to make being afraid feel like fun.""

To show my appreciation for Mr. Blow's column, I like to add my line saying this : We democrats have no illusion that Trump could only run with a Republican ticket in 2016. 

Why ?

Because we on the left would've given him no ground to start his campaign with the most divisive language like, ""Mexicans are bringing....."" like Charles mentioned in his Op-Ed.

Actually if fear could be used as a weapon then the Republican party was guilty of always welcoming all of their candidates whoever had fear mongering messages. And they did it for a very long time. 

No wonder Trump took full advantage of a ready made audience that the Republicans had nurtured for a almost a century.

He came up with some of the most outlandish claims that any other Americans had ever come up with. 

By announcing Obama's presidency illegal, Trump started spreading this rumor that our first Black president was not born in America but in his father's native land Kenya.

Almost all the Republicans jumped on the same hoax spread by Trump saying in unison that ""if Obama was not born here, he could not be president of this country.""

What nobody told Trump on his ugly face was, ""So what ?""

With his White Kansas born American mother, Obama had as much claim to the throne as John McCain who was born on Panamanian waters as we've seen in his birth certificate issued by a hospital in Panama. 

But none of that was a concern for the morons who filled up the higher echelons of G.O.P. 

So with ""Here it goes again"" sounding all over the country with ""The Commander OF Fear"" as Mr. Blow addressed him in his piece, Trump and his leeches are spreading one fear after another squashing all the civility that this country grew up with. 

Trump's sponsored candidate DeSantis of Florida went one step further by insinuating while using a bull horn on Fox Tv that his Black opponent for Governor, ""is a Monkey"".

Go figure !",democrats,"Trump will burn in hell for spreading one fear mongering counterpoint after another using many bullhorns with totally racist undertones. Even DeSantis, his sponsored Republican candidate in Florida Governor's race used the word ""Monkey' to describe his Black opponent."
,democrats,Running List of Republican Scandals with Congress Refuses to Investigate
,democrats,Trump cancels pay raises for federal employees
,democrats,"Hillary Clinton: Over 500 children are still waiting to be reunited with their parents, five weeks after the administration's deadline to reunify families. Every day they are made to wait is a tragedy."
,democrats,Trump North Korea rant bad news for Mattis. Is Mattis Next Out the Door?
,democrats,Democrats in Pennsylvania Are in a Strong Position for 2018 Midterms
,democrats,"National Enquirer Had Decades of Trump Dirt. He Wanted to Buy It All. -- He and his lawyer at the time, Michael D. Cohen, devised a plan to buy up all the dirt on Mr. Trump that the National Enquirer and its parent company had collected on him, dating back to the 1980s."
,democrats,Trump seeks to backtrack on 2017 comments on Comey firing
,democrats,"In-N-Out donates $25,000 to California Republican Party, angry Twitter users call for boycott"
,democrats,Robocalls falsely tell seniors net neutrality raises phone bills by $30 -- calls spread misinformation to seniors as California votes on net neutrality
,democrats,Sessions is one reason to flip control of the Senate: The new AG will fire Robert Mueller or restrain his investigation or pull his clearance.
,democrats,Bernie dog
,democrats,West Virginia GOP poll shows Dem Senator Joe Manchin leads challenger Patrick Morrissey 47% to 41%
,democrats,"McCain came to realize she's bat shit crazy, that's all ."
,democrats,Trump’s Student Debt Policies Are Mind-bogglingly Corrupt
,democrats,MSNBC's Rachel Maddow reveals Trump's 'ethics advisor' is being investigated for money laundering — and may replace Sessions
,democrats,‘Keep your damn money’: Dems reject corporate PACs as they rally around anti-corruption message
,democrats,Hill.TV poll: Dems have double-digit lead over Republicans on generic ballot
,democrats,A Neuroscientist Explains What Happens When a Narcissist Starts to Lose Power
,democrats,Democrats Like Beto O'Rourke Could Remake the Sun Belt
,democrats,"U.S. is denying passports to Americans along the border, throwing their citizenship into question: The Trump administration is accusing hundreds, and possibly thousands, of Hispanics along the border of using fraudulent birth certificates since they were babies and is undertaking a crackdown."
,democrats,"Says ""96 percent of (Google News) results on ‘Trump News’ are from National Left-Wing Media."" — Donald Trump on Tuesday, August 28th, 2018 in a tweet"
,democrats,CNN New Day: Trump Predicting Violence if GOP Loses Midterms is ‘Dangerous New Low’
,democrats,Republicans Are Exploiting the Murder of Mollie Tibbetts
,democrats,Could This Be the Year Montana Sends a Democrat to the House?
,democrats,GOP Will Beat Beto O'Rourke By Showing Texas How Fuckable Beto Is
,democrats,"My Google searches are working just fine--- ""Worst President Ever"" Google Search"
,democrats,"Cuomo 2020 Presidential Run: Citing God and Death, He Rules It Out"
,democrats,Democrats Just Confirmed Lots Of Trump's Judges So They Could Skip Town
,democrats,Chris Cuomo Calls Out Ex-Trump Adviser: 'Don't Sell B.S. To My Face!'
,democrats,‘The race has tightened’: Cruz allies sound alarm about Texas Senate race
,democrats,NY Democratic Gubernatorial Debate - Andrew Cuomo v. Cynthia Nixon
,democrats,How Andrew Gillum Can Replicate His Staggering Democratic Primary Win in November
,democrats,"All the times alleged Russian spy’s lawyer went on Fox News and didn’t say who he was: Robert Driscoll loved appearing on Fox News to talk about Russia, but not about who he was working for."
,democrats,"Trump’s Coal Plan Will Kill People, but at Least It’ll Create Jobs, Right? Wrong. -- The idea was supposed to be that, well, people may die, but it’ll revive the industry. But it won’t. Our source on that? Trump’s own EPA."
,democrats,"Andrew Gillum, Martha McSally: 5 Takeaways From Florida And Arizona Primaries : NPR (Again Democrats Need to Turn Out the Vote!)"
,democrats,Trump’s Ludicrous Attack on Big Tech: Here’s the truest conundrum of the social media age: Those who complain loudest about being silenced never ever shut up. Mr. Trump huffs and puffs away on issues that have finally bubbled up to him from the ever-growing cesspool of online anger.
,democrats,DeSantis says Florida voters would ‘monkey this up’ if they elect Gillum as governor
,democrats,A former C.I.A. officer running for Congress accused a super PAC aligned with Speaker Paul D. Ryan on Tuesday of improperly obtaining her entire federal security clearance application — a highly sensitive document containing extensive personal information — and then using it for political purposes
"Source: [https://grafiti.io/facts/5132](https://grafiti.io/facts/5132)

https://i.redd.it/jd5wer5bk6j11.png",democrats,"Poll: Just 36% Of Americans Indicate They Would Vote For Trump In 2020, Clinton Had 42% in 1993"
,democrats,"Department Of Defense Basically Admits Trump's North Korea Summit Was Fake: As we’ve learned from Mattis, the people around Trump knew all along what was going to happen and didn’t bother fulfilling their part of the bargain anyway."
,democrats,"2018 midterms: millennials prefer Democrats, but only half plan to vote"
,democrats,Andrew Gillum’s Win Is Great News for All Democrats—Despite What the Media May Tell You
,democrats,One Small Blow Against Encroaching Totalitarianism: More for More Than Me
,democrats,"In Unprecedented Move, The US Postal Service Released A Former CIA Officer’s Security Application to Republican Group: The former officer, Democratic candidate Abigail Spanberger, and suggested that the Trump administration may have leaked the information for partisan purposes."
,democrats,Private prison employee morale hits major low as ICE controversy continues
,democrats,The government just made it easier for workers to own a piece of their employer
,democrats,“It Seems Like Iowa in 2007”: Is Beto O’Rourke the Left’s Obama-Like Answer to Trump in 2020?
,democrats,Texas GOP attack on Beto O'Rourke completely backfires
,democrats,DeSantis: Florida voters shouldn’t ‘monkey this up’ by voting for Gillum
,democrats,"Can Trump find a sufficiently devoted lickspittle to replace Don McGahn? -- In Trump’s world, if you’re not a toady then you’re an enemy."
,democrats,Who Stretched the Truth? A Cuomo-Nixon Fact Check
"As Dr. Thomas L. Friedman rightly said in his Op-Ed today in NYT, ""What if Trump Did Actually Shoot Someone on Fifth Avenue ?"" where the famous columnist has cautioned us on the left warning us saying ""Your vote in the midterms matters, because republicans in Congress won't restrain the president's excesses.""

Actually this type of warnings came to us two days in a row by two different gentlemen who really care about America, by Paul Krugman yesterday. And Dr. Friedman today.

But it's the Evangelicals who're still supporting Trump even after their meeting with their president day before yesterday who  should be really fearful of their fate. Those pastors and their congregation should realize that by supporting a pure evil called Trump they're praying to the Devil, not Jesus.

Being associated with the Devil himself or an incarnation of Lucifer called Trump, those Christian leaders and their congregation should be ashamed of calling themselves Christians.

Those apostles have to realize that they're in cahoot with a man who said in his campaign stops that his supporters would still vote for him even if he ""shot someone on the Fifth Avenue"" the subject of the Op-Ed in NYT today.

Although Dr. Friedman's column is fictional but Trump has such a sway over his followers in the Republican Party who'll look the other way even if Trump shoots someone totally unprovoked on Fifth Avenue in New York or on Pennsylvania Avenue, Washington D.C.

Even the Senators like Lindsey Graham and Rand Paul are ready to trash their colleague and best friend John McCain's legacy and his wishes of calling Russia's president Putin, ""a thug"" even a few days before his death from brain cancer.

As no one knows yet how much help the Russians extended to both of the above Republican Senator's reelection campaigns, those two Senators and other stalwarts from G.O.P. sure like to overlook Russian intervention in our last election which catapulted not only Trump in the Oval office of White House. 

The Russians helped majority of the Republican congressional candidates to destroy their Democratic opponents' chances of winning elections by hacking and publishing their small infractions with the law like not paying their parking tickets years ago.

I cannot believe that Lindsey Graham, Rand Paul and other senior members of the Republican party like Mitch McConnell and Paul Ryan do not have any clue about Russian intervention in our elections in 2016. The fact is, they know.

Or if they don't know they should ask Mr. Mueller. He knows what Russians did.",democrats,"Evangelicals,who're still supporting Trump even after their meeting with him where he said, ""There'll be violence after election"" should pray to Devil instead of Jesus. They should know that violence after election will come from Trump's White Supremacists/Nationalists, not from Antifa."
,democrats,"Donald Trump’s Response to John McCain’s Death Reminds Us Just How Petty He Is: Donald Trump is a small, petty man. He is a liar and a crook. And his legal problems are mounting. Each one of these statements has been true since January 20, 2017, when Trump became the President of the United States."
,democrats,Japan and North Korea held secret meeting as Shinzo Abe 'loses trust' in Donald Trump
,democrats,Representatives in hiding: campaigning as a Republican incumbent in upstate New York
,democrats,Bernie backed progressive Andrew Gillum wins stunning upset in Florida Gov race
,democrats,Andrew Gillum will face Ron DeSantis in Florida
,democrats,70% of Americans now support Medicare-for-all
,democrats,Stop Kavanaugh.
"NY-23 has the opportunity to elect the first cyber security expert to congress. [Tracy Mitrano](https://tracymitranoforcongress.com/) is running against incumbent Tom Reed, a long time Trump supporter. Mitrano is the former director of information technology policy for Cornell University. She's running on a campaign of universal healthcare, net neutrality, and accessible higher education.

Currently NY-23 is rated as R +6 according to Cook voter index. Voters are apathetic about Tom Reed, and turnout is usually low. In the democratic primaries, more votes were cast than in any primary since the redistricting about 7 years ago.

This is a very winnable race. Congress desperately needs someone with experience in information technology and cyber security, especially as nature of election interference has begun moving into the digital age. The [videos of congress trying to ask Mark Zuckerberg questions about facebook](https://www.youtube.com/watch?v=ncbb5B85sd0) should be a red flag that our current congress is not prepared to handle these threats. Tracy Mitrano is one (if not the only) congressional candidate qualified to handle these kinds of hearings.

​

Locally, many big manufacturing plants have been shutting down. Thousands have lost their jobs in the last year alone. Pollution from a nuclear plant neat the great lakes remains a concern. Opioid addiction continues to rip through the community. Much of the land here is farm land, and will be hit by Trump tariffs.

Mitrano needs help. Reed is backed by multiple pharmaceutical companies, and several other big lobbying firms. She needs name recognition and much more media attention than local newspapers can give her.

​

If you can give money, time, or just words of encouragement the campaign can use it all. @ her campaign on twitter. Tag her in stories about election meddling and cyber security. Write post cards to voters. Donate a couple bucks. If you're in the area, join us going door to door. Buy signs and bumper stickers. Write in opinion pieces to local newspapers in the district.

​

With some help, this race can flip. It's marked ""safe R"" by most forecasts, but in this climate this one is an excellent bet for a surprise upset.",democrats,Tracy Mitrano - NY23
,democrats,ShickenChit.
,democrats,Enema of The People.
,democrats,Democrats say Brett Kavanaugh would 'cripple' net neutrality 'for decades to come'
,democrats,Americans Are Making Less Money Despite Trump’s Promises
,democrats,"Rush Limbaugh: ""It appears that the (Jacksonville) shooter was part of the Trump 'Resistance'."" | FALSE"
,democrats,Another Strong Night for Democrats
,democrats,Sanders to introduce ‘Bezos Bill’ next month
,democrats,White House lawyer who may have incriminated Trump in extensive Mueller interviews may leave admin
,democrats,"Following primary, Democrat could prove tough competitor for Arizona’s moderates"
,democrats,Vermont Democratic Party endorses weed taxation and regulation
,democrats,Trump aide says president weighing regulations on Google search engine that he considers 'rigged'
,democrats,"Robert Reich: If Trump Is Guilty, His Presidency Must Be Annulled"
,democrats,"This toddler got sick in ICE detention. Two months later she was dead. -- When Yazmin Juárez arrived at the South Texas Family Residential Center her 18-month-old daughter was a healthy toddler who liked dancing and singing with her mother, and was blissfully unaware of her confinement."
"I have a user that is requesting help to make a video to support Democrat Bill Nelson, who is running for the Senate in Florida against republican Rick Scott. Here is your chance to get involved helping democrats take back the senate.

If you are willing to give your talents to help with this video, Contact me and I will hook you up with them. Let's turn the congress blue!",democrats,"Need a video editor to make an ad for Bill Nelson, who is running against republican Rick Scott."
,democrats,"Hillary Clinton: There's a lot going on right now—understatement of the year. The separation of families and the failure of the administration to reunite them has been eclipsed in the news in recent days, but these tragic circumstances persist. Here are some of the latest developments:"
,democrats,"Amanda Terkel: ""National Park Service employee tells me they got an email around 10am ordering flags at half staff. Around 2:30pm, email went out cancelling it and saying flag should go back to regular order. And around 5:30, another one went out saying to lower again.""""Employee says the flag..."""
,democrats,Democrats need to start taking voting rights seriously
"BY his OP-Ed in today's NYT called ""Why It Can Happen Here"" Dr. Paul Krugman has given a stern warning to all the Americans.

Actually his warning is more towards us on the left than the Americans on the right when he said this very frankly, ""We're very close to becoming another Poland or Hungary.""

While appreciating Dr. Krugman's comments, I also like to put my own input on the subject by informing our Dem members of congress and Dem, Liberal, Progressive and Bernie's Independent voters that we're at the edge of a precipice if we don't take this upcoming midterms seriously.

I just like to remind our voters that there are still millions of Republican supporters who voted for Trump in 2016. These Trump voters voted for him not having any clue who they were voting for.

They just went to the poling booths to vote for a narcissistic sycophant who initially used dog whistle to question our first Black president Obama's place of birth to put him in the spot light.

Next, he literally blew a big trumpet to announce his candidacy for the presidency by using senseless jingoism and pointed attacks on the Mexicans in particular, immigrants in general.

And now as we're nearing two years of Trump's ascendancy to the throne once coveted by ideal Republican presidents like Abe Lincoln and Gen. David ""Ike"" Eisenhower and Democrats like Franklin Roosevelt, Jimmy Carter and John Kennedy, we're almost at the edge of the Abyss where any mistake by our countrymen to put the same Republican party in power after November's midterms will put our country towards the dictatorship that we've only read in the Newspapers or watched on tv.

Yes, it's true that we've never seen a dictator in this great country which functioned as a Democracy for almost 300 hundred years. 

Hope we do not have to see now with Trump turning into a totally rogue dictator starting January 1st, 2019.

That is the only reason why this upcoming elections are so important for the existence of America and the prevalence of American values that were instilled on July 4th 1776.

We should not also forget our Constitution that was ratified on June 21,1788. And the 27+ Amendments which sealed the deal against an impending authoritarian regime that Trump is going to bring in if the Republicans are kept in power in both the chambers of congress after the midterms on November 6th.",democrats,"By not lowering the flag initially for late Sen. McCain,Trump has proved that he doesn't love America or its values and it's heroes. With the help of the Republicans in congress he'll turn our country to a dictatorship like in Poland or Hungary next year."
"So I’m desperate I’m wanting to make calls to voters in districts and states I’ve gone on www.swingleft.org signed up but still need help I’m disabled and live in Missouri have tried to contact other campaigns with no help.

Is there anywhere i can make calls to voters for democrats so they know to vote in November? 

Any help would be great. Thanks ",democrats,Where can i make calls to voters?
,democrats,"Republicans are mired in a culture of corruption, and Democrats should say so at every opportunity"
,democrats,Don't consider Supreme Court nominee Kavanaugh until Mueller probe ends
"Hey, curious as to what centrist Democrats read? Specifically those who lean more to the center than the far-left. I guess you can say center-left. What news outlet do you read?

Also, what books do you advise reading? ",democrats,What news outlets do centrist democrats read?
,democrats,"McCain gets the last word on Trump: McCain even in death was able to illustrate what a small, self-absorbed character now occupies the White House. His party is defined now by the man whose low character is revealed each and every day."
,democrats,"Why we fight against Rent-Seeking, Life-Sucking Republicans: ""Life-Threatening Heart Attack Leaves Teacher With $108,951 Bill"""
,democrats,Obama endorsements target ‘flippable’ metro Atlanta House districts
,democrats,"Col. Morris Davis on Twitter: ""No sane and sober Veteran of the United States Armed Forces can condone the dishonorable conduct of the draft-dodging, Russia-enabling @realDonaldTrump ... shame on those who once wore the uniform and now facilitate a piece of trash."""
,democrats,"“Trump Is Nuts. This Time Really Feels Different”: Trump Rejects “War Council” Intervention, Goes It Alone -- He “got joy” from stripping John Brennan’s security clearance. And after betrayals by Allen Weisselberg and David Pecker, Trump “spent the weekend calling people and screaming.”"
,democrats,Ted Cruz passes the hat for campaign cash as concern rises about challenger Beto O'Rourke
,democrats,Adding Insult To Injury: Trump’s Instagram Tribute To McCain Features Picture Of…Himself
,democrats,"The Republicans Have No One Who Will Stand Up to Trump Now: The GOP’s moral leader is gone, and instead of challenging Trump, Lindsey Graham, the only one in the caucus with enough gravitas to try to fill McCain’s shoes, is rolling over."
,democrats,"Jonathan Frakes on Twitter: ""An articulate politician"" -- NowThis on Twitter: ""‘I can think of nothing more American.’ — Beto O'Rourke — the man taking on Ted Cruz — brilliantly explains why NFL players kneeling during the anthem is not disrespectful"""
,democrats,Trump’s not-so-subtle denigration of a dead man: Leaks suggest that the staffers weren’t terribly happy with how Trump was handling the matter — which is the usual genesis of such leaks.
,democrats,His whole adult life Trump was always able to buy himself out of trouble. He doesn't know or understand any other way. He can't buy or pardon himself out of this mess. Eventually there will be proof of a crime. He will act like a child when that happens. An angry child in the oval office. Get ready.
,democrats,"Garry Kasparov: ""I said this as soon as Trump had Lavrov &amp; Kislyak in the Oval Office last year. Who would share vital intel that Trump might divulge, intentionally or not?"" -- Edward Lucas: ""I’m hearing that allies are now v nervous about sharing intel w US for fear of what may happen to sources"""
,democrats,"AP FACT CHECK: Trump's bent reality: Cohen, clean air, taxes -- President Donald Trump is living in an alternate reality when it comes to special counsel Robert Mueller's investigation and other controversies swirling around him."
,democrats,Will Beto O’Rourke Become President?
,democrats,"Student loan watchdog resigns, claiming Trump administration has ‘failed borrowers’ -- The student loan ombudsman stepped down from the Consumer Financial Protection Bureau, arguing that acting director Mulvaney has done “damage” that “sacrifices the financial futures of millions of Americans.”"
