selftext,subreddit,title
"We are two of r/democrats more vocal members from opposite sides of the aisle. /u/Caveliertunes speaks out for Progressives and I, /u/backpackwayne, encourage the more Centrist view. We both have our arguments, and we both do our best to convince others of our position. But with exactly two months until a crucial election, we have decided to join together and urge unity, if only for a short time. 
 The following are statements are from each of us and we only ask that you listen.


-----------------


**From /u/backpackwayne:**

The Democratic Party has been in a struggle for control for over two years now, and this battle has taken its toll. Republicans are giddy as we are doing their job for them. Progressives and Centrists want the same things but differ on how to achieve them. But we do want the same things. Putting that aside, it is time to look at reality. If democrats do not win back the house and/or the senate in this election, we will face another two years of our democracy being shredded by an inept and callous Trump administration. They will stack the courts, take away our rights, abuse and pollute our justice system, destroy our environment, and eliminate any chance for universal healthcare for at least a decade.

The fight for the left should take place in the primaries. **THE PRIMARIES ARE NOW OVER!**  In the next two months we must unite and fight for the candidates that have been chosen. If we don’t, it won’t matter who controls the left. We can get back to that battle later after the election. It is imperative that we put aside our differences for the time being and stop fighting with each other. We all know who the real threat to our democracy is. So please stop this infighting and join together to achieve step one our both our goals. We need to first stop the bleeding and prevent any further damage by gaining control of at least one chamber of Congress. As a united front, there is no stopping us. Divided we face the worst threat to our democracy in yours and my lifetime.

-----------------


**From /u/Caveliertunes:**

Understandably, there are still many hurt feelings and resentment left over from 2016. We all understand. Many Progressives feel unwelcome and belittled. Many Centrists feel like they are consistently under attack. If you feel like your fellow Democrats who are of an alternative viewpoint are not respecting you, remember they likely feel the same way. Empathy is an important trait to have right now. It is something we have over the Republican Party; it is something we need to utilize—not only to defeat them but to work together. We, as a party, must be able to combine our efforts if we are to achieve any of our goals. Perhaps it is ironic that the man who said it best was a Republican himself, Abraham Lincoln: ""A house divided against itself, cannot stand.""

We may not ever all completely agree, but that is what makes us great. That is what makes us strong and resilient! As many have often said: we are a ""big tent party."" We can disagree; we can like different politicians; we can debate about the issues. However, we cannot waver: **Not now!** 

**THE PRIMARIES ARE NOW OVER.** Progressives and Centrists both had significant victories in the primaries this year, and it is becoming increasingly evident that both sides have a place in the Democratic Party. We all have a voice, and those voices are heard loud and clear. However, once the primaries end, we need to put aside any lingering resentment and work toward achieving our common goal. We've all decided that the Republican Party is dangerous! Even if we can't get everything we want out of the election, we can at least achieve that shared objective.

Progressivism is necessary to push forward toward ideals we must achieve as a nation. Centrism is essential to moderate, balance, and work pragmatically when needed, so we don't fizzle out before the fight begins. We are sides of the same coin. We are all necessary for a complete and robust Democratic Party. Progressives and Centrists are both the ""base"" of the party: We need one another! Let's make sure we find ourselves in a position where we can affect policy and help both the party and the country grow!

Respect one another. Respect each other's points of view and preferences. Let's show a united front now and in November, and grind out our differences after the election.


---------------------

#REGISTER TO VOTE HERE NOW!

* https://vote.gov/

",democrats,THE TIME FOR UNITY IS NOW - A Progressive and a Centrist Speak Out
,democrats,Kavanaugh Hearing Erupts in Chaos as Dems Demand Documents
,democrats,Shameful.
,democrats,"Brett Kavanaugh is a threat to women, workers, and the environment."
,democrats,Brennan on Kap’s endorsement deal.
,democrats,"‘We’re in crazytown’: Aides stole Trump's papers “to protect the country,” Bob Woodward writes in book obtained by CNN"
,democrats,Democrats are driving home that Republicans keep changing the rules with Supreme Court nominations
,democrats,"Beto O'Rourke's fiery Labor Day speech: humane immigration, protect teachers"
,democrats,"Trump called Attorney Jeff Sessions a 'traitor,' and said 'Everybody's trying to get me' after Mueller appointed, according to explosive Woodward book"
,democrats,Hillary Clinton: Do you have a pre-existing condition? Do you care about someone who has one? Could you or someone you love ever get one? Then you should call your senators today to #StopKavanaugh from getting a lifetime seat on the Supreme Court. Here's why:
,democrats,The Difference
,democrats,Beto draws a standing room only crowd in Fort Davis which is in conservative West Texas
,democrats,Biden kicks off midterm campaign effort at Labor Day parade
,democrats,The Paradox of Tolerance.
,democrats,"Yes, America Benefits From All Immigration—Legal and Illegal: A tragedy like Mollie Tibbetts’ murder brings out the haters and demagogues. But the truth—as Mollie’s brave father knows—is a lot more complicated."
,democrats,'He has no poker face': CNN panel mocks Trump's panicky tweets as 'the walls are closing in'
,democrats,Biden: ‘Everything’ at stake for Democrats in midterms
,democrats,Republicans Who Didn’t Even Hold Hearing on Merrick Garland Complain That Democrats Are Destroying Norms.
,democrats,Poll: Democrats regain clear advantage in midterms shaping up as referendum on President Trump
,democrats,"Former Republican Kansas Gov. Bill Graves has endorsed Democratic nominee Laura Kelly in this November's gubernatorial election, spurning the GOP's Kris Kobach"
,democrats,"Colin Kaepernick on Twitter: ""Believe in something, even if it means sacrificing everything. #JustDoIt"""
,democrats,Dems retake wide lead over Republicans ahead of midterm elections: poll
,democrats,"Woodward book shames Trump shills, apologists and enablers"
,democrats,Pure Class. Upvote this so people see it when they search for Pure Class
,democrats,Ajit Pai at it again—Millions could lose subsidized phone service under FCC’s overhaul of Lifeline
,democrats,"You can only reform a party that loses: If you care about reviving or reforming (or, of course, obliterating) the GOP, you cannot vote for Republicans for either the House or the Senate in November. Looking ahead to 2020, if Trump runs, I see no hope the Republican Party would abandon him."
,democrats,Bernie Sanders says Trump is a ‘pathological liar’
,democrats,Democrats regain clear midterm advantage (+14) in latest WaPo-ABC poll
,democrats,Joe Biden Was Running During A Parade And Twitter Loved It
,democrats,"Dems interrupt Kavanaugh hearing, asking that it be adjourned"
,democrats,"They’re destroying their Nike stuff because they hate Michael Jordan, right?"
,democrats,Democrats raise alarm over White House decision to withhold Kavanaugh documents
,democrats,"Maybe Trump’s incredible poll drop is real: Bolstering the theory that the trade wars are a turnoff, Trump’s numbers “among rural dwellers plunged 15 points — going from 60% to 45%.”"
,democrats,"Matthew Miller: ""If the Trump era ends in impeachment, the president trying to undermine cases brought by the Justice Department against his political allies should figure prominently. This is open corruption."" -- Donald J. Trump: ""Two long running, Obama era, investigations of two very popular..."""
"In her Op-Ed today in NYT called ""Mourning McCain, and America"" Michelle Goldberg has sharply rebuked Trump and the Republicans for being so anti-McCain, by adding this line that said ""The bipartisan establishment is gone. Is it O.K. to miss it ?""

To that article of Michelle, I like to add that the funeral of a ""Maverick"" John McCain has shown the contrast between a hero and an ugly human being called Trump.

Trump who's built a career degrading and insulting contestants in his talk show, is repeating his act while sitting in the White House.

He came into political arena first by trying to dehumanize our first Black president Obama by questioning his legitimacy to the throne by calling him a non-American. Even Obama's revealing the original birth certificates didn't convince the son of a racist monster called Fred Trump who might've lynched an unverifiable number of Black and minority folks in his lifetime.

So to the psychiatrists and psychologists, it is quite natural that a son of a vicious racist murderer has to be another racist murderer. 

Just like his father, there is hardly any account about how many murders or tortures of Black and minorities that Trump had ordered in his lifetime. 

But even without any evidence we know that Trump is capable of committing totally racist actions because we've seen him praising the White Supremacists/ Nationalists who not only killed an innocent woman but tore up the reputation of a peaceful town in Virginia by starting a pitched battle against the their opposition members who didn't like their chanting of Nazi slogans,""Blood and soil"" and ""Jews won't replace us.""

What did Trump say to those anti-Jew, anti-Black and anti- minority haters ?

""They're good people.""",democrats,Mollie Tibbetts's father literally slapped the faces of Trump and the Republicans' by warning them not to exploit her death for political purposes.These racist bastards never said a word against White Supremacists/Nationalists' mass shooters who killed hundreds of Americans in hundreds of schools.
,democrats,#FATT -Farmers Against Trump's Tariffs
,democrats,"Like frogs in a slowly boiling pot, Americans are finally realizing how dire their labor situation is"
,democrats,Nike Names Colin Kaepernick as Face of Their ‘Just Do It’ Campaign’s 30th Anniversary
,democrats,LISTEN: Beto O’Rourke’s First Album Springs Up Online. It’s Pretty Damn Good.
,democrats,"My Children Were Denied Passports Because They Were Delivered by a Midwife: In border states, the latest erosion of American citizens’ rights. My sons have never been outside the United States, but their passport applications were denied by the State Department."
,democrats,"For Democrats, hopes of defeating Brett Kavanaugh's nomination lie with public"
,democrats,"If You’ve Been Enjoying All the Donald Trump Subtweets at John McCain’s Funeral, You’ll Love This Anti-Trump Film the U.S. Government Produced in the 1940s"
,democrats,MSNBC guest mocks Trump: It's exhausting to pretend like he knows what he’s talking about
,democrats,Kavanaugh hearings to launch Tuesday amid fresh Democratic calls for a delay
,democrats,"Donald Trump Isn’t the Victim of a Witch-Hunt. He’s Leading It. -- From the 14th century to McCarthyism, the president’s predecessors were the ones doing the hunting. Now Trump claims to be the victim, when in fact he’s the witch-finder general."
,democrats,"Kamala Harris on Twitter: ""Remember that this president is an unindicted co-conspirator in a felony criminal investigation and should not have the ability to appoint someone to a lifetime position on the Supreme Court. Kavanaugh's hearing should be delayed until the investigation is resolved."""
,democrats,Rudy Giuliani Says He’s ‘Sure’ Trump Will Try to Block Public Release of Mueller’s Final Report
,democrats,Chicago Mayor Rahm Emanuel Announces He Won’t Run For Third Term
,democrats,"Trump could push Germany toward Russia and China, veteran diplomat says: The longer Donald Trump stays in office, the higher the risk that anti-American forces will gain the upper hand in Germany and push it into the arms of Russia and China."
,democrats,"Obama readies fall campaign push, but some Dems say no thanks"
,democrats,"Some history: Racists can be defeated (even in the Deep South in the 50's) ""The Battle of Hayes Pond"". Let's do it again, this November!!"
,democrats,Democrats Need to Show a Whole Lot of Solidarity With Labor in 2018
,democrats,"Hillary Clinton: Happy Labor Day. There's no better time to talk about why workers’ rights would suffer if Brett Kavanaugh, whose hearings for a lifetime appointment to the Supreme Court start tomorrow, is confirmed."
,democrats,"Donald Trump’s war on workers: Trump benefited greatly when he told workers the system was rigged against them. He was right, but what they didn’t understand was that when he got into office he’d work to rig the system even more starkly in favor of the wealthy and powerful."
,democrats,"Joe Biden is running, literally - CNN Video"
,democrats,U.S. women see reason to reject Trump SCOTUS pick Brett Kavanaugh
,democrats,"Biden on how Dems should handle Kavanaugh hearing: 'Stay in the room, demand answers'"
,democrats,"Democrats, Eyeing a Majority, Prepare an Investigative Onslaught: House Democrats, increasingly optimistic they will win back control, are mining a mountain of stymied oversight requests for an onslaught of hearings, subpoenas and investigations into nearly every corner of the Trump administration."
,democrats,"Haley Byrd: ""congrats to everyone who supported trump because he said he was the law and order candidate"" -- Donald J. Trump: ""Two long running, Obama era, investigations of two very popular Republican Congressmen were brought to a well publicized charge, just ahead of the Mid-Terms, by the Jeff..."""
,democrats,Trump loyalist Nunes finds himself in tighter race than usual as Democratic rival rises in the polls [CA-22]
,democrats,Fmr U.S. Attorney on Trump’s Renewed Attack Against Sessions: ‘Reprehensible Conduct by a President’
,democrats,"John Weaver on Twitter: ""We have a ""president*"" publicly urging his AG to obstruct justice &amp; all the while nominating (&amp; getting them confirmed) judges -- many of them unqualified or worse -- without so much as a speed bump by this Senate. WTF!"""
,democrats,"Labor Day in Trump’s America: His administration is presiding over the biggest decline in worker rights most of us have seen in our lifetimes. Whenever there is a choice to be made, Trump favors the perceived needs of the plutocratic class at the expense of almost anyone who earns a paycheck."
,democrats,"Dave Itzkoff: ""so hard-working, he obstructs justice even on federal holidays"" -- Donald J. Trump: ""Two long running, Obama era, investigations of two very popular Republican Congressmen were brought to a well publicized charge, just ahead of the Mid-Terms, by the Jeff Sessions Justice..."""
,democrats,Biden hits the trail like he's running
,democrats,Why Aren’t Democrats Waging an All-Out War to Stop Kavanaugh’s Confirmation?
,democrats,Trump has visited his golf courses on 25 percent of his 590 days in office
,democrats,My message to Trump supporters
,democrats,A blast from the past!
,democrats,Brett Kavanaugh hearings are the start of something big
,democrats,Carter Page Takes to Twitter to Weigh in on FISA Warrants in the Most Bizarre Way Possible
"Politico currently showing these 2 articles side by side.

[Trump woos labor unions as he tears up NAFTA](https://www.politico.com/story/2018/09/03/trump-nafta-labor-unions-806291)

[Trump rolls back worker safety rules](https://www.politico.com/story/2018/09/03/trumps-worker-safety-regulations-protections-unions-806008)

Well, injured workers can still vote as long as they're not too injured.",democrats,Helluva Juxtaposition
"In today's OP-ED ""They Sat in Hypocrisy"" in NYT David Leonhardt gave a clear picture of what those Republican honchos are, the ones attended John McCain's funeral sitting near the front  in Washington National Cathedral  : They're hypocrites. 
 
David was also right when he told us this in his piece ""Congressional Republicans made a show of honoring John McCain even as they continue to reject his principles.""

To David's lines I also like to add that if hypocrisy was the only word in the dictionary to describe what the congressional Republicans are, then maybe we could give them a pass.

But there are some real ugly words written in the dictionary that could be used here to describe a bunch of 'compromats'.

From being strong Russia foes, the current Republican Party is Russia  lovers now.

They forgot that their ideal president in the eighties Ronald Reagan hated Soviet Union then. He was the president who said famously on June 12,1987,""General Secretary Gorbachev, if you seek peace, if you seek prosperity for the Soviet Union and Eastern Europe, if you seek liberalization, come here to this gate ! Mr. Gorbachev, tear down this Wall."" 

No wonder then General Secretary of Soviet Union Mikhail Gorbachev got scared and tore down the Berlin Wall separating West Germany and it's eastern communist counterpart. Russians then, unlike now under their current President Putin, didn't hesitate to do what an American president wanted them to do because of a 3 : 1 advantage in nuclear arsenals that our United States had over Soviet Union throughout the eighties.

Even Democratic President Kennedy before that caught the First Secretary of the communist Party of the Soviet Union Nikita Khruschev's bluff in 1962 and forced him to withdraw all the nuclear missiles from Cuba after our American president made them to sign an agreement on November 20,'62. This humiliating experience for a Soviet leader happened after a harrowing and very frightful 13 days, known as Cuban missile crisis that started on October 16th and lasted till October 28th, in 1962.

But what are the current honchos in the G.O.P. are doing right now?

They're giving in to their current president Trump's demands that America should be subservient to the current Russian premier Putin, no matter what.

No wonder the big shots of the Republican party are now doing just that . 

Although this bunch of Republicans looked so quiet and respectful looking at the coffin of Mr. McCain at the Capitol rotunda but that was just a front, nothing else . 

What we didn't notice on our tv screens was that although the big names from the Republican party stood in silence and looked mournful at their Senator John McCain's funeral but we know for sure that they'd not do what their friend and ex-colleague wanted them to do.

These Republican leeches have no desire to show any true respect to the ""Maverick""'s real desire before he succumbed to the brain cancer : to stop Russia from meddling in our elections.

Why ?

Because Mr. McCain's Senate and House leaders know only one thing, ""Country be damned if we can't keep the congress in our control.""

Go figure !",democrats,Trump's leeches in the Republican Party tried to put up a front at Senator McCain's funeral. They tried to show us that they'd follow his wishes. But as soon as they left the church they're back into using Trump's Russian friends to hack in to the Dem members' computers to win their midterms.
,democrats,Amazon is paying employees to tweet positive stories
,democrats,Durbin: White House is saying 'American people have no right to know' Kavanaugh’s background by withholding documents
,democrats,"Trump rolls back worker safety rules: 'We want to protect our workers,' Trump said in 2017. But his administration has weakened measures designed to keep them safe. Trump's deregulatory moves on worker safety are at odds with his public stance as a champion of working class Americans."
,democrats,"At 86, She Was 'About Ready to Give Up.' Then a New Apartment Saved Her Life."
,democrats,Kavanaugh Thinks Presidents Should Unilaterally Declare Statutes Unconstitutional
,democrats,Hillary's Problem Wasn’t Emails. It Was Challenging Stereotypes
,democrats,Former Obama Attorney General Eric Holder interviews with Stephen Colbert
,democrats,Republicans who accept Trump's endorsement are validating his misconduct
,democrats,A Handy List Of Trump’s 2017 Inaugural Committee Members
,democrats,GOP strategists fear candidates will get steamrolled in midterms: They only know how to 'run against Obama'
,democrats,"How Trump Betrays ‘Forgotten’ Americans: From the Supreme Court to labor organizing rules, the president undermines workers’ greatest champions."
,democrats,John Kerry: Trump 'really just doesn't know what he's talking about. He makes things up.'
,democrats,"Oldie, but goodie: Trump's bid for Sydney casino 30 years ago rejected due to 'mafia connections’"
,democrats,"Trump 'Is Mentally Ill,' Doctor and Former Vermont Governor Howard Dean Says"
,democrats,"Fox News’ Kurtz on Trump Attacking CNN, NBC Chiefs: Imagine If Obama Went After Ailes Like That"
"The  U.S. Executive Branch has utilized propaganda techniques since, well,  its founding. Decade after decade, presidents and his respective  cabinets have manipulated public opinion as a means to an ends -  rallying for war, tax cuts, wearing sweaters. Now, under Trump, a new,  incredibly effective propaganda technique - [The Firehose of Falsehood](https://youtu.be/nknYtlOvaQ0) \- is being tested. There are no apparent counter. There are no apparent legal limits.

The  Firehose of Falsehood technique is used in Russia, and is now adopted  by President Trump, to great affect. It comprises the following  elements:

* Propaganda (such as a lie about taxes) are put out in high-volume and multichannel
* Propaganda is disseminated without regard for the truth
* It is rapid, continuous, and repetitive, and
* Lacks commitment to consistency.

**Are there legal limits to American propaganda? What are they?**

&amp;#x200B;",democrats,"Does White House's ""Firehose of Falsehood"" propaganda technique have legal limits?"
,democrats,Sleepy Ben
,democrats,Schumer Calls Withholding of Kavanaugh Documents “Friday Night Document Massacre”
,democrats,Former CIA Chief Leon Panetta: Mueller ‘Very Close to Making a Case for Obstruction of Justice’ Against Trump
,democrats,Bernie Sanders' Newest Social Security Bill Calls for Sweeping Changes
,democrats,"They Sat in Hypocrisy: Congressional Republicans made a show of honoring John McCain, even as they continue to reject his principles. Despite running a branch of government the Constitution makes equal to the presidency, they meekly assented to Trump. Entrusted with power, they chose complicity."
,democrats,"Trump's medieval sense of order: Trump ran for office on an anti-corruption platform — ""Drain the swamp!"" — and yet he himself is significantly corrupt. For Trump, society has a definite hierarchy that must be preserved. As president and a wealthy, white businessman, his own rank is the highest."
,democrats,"Is Trump a Champion of Workers? His Anti-Union Policies Indicate Otherwise: Trump has decreased labor protections, rolled back worker safety and weakened federal unions during his presidency. ""If you think of his base as ordinary workers, it definitely doesn’t benefit them at all."""
,democrats,"Patton Oswalt on Twitter: ""Colin Kaepernick should get off his damn knees during our National Anthem and do something respectful like Tweet and play golf."""
,democrats,"Asha Rangappa: ""Don't give Russian intelligence officers a ride"" -- Carter Page, Ph.D.: ""From his perch among legal scholars, perhaps @OrinKerr might offer his counsel for an innocent soul going 29 in a 45 mph zone: What does precedent, or esteemed Secret Society textbooks, prescribe in such cases?"""
,democrats,Conservative Matt Lewis explains how the death of McCain is a metaphor for the death of the GOP
"I am an NYC dweller and all of our races are essentially noncompetitive, but I still really want to personally help create a blue wave in the midterms. I am willing to take a week off work in late October and fly somewhere (e.g. Indiana, West Virginia, Texas, etc.) to help with a Senate or House race if there is someone local to put me up for the week. 

Is there some kind of service that links people looking to help with people looking to host? ",democrats,Traveling somewhere competitive to help a Democrat win
,democrats,"Kenneth P. Vogel: ""HELSINKI SUMMIT UPDATE: We still don't know exactly what TRUMP &amp; PUTIN agreed to. BUT, I can now report that the White House Communications Agency's team did in fact produce a challenge coin commemorating the occasion. Alas, it does not feature the faces of Trump &amp; Putin."""
