,selftext,subreddit,title
210,,Democrat,Nancy Pelosi Says It’s ‘Unjust And Cruel’ To Arrest Illegal Alien Sexual Predators
211,,Democrat,Report: Rising Democratic Star Megan Barry to Resign as Mayor of Nashville Due to Sex Scandal
212,Can we make Republicans a third party together? What would it take on our end?,Democrat,How do the Greens get along in California?
213,,Democrat,"The NRA Has Gained 500,000 New Members Since The Parkland Shooting"
214,,Democrat,Dem Mayor Faces Decades In Prison For Corruption
215,,Democrat,"Georgia Senate approves tax bill, snubbing Delta in NRA feud"
216,,Democrat,Bernie Sanders Fined For Illegally Coordinating With Australian Labor Party
217,,Democrat,BleachBit 2.0 Released
218,,Democrat,"The Sheriff's Office is composed of 5,800 employees,[5] including approximately 2,800 certified deputies and approximately 600 firefighters.[3] The BSO budget is approximately $700 million annually. How can this many not protect against 1 shooter?"
219,,Democrat,"In blow to Dianne Feinstein, California Democrats won't endorse Senate run"
220,,Democrat,CNN Town Hall BOOS Rape Victim Who Wished She Had a GUN
221,,Democrat,Sheriff Israel a Muslim? Terrorist attack?
222,,Democrat,"As Obama Presidential Center comes closer to reality, tensions on race, class surface"
223,,Democrat,"Democratic women slam Trump for not backing abuse victims, saying he is 'quick to doubt'"
224,,Democrat,Don’t Putin a President - Autocracy at your Doorstep
225,,Democrat,Fox News is mad that PA gerrymangering is stopped
226,,Democrat,Columbine survivor introduces bill to expand concealed-carry in schools
227,,Democrat,John Kerry Approved Visas for Russian Operatives to Enter US in 2014 and 'Interfere' with Election
228,,Democrat,Warren addresses claims of Native American heritage - The Boston Globe
229,,Democrat,They are so cute together
230,,Democrat,Lincoln
231,,Democrat,BTFO!! - DHS Statement on NBC News Coverage of Election Hacking. DHS says CNN and the rest of MSM is fake news!!!
232,,Democrat,"RESIST? New Poll Finds Voters Trust GOP Over Dems on Economy, Jobs, National Security...and Immigration"
233,,Democrat,Shit House Opportunity- Op-Ed response to President Trump's shithole comment - Slanted Online
234,,Democrat,Why NO ONE Should Trust Mainstream Narratives
235,,Democrat,Seven Reasons to Beware the Southern Poverty Law Center
236,,Democrat,"BOOOM: Obama now implicated. Page to Strzok new texts Page to Strzok new text messages: ""OBAMA WANTS TO KNOW EVERYTHING"""
237,,Democrat,My Scandal Free Legacy
238,,Democrat,Trump tops Obama's approval rating for the first time!!! 49% v 46% (2/6/2018 -- 2/6/2010)
239,,Democrat,The real reason Schiff wants Trump's nudes
240,,Democrat,"THIS DID NOT AGE WELL: April 10, 2016 Obama: ""I do not talk to FBI directors about pending investigations."" September 10, 2016: Texts from Strzok/Page reveal Obama specifically asked Comey to KNOW EVERYTHING THE FBI WAS DOING RELATED TO THE HILLARY INVESTIGATION. 𝐂𝐎𝐑𝐑𝐔𝐏𝐓𝐈𝐎𝐍"
241,,Democrat,Remember when the party of diversity was represented at the rigged Democratic primaries by two privileged old white people?
242,https://www.reddit.com/r/Republican/comments/7vswtl/10_years_ago_i_paid_400_for_ins_for_my_6yo/?st=JDCH01LA&amp;sh=b6781f79,Democrat,Obamacare has destroyed the healthcare system in America
243,,Democrat,Dems Lose It as Tweet Suggests Trump Ordered Military Vet Deported... Fail to Realize It Was Actually Obama
244,,Democrat,Toxic Air Pollution at U.S. Schools Most Impacts Students of Color
245,So why is this Annon dude shitposting this subreddit liken 90% of the time? Does he have anything to do with his life?,Democrat,Wtf
246,,Democrat,Feds Arrest Democrat Texas State Judge Near Border
247,,Democrat,Democrats have a long history of division.
248,,Democrat,BREAKING NEWS
249,,Democrat,Joe Kennedy For President 2020 SOTU Democrat Response
250,,Democrat,Dems have no money. No respectable leaders. A platform of higher taxes and more illegal immigration. 2018 wave may wash them away forever.
251,,Democrat,Wages Rise at Fastest Rate in More Than Eight Years
252,,Democrat,Breaking: The White House releases a very detailed breakdown of ending the VISA LOTTERY program in the new immigration reform framework
253,,Democrat,"""House Intel Democrat Eric Swalwell just said the Memo release will “torch every floor of the FBI” Guess it’s not a “dud” then"""
254,,Democrat,"Trump Approves Releasing GOP Memo Alleging FBI Abuses. President Donald Trump has decided to allow publication of a Republican memo arguing the FBI abused its surveillance powers in its Russia probe, and is unlikely to redact any of the contents of the document, a White House official said."
255,,Democrat,WSJ Columnist Explains Why This FISA Memo Tantrum By Democrats Doesn't Matter
256,,Democrat,Democrats be like:
257,,Democrat,MAXINE WATERS: Russia is out to get me! - The American Mirror
258,,Democrat,Am I doing this right?
259,,Democrat,I've never seen a political party so angry the country is doing well as the Democrats are
260,,Democrat,Millions will learn the truth about their “scandal free” President obama when GEOTUS releases the memo! Tomorrow morning lads!
261,,Democrat,AMAZING! Trump Just Donated His ENTIRE Salary To A Cause That Will Make You Cry Tears Of Joy
262,,Democrat,"I know it's a day late to be picking on poor Drooling Joe, but I thought I'd leave this here anyway.... :)"
263,,Democrat,"Extry Extry; Read all about it! -- Your fourth Historically Accurate meme of the day. (Do we have the finer tradition or what, folks?!)"
264,,Democrat,Typical democrat today.
265,,Democrat,"5th historically accurate meme of the day--You didn't think I wasn't going to bring this up to present-day, did you?"
266,,Democrat,Democrats: The party that literally stands for nothing. #DrainTheSwamp
267,,Democrat,Democrats disgusting legacy. Images show brutal reality endured by slaves in America. Know your history! ( wonder how many downvotes this gets)
268,,Democrat,"Be prepared, pedes!! Democrats and their propaganda arm, the MSM, are about to embark on the biggest misinformation campaign in American history."
269,,Democrat,"After the Dems got 15sec of fame with Kichael Wolff "" Fire and Fury"" now they are calling him full of shit."
270,,Democrat,FBI Officials Just Issued Another BLOW to Dems With FISA Memo Review • u/Lara_01
271,,Democrat,Joe Manchin: Democrats were 'wrong' to sit for Trump's speech
272,,Democrat,Trump surge traps Democrats in ‘resistance’
273,,Democrat,Never Sit on a Democrat's Lap
274,,Democrat,Nearly 46 Million Viewers Watch President Trump's State of the Union Address &amp;amp; 80% Liked It - Dems In Panic!
275,,Democrat,REMINDER FOR DEMOCRATS AND LIBERALS: Not fully supporting the release of the memo is LITERALLY TREASON
276,,Democrat,Hard-Right Nationalist gives racist speech praising outdated ideals that support the patriarchy...
277,,Democrat,There’s no other way to say this — THESE HYSTERICAL BITCHES ARE FUCKING OUT OF THEIR GOD DAMNED MINDS 😂
278,,Democrat,Democrats Boo America
279,,Democrat,I neeeeeeds!
280,,Democrat,"Monmouth poll: Democrats 47, GOP 45 (was Dems +15 in December!!)"
281,,Democrat,ISLAMIC RAPE CULTURE: German Women Launch Campaign Highlighting Increased Violence Against Women as a Result of Mass Migration
282,,Democrat,the “Blue Wave”. lulz
283,,Democrat,The nasty left
284,,Democrat,My response when a Dem says there's going to be a blue wave in 2018
285,,Democrat,The Future of the Democratic Party
286,,Democrat,"Without illegals &amp;amp; DACA's votes, the Democrats will get wrecked in 2018 and beyond."
287,,Democrat,The truth
288,,Democrat,"Hey guys, can you stop making us look like a bunch of pussies? Thank."
289,,Democrat,Democrats... the party of lemmings.
290,,Democrat,Joe Kennedy mystery substance explained
291,,Democrat,YOUR FAVORITE PRESIDENT
292,,Democrat,"If you missed the SOTU last night, here is a summary of what the Democrats did 99.9% of the time."
293,,Democrat,Americans Have Dreams Too #SOTU
294,,Democrat,"Dear so-called ""Liberals"", You don't cheer for God, country, family, military, cops, African American and Hispanic prosperity, a booming economy, lower taxes, rising wages, or a fair deal for DACA, and you only cheer for Children who want to mutilate their genitals. Maybe it's time to start asking:"
295,,Democrat,Pepe steps in to help
296,,Democrat,"Fun fact: Throughout the tenure of Secretary of State Hillary Clinton, there was no permanent Inspector General at the State Department. Moreover, President Barack Obama did not nominate anyone for that position while she was Secretary. THIS IS ALL STARTING TO MAKE SENSE!"
297,,Democrat,Sorry Democrats...
298,,Democrat,"After 24 Years In Congress, Corrine Brown Starts New Life In Prison"
299,,Democrat,Cherokee Woman Blasts Elizabeth Warren: 'We've Asked Her to Stop' Claiming Our Ancestry
300,,Democrat,Jack Posobiec: Should Russian illegal aliens be given the right to vote in our elections?
301,,Democrat,"Pedes, haven't seen this pop up here before. Norman claiming ""Nunes memo"" was ""uncovered,"" not ""written by Rs."" Bit of slipped intel?"
302,,Democrat,"If you are from Oklahoma, Id suggest contacting this cuck Sen. Lankford. and his America last Legislation. https://www.lankford.senate.gov/contact/email"
303,,Democrat,Still not Americans
304,,Democrat,"Not THIS TIME, Sergei, this time AMERICA Votes and you can’t take my Voter Rights away."
305,,Democrat,Obama DOJ appointee explains Mueller will NOT indict Trump. Liberals not pleased.
306,,Democrat,Daily reminder that this woman will never be President of the United States
307,,Democrat,The Democrat party platform
308,,Democrat,Some Detroit businesses question fairness in Green Light crime fight
309,,Democrat,Can We Now Discuss Where Barack Obama Was Born? - American Digital News
310,,Democrat,"The United States Constitution. The words ""Offended"" and ""Hurt Feelings"" are not in it."
311,,Democrat,"Feinstein calls on Trump to help clean up Tijuana sewage impacting border patrol agents, beachgoers"
312,,Democrat,Social media continues further into madness tonight.
313,,Democrat,"Baltimore’s Police Department Is A Complete Disaster - Federal corruption investigations into nine of its officers, its police commissioner was fired last week, and now two other top cops have resigned. - Living in a Democrat Paradise - Where the cops practice racketeering, plant drugs, &amp; guns"
314,,Democrat,Obama may not have cleaned up his breadcrumbs after all - Clinton–Obama Emails: The Key to Understanding Why Hillary Wasn’t Indicted. New FBI texts highlight a motive to conceal the former president’s involvement.
315,,Democrat,Senator Chuck Grassley Confronts FBI and Justice Department – Asks Full Senate To Review Criminal Referral For Christopher Steele… GET THE NOOSES READY! CLINTON OBAMA TREASON!
316,,Democrat,When POTUS Trump won in 2016 Democrats said they were moving to Canada.Why not Haiti El Salvador or Africa? Seems rather racist to flee to a White Country.
317,,Democrat,"DETAILED TIMELINE Showing Obama HEADED Crooked's Fixed Email Investigation To Protect HIMSELF: Barry Even Sealed HIS Emails To/From HRC With Executive Privilege While Claiming He Did Not Even Know Of Them! GET IN HERE, PEDES!"
318,,Democrat,Media Forced To Hang Heads In Shame As Tom Cotton Reveals What Really Happened In Meeting Yesterday
319,,Democrat,"There, I didn’t spam from t_d on this one."
320,,Democrat,SOON!
321,,Democrat,Smarter than the avg Democrat
322,,Democrat,Red to Blue Effort Underway
323,,Democrat,"The more Democrats screw up, the more support they lose. The people who still support the Democrats get louder to cover it up. They're creating their own illusion of being the majority. Bluemeltdown2018 is going to be delicious!"
324,"Hi everyone. I am a political moderate who is interested in pursuing both sides of the issue.

The following is just some reflections I have been working on from the Devils advocate position of the Iraq war being necessary.
I know youll hate me for it, but Im curious as to your opinion


It is almost common consensus that the 2003 invasion of Iraq was a mistake at best, and at worst, the worst foreign policy decision in recent years. However, coming to either conclusion one would have to overlook facts and circumstances that led up to the invasion itself. The undisputed facts about Saddam Hussein and the time period between the two gulf wars would indicate that a second war with Iraq was only a matter of time. The current situation with North Korea and the Trump administration helps illustrate the potential danger of letting rogue states slowly grow in power and influence. Saddam’s regime was in some ways more dangerous and unpredictable than North Koreas. By the time of the Iraq invasion, it had started a brutal war with Iran, used chemical weapons on its own people, invaded and occupied Kuwait and launched missiles into Saudi Arabia and Israel. During the 1990s, Iraq was constantly visited by United Nations Weapons Inspectors, seeking to investigate and stop Iraq’s suspected development of Weapons of Mass destruction activity.  Iraq ceased cooperation with the inspectors in 1998, and UN inspections would not resume until 2002.

President Bill Clinton acknowledged the threat Iraq posed,  when he signed into law the Iraq National Liberation act of 1998. With nearly universal support of the U.S Congress the Act made leant official US support to helping democratic opposition groups replace Saddam’s government, citing Saddam’s potential Weapons of mass Destruction capabilities as  as only one of many justifications for the act which included:

1.	The Iraq instigated 1980-1988 Iraq-Iran war, which resulted in nearly 2 million casualties, including chemical attacks on the Kurds, an ethnic group native to Northern Iraq
2.	Iraq’s violation of terms of the 1991 Gulf War Ceasefire, (which  included moving troops to the border of Kuwait in 1994 and attempting to invade and control the autonomous Kurdish region in the North)
3.	The attempted assassination by car bomb of  the Emir of Kuwait and former President George H.W Bush in 1993. 

All of these undisputed facts led to a bi partisan consensus that Saddam’s regime was a potential security threat that had to be addressed. 

Although the Saddam Hussein regime had no role 9/11 attacks and was not officially allied with Al-Qaeda it was a supporter of terrorism in the region and around the world, and paid host to several terrorists including.

1.	Abu Nidal, Palestinian terrorist (top of FBI’s most wanted  list before Osama Bin Laden.

2.	Muhammad Abbas (of the 1985 Achille Lauro hijacking)

3.	Abdul Rahman Yasin who mixed chemicals for first 1993 WTC attacks.

4.	In addition to inviduals Saddam helped finance the 2000-2001 Palestinian Intifadah against Israel, awarding cash rewards  (of up to x amount of dollars)  to the families of the deceased. 


In conclusion, Saddam Hussein’s regime was uniquely brutal and troublesome on a level unmatched by most of the United States adversaries, including Iran. With it’s history of terrorism, WMD development, and unprovoked war,…..(will finish conclusion.)
",Democrat,Iraq War justified!
325,,Democrat,"On shutdown, Democrats have a lot of explaining to do"
326,,Democrat,California Has the Highest Poverty Rate in America. Why? | Jon Miltimore
327,,Democrat,"WARNING: Puerto Ricans watch out, there must be another Clinton wedding on the horizon"
328,,Democrat,JW Pres. Tom Fitton on #ReleaseTheMemo: Was Trump Dossier Used for FISA Warrants Against Team Trump?...
329,,Democrat,Everything we're dealing with revolves around law breaking: Illegal Immigration. Illegal Spying. Illegal Votes. Illegal finances. Illegal drug/weapon trafficking. Illegal use of information.Seems to me we have a Justice problem in this country. Where's the blindfold?
330,,Democrat,"How will the Reconquista be accomplished? Today, millions of Mexican illegal immigrants are pouring into the United States. None of these illegal aliens are checked in any way. They live in the United States while swearing their allegiance to Mexico."
331,,Democrat,Donald Trump: I'm with the American people (in contrast to the losers who choose foreigners over their own countrymen and expect us to foot the bill!)
332,,Democrat,"'It was Moscow's victory, after all': At least 6 Putin-allied Russians reportedly attended Trump's inaugural celebrations"
333,,Democrat,"Its far past time to stop using the word ""Immigrant"", when the law specifically calls them ""Aliens"". Stop trying to change what you cannot."
334,,Democrat,"Elizabeth Warren’s Native American claims will not go away, now a fresh investigation raises more questions"
335,,Democrat,"""I think you should be reminded of my feminine penis"""
336,,Democrat,Trump 2020
337,,Democrat,OOPS! Billionaire Couple Found Murdered in Their Toronto Home Are Linked to Clinton Foundation’s Relief Efforts
338,,Democrat,"""Drumpf is mentally insane!"" said the womyn dressed like a vagina."
339,,Democrat,Liberal logic.
340,,Democrat,This shutdown is the perfect opportunity for the GOPe to do their job for once. We dont need democrats anyway.
341,,Democrat,If the Memo is about to be released... There will be a mass shooting to distract from it.
342,,Democrat,"The NSA loses tons of data? GEE, what a """"""COINCIDENCE"""""" #ReleaseTheMemo"
343,,Democrat,Cuck Schumer in 2013: Democrats would never shut down the government over immigration because it would be chaos. Make Schumer eat his own words!!
344,,Democrat,STOP PLAYING DEFENSE WITH THE DAMN SHUTDOWN AND GET BACK ON THE OFFENSIVE BY PUSHING #RELEASETHEMEMO!
345,,Democrat,#AMERICA First!
346,,Democrat,Dems are so lazy. They loved our #SchumerShutdown meme &amp; website so much that they got original with #TrumpShutdown. But their website isn’t done yet.
347,,Democrat,Democrats care more about illegal's votes than working for U.S. citizens. #Democratspreferillegals
348,,Democrat,365 DAYS SINCE WE TRADED IN AN ACTUAL fascist DICTATOR &amp; HIS HUSBAND MICHEAL for OUR GOD EMPEROR PRESIDENT AND HIS INCOMPARABLE GODDESS EMPRESS FIRST LADY !!! 365 days of winning and reeees !! LONG LIVE THE KING !!!!!!!
349,,Democrat,“This is the One Year Anniversary of my Presidency and the Democrats wanted to give me a nice present. #DemocratShutdown”
350,,Democrat,Trump-state Dems introduce bill to withhold lawmaker pay during shutdown
351,,Democrat,Donald Jr: Prediction: Democrats will take an even stronger stance on shutting down the govt so that becomes the narrative rather than talking about the release of the apparently very damaging memo. Media will obviously be complicit in helping them! #releasethememo
352,,Democrat,US politicans demand private memo 'worse than Watergate' is released
353,,Democrat,"""When we use phrases like 'undocumented workers,' we convey a message to the American people that their government is not serious about combating illegal immigration, which the American people overwhelmingly oppose"" — Senator Chuck Schumer, 2009."
354,,Democrat,/pol/ figured it out. Meme this EVERYWHERE. Trick the LEFT into supporting #RELEASETHEMEMO
355,,Democrat,Twitter just banned the House Special Committee on Intelligence’s twitter account....let that sink in
356,,Democrat,"3/4 of terrorists convicted in the U.S. were foreign born. Deportation officers had more than 2,500 encounters last year with people on the FBI’s terrorist watch list. Kirstjen Nielsen called the findings “truly chilling” and said that it doesn’t capture the full extent of the threat of terrorism"
357,,Democrat,"Nancy Worley, Head Of Alabama Democratic Party, Indicted On 10 Felony And Misdemeanor Charges"
358,,Democrat,"🌩️[RELEASE THE MEMO]🌩️“It's troubling. It's shocking,” North Carolina Rep. Mark Meadows said. “Part of me wishes I didn't read it. I don’t want to believe that those kinds of things are happening in this country that I love so much.”🌩️"
359,,Democrat,"GOP Rep. Gaetz Calls on House to Release 'Important Intelligence Document' - Goes to 'Very Foundations of Our Democracy,' Involves FBI, DoJ and Trump - Breitbart"
360,,Democrat,‘SH*T IS ABOUT TO HIT THE FAN’: Ex-Secret Service Agent Warns ‘Devastating’ FISA Memo Set To ‘Expose’ Obama. Stop teasing and start executing the treasonous racists from the last administartion.
361,,Democrat,Obama’s Timeline of Treason: How Democrats Tried to FIX the Election
362,,Democrat,CNN's Reaction When the Damning Memo is Released
363,,Democrat,Classified Intel Memo Compiled by House 'Deeply Troubling' and Raises 'Serious Questions' About the Russia Investigation - And also about the DNC's and Hillary's involvement...
364,,Democrat,John McCain Associate Connected To Steele Dossier Begs Judge To Seal Deposition For 'Personal Safety' Reasons
365,,Democrat,Let me get this straight - NBC news had a crew inside the Hawaii emergency operations bunker the day before the false alarm? (proof)
366,,Democrat,"Democrats Admit to Wanting to Shutdown the Government. Imagine putting illegal aliens before the military, yep Democrats."
367,,Democrat,Thank goodness Obama is returning to politics in 2018!
368,,Democrat,"Dems Think 800,000 Illegal Immigrants Are Worth Forcing Active Military To Go Without Pay"
369,,Democrat,"She should see prison time for stealing the nomination from Bernie. We could have had ""Real"" Socialism for the first time in world history."
370,,Democrat,Illegal Aliens give California 3 stolen seats in Congress.
371,,Democrat,'Info Suggests Documents Catastrophically Bad For Dems': Leaks Dry Up After Adam Schiff Reviews FISA Abuse Proof. What are the democrats afraid of? The end of the Democrat Party is near.
372,,Democrat,Living proof that term limits are needed.
373,,Democrat,"DEMOCRATS Are Putting 800,000 Illegal Immigrants And Their Extended Families Ahead of Active Duty Military Members. Of course they are, they need voters, and majority military arent democrats."
374,,Democrat,Obama's Timeline of Treason: How Democrats Tried to FIX the Election
375,,Democrat,Republicans Are Trying to Dismantle the Backbone of US Immigration Policy
376,,Democrat,Why is liberal California the poverty capital of America?
377,,Democrat,"Trump is commonsensically undoing, piece by piece, the main components of Obama’s legacy."
378,,Democrat,"We need just 41 Senators to stop Congress from reauthorizing and expanding unconstitutional NSA spying powers. The vote is Tuesday, January 16th"
379,,Democrat,"White Supremacist, KKK Member Running for Office as Democrat"
380,,Democrat,"WE HAVE THE MOST STABLE PHYSICALLY FIT PRESIDENT EVER. (This is a video, it's just extremely stable)"
381,,Democrat,President Trump is a racist? Be a shame if he were to tweet this picture out.
382,,Democrat,Armed Feds Seize 'Massive Store' Of Rebuilding Materials Kept From PR's Hurricane Victims. Theres your democrat run shithole trying to screw their people to make our president look bad.
383,,Democrat,Rep. Tom McClintock: The question Democrats fear most
384,,Democrat,Evaluating The Damage: Immigration's Impact On Black Americans ...
385,,Democrat,Black Americans are Americans! The reason black unemployment has dropped to historical low figures is because Donald Trump wants to put Americans first above criminal illegal aliens! If Democrats cared about black Americans they would stop supporting giving amnesty to criminal illegal aliens!
386,,Democrat,Jerry Brown Threatens California Pensions
387,"This is the latest episode of a podcast that I do. Let me know what you all think.

[Website](https://idpodcast.org/episodes/2018/1/14/episode-39-foreign-and-foreigners-jan-15-2018)

[iTunes](https://itunes.apple.com/us/podcast/episode-39-foreign-and-foreigners-jan-15-2018/id1166691718?i=1000399868234&amp;mt=2)

[YouTube](https://www.youtube.com/watch?v=3-kmYLOPaO8)",Democrat,Political Podcast About Trump Foreign Policy
388,,Democrat,🚨WE ARE REACHING LEVELS OF ANTI-WHITE PROPAGANDA THAT SHOULDNT BE POSSIBLE🚨
389,,Democrat,"Biden Attacked Trump For Not Speaking Like A President, Gets Embarrassed With His Own Quotes"
390,,Democrat,"CNN Says Socialism Is ‘Cool’ In MLK Day Tweet. And with that, CNN just went full retard."
391,,Democrat,Won’t see or hear about this on mainstream media.
392,,Democrat,MLK's Niece: 'Outrageous' That Critics Are 'Unjustly' Calling Trump Racist
393,,Democrat,If Trump is a racist why did he have a black girlfriend for 2 years?
394,,Democrat,Pretty good stuff on the Uranium One indictment
395,,Democrat,Donald Deletes 13 Billion-Dollar Obama Deal In Two Democrat States
396,,Democrat,1.2M documents set to start being released tomorrow in regards to how the Clinton Email “Matter” was handled.
397,,Democrat,This keeps the patriarchy alive.
398,,Democrat,"Apparently, the Democratic party now owes black people"
399,,Democrat,DOJ's IG Report May Explode on Monday
400,,Democrat,Winfrey's cousin: 'Oprah made up poverty stories'
401,,Democrat,"""I was there on Air Force One, and I was there when the president signed the bill in honor of Martin Luther King, Jr., my uncle, making that historic site here in Atlanta, Georgia, where I live, a national park,"" Evangelist Dr. Alveda King told CBN News. In Honor of MLK Day. 🇺🇸💙"
402,,Democrat,Top Democrat Promises to Shut Down Government If DACA Illegals Are Not Given Amnesty (Video) - Please Do - You value ILLEGALS over Citizens &amp; Your District remains the Worst In Georgia Despite Your Representation since it was established - You however are wealthy
403,,Democrat,BREAKING! Major New York Dem Just Got Arrested! Got Caught Blocking An Ambulance On The Way TO The Hospital! These People Don't Care If They Kill Someone!
