,selftext,subreddit,title
0,,Democrat,America Fights back in 2020 against Russian meddling with the VOTER RIGHTS CARD!
1,"Hello! My name is James and I am conducting a research study as part of my Ph.D. program at the University of Missouri-Kansas City in Counseling Psychology. I am looking at job identity and satisfaction for those who began working after high school without attending college. I would really appreciate (a) your participation in it, or (b) you sending it on to those who meet the criteria to participate. To qualify for the study, there are three requirements: (1) be ages 18-30, (2) be currently working, and (3) have never attended a college or university. It takes **10-15 minutes** to complete.

If you participate, you can also enter your email address separately into a raffle for **one of six $15 Amazon gift cards**. Thanks for your help in this! Here's the link for the study:

[https://survey.az1.qualtrics.com/jfe/form/SV\_cHlNaNhJ7XEPQxf](https://survey.az1.qualtrics.com/jfe/form/SV_cHlNaNhJ7XEPQxf)",Democrat,UMKC Research Project-Job Satisfaction
2,,Democrat,Questioning the Legitimacy of Brett Kavanaugh's SCOTUS Seat Nomination
3,,Democrat,Walk it off?
4,,Democrat,"Sen. Warren to Parents of Murdered Iowa Teen: Sorry, We Need to Focus on 'Real Problems'"
5,,Democrat,Pelosi says impeachment ‘not a priority’ after Cohen's guilty plea
6,,Democrat,This is what male privilege looks like
7,,Democrat,Authorities: Iowa student killed by Mexican in US illegally
8,,Democrat,Al Sharpton Messes Up Spelling of Legendary Aretha Franklin's Song While Slamming President Trump
9,,Democrat,AMA candidate for NH Senate Seat District #1
10,,Democrat,There's a Science to Successfully Talking to Trump Supporters — Here's How
11,,Democrat,The Fad Of Disputing Scandinavia's Socialist Policies: A Bid To Curb The Revival Of U.S. Socialism?
12,,Democrat,"Detroit Democrat Bettie Cook Scott on Her Asian Opponent: ""Don't Vote for the Ching-Chong"""
13,,Democrat,Hillary Clinton Guest Interview | Pod Save America
14,,Democrat,High School Jewish Student and Trump Supporter Labeled a Nazi Because He Attended Trump Rally (VIDEO)
15,,Democrat,"Israel Wages Bombing Campaigns on Gaza, and US News Networks Aren’t Broadcasting the Siege"
16,"I've tried several different titles, apparently Avenatti2020 already exists but I can't find it. Avenatti For President Just gives me red text that says 'that name isn't going to work'. What's up? Is Avenatti blacklisted from having a forum? ",Democrat,Why won't Reddit let me make a Avenatti for President forum?
17,,Democrat,UFC fighter Kajan Johnson wants to punch President Donald Trump
18,,Democrat,"The BILL that opened the door for TWITTER, FB, GOOG, etc. to CENSOR &amp; CONTROL"
19,,Democrat,"670 ballots in a precinct with 276 voters, and other tales from Georgia’s primary"
20,,Democrat,Mike Lux on the Future of the Democratic Party
21,,Democrat,Illegal immigrants not exactly flocking to register to vote in San Francisco
22,,Democrat,Get It Through Your Head That Progressives Hate You
23,"To me, culture appropriation has been around for all of human history and has led to many great things. For example, Scottish distillery methods were used to make Bourbon, which is now an aspect of American culture. Tejano Music is a mixture of German and Polish Polka music and Ranchero Mexican music. If the trend of anti culture appropriation continues, I believe future cultural developments would stop. Also as someone who loves cultures, I like to participate in a lot of them. My room is Chinese themed, I like a lot of foreign music, I like making foreign dishes and have traditional shirts from other countries and I'll be damned if someone accuses me of culture appropriation for enjoying what the world has to offer ",Democrat,Serious Discussion: how do you feel about culture appropriation? Do you believe it exists?
24,,Democrat,Elizabeth Warren: America's criminal justice system is racist | US news
25,,Democrat,Andrew Sullivan: When Racism Is Fit to Print
26,,Democrat,Are Liberals and Progressives Sabotaging the Economy?
27,,Democrat,NAILED IT! Don Jr. Compares DNC To 1930s Nazi Platform
28,,Democrat,Senator Jeff Woodburn arrested after allegedly biting partner and kicking down her door Senator says he plans to fight charges in court
29,,Democrat,California Judge Rules Twitter CAN Be Sued for Falsely Advertising Free Speech | Breitbart
30,,Democrat,Feinstein was 'mortified' by FBI allegation that staffer was spy for China: report
31,,Democrat,Report: Worker pay rising at fastest pace in 10 years
32,,Democrat,"Man in prison for violent sex crimes gets 7 more years, will be deported"
33,"This is a serious question, and mods if you could chime in I would appreciate it.

My observation: Yesterday on r/videos there was a post of sacha cohen ""quinceanera"" video clip. Today it is gone and I have been banned for replying to people with pure facts about their mis-information they have on the democratic party.

It seems to me there are a handful of Moderators out there banning Americans who are trying to stop mis-information... but yet they are allowing thousands of russian trolls to just bash away.. If this happened to me I can only imagine how bad this really is.

Note: they banned me for hate speech after providing actual facts that represent the racism ongoing inside of the republican party. I was attacked by russian trolls all night trying to spin it.. did everything I could for actual facts to be presented and allow the users to decide on their own. ",Democrat,Are there Moderators on here pushing a trump agenda?
34,,Democrat,More than 100 ex-cons already lost voting rights granted by Cuomo
35,,Democrat,"Socialism Always ‘Becomes a Big Prison System at the End,’ Albanian Refugee Warns"
36,,Democrat,WATCH What Democrat Senator Said When Told Illegals ‘Broke the Law’ Video: 00:01.0
37,,Democrat,"Trump supporters pelted by eggs, punches can sue San Jose cops after attack, court says"
38,,Democrat,"Liberty Makes Us Unfree, Says the ACLU"
39,,Democrat,Government data shows the entire ‘family separation’ crisis was built of lies
40,,Democrat,Court Rules Lawsuit Against San Jose Officials By Trump Supporters Beaten to a Bloody Pulp by Violent Leftists Can Proceed
41,,Democrat,San Francisco train conductor reportedly warns riders to watch 'for needles' amid 'needle litter' epidemic
42,,Democrat,Trump secures concessions from Europeans to avoid trade war
43,,Democrat,VIDEO AND PHOTOS Of Obama Ejecting Reporters Resurface After Lefty Outrage Over Rude CNN Reporter Being Tossed From Trump Photo Op [Video] * 100PercentFedUp.com
44,,Democrat,Trump: 'We will look into' Twitter for 'shadow banning' Republicans
45,,Democrat,32M Central Americans Would Have Right to Migrate to U.S. Under Asylum Plan
46,,Democrat,Centrist Dems begin arguing against far-left agenda as 2020 play
47,,Democrat,Calling Law Enforcement Terrorists Is Proof That The Left Hates America
48,,Democrat,Maxine Waters Wants Trump Supporters To Stop Confronting Her - Big League Politics
49,,Democrat,Equality now.
50,,Democrat,Lawyers: White Students Should Be Able To Sue Cal Poly For Racial Discrimination
51,,Democrat,"Report: How Noncitizens Vote in Allegheny County, PA"
52,,Democrat,"Carol Hafner, candidate for Alaska House, has never been to the state"
53,,Democrat,Matt Drudge Weighs in on Latest New Yorker Cover: The Left Has a ‘Fetish’ For Trump’s Death
54,"[https://wcu.az1.qualtrics.com/jfe/form/SV\_1Mt5g3XBaR2AlF3](https://wcu.az1.qualtrics.com/jfe/form/SV_1Mt5g3XBaR2AlF3)

Hello,

Please consider taking the attached survey examining the experiences of veterans and civilians. More specifically, the relationship between trauma, interpersonal relationships, and other individual experiences. The purpose of this study is to further understand reintegration difficulties of veterans, identifying coping mechanisms among minorities and civilians, and gaining a deeper understanding of general human attachments and interactions. You must be 18 or older and be a citizen of the United States to complete this survey. All responses are anonymous, and no identifying information will be collected. The questionnaire should take 30-45 minutes to complete.

You will be given the online anonymous questionnaire that consists of a variety of questions. We ask that you answer each question honestly. Upon completing the questionnaire, you will be given a debriefing form with contact information for the Principal Investigator, Institutional Review Board, and several help lines.

You may refuse to answer any of the questions, take a break or stop your participation in this study at any time. This survey is completely voluntary, and you may withdraw at any point.

If you have any questions, please contact Caitlin Stone, Western Carolina University Clinical Psychology alumni, at [cheighes1@catamount.wcu.edu](mailto:cheighes1@catamount.wcu.edu) or Hannah Hinkel, Western Carolina University Clinical Psychology student, at [hhinkel1@catamount.wcu.edu](mailto:hhinkel1@catamount.wcu.edu). You can also contact Dr. Kia Asberg, the Principal Investigator and faculty advisor for the project from Western Carolina University Clinical Psychology Program, at [kasberg@email.wcu.edu](mailto:kasberg@email.wcu.edu). If you have concerns about your treatment as a participant in this study, contact the chair of WCU’s Institutional Review Board through the office of Research Administration at WCU (828-227-7212).

Thank you!",Democrat,"[Academic] Evaluating Differences in Adjustment, Self-Esteem, and Stressors Among Veterans, Minorities, and Civilians (18+ US Citizen)"
55,,Democrat,"Puerto Rico mayor, two others arrested on corruption charges"
56,,Democrat,"Poll: Americans want tough immigration reform, the wall, English spoken"
57,,Democrat,Has Trump Been Compromised?
58,,Democrat,Bring out your dead
59,,Democrat,"California Dems snub Sen. Dianne Feinstein for long shot rival, in 'clear-eyed rejection' of party establishment"
60,,Democrat,Black conservative leaders call for censure of Maxine Waters
61,,Democrat,"NYTimes Admits ""Trump Got From NATO Everything Obama Ever Asked For"""
62,,Democrat,The Unmasking Antifa Bill Introduced by Congress Puts Antifa in Same Category with Their Democrat Cousins in the KKK
63,,Democrat,MAGA Hat Thief Kino Jimenez Released on $5000 Bond - Big League Politics
64,,Democrat,Feminists Clash with Transgenders at London Pride Parade
65,,Democrat,Wait–How Many Immigrants Are On Welfare Again?
66,,Democrat,"The Facts: 48,000 Assaults Attributed to Illegals in 2017"
67,,Democrat,Man threatened to kill Trump supporters at congressman’s campaign office on Long Island: police - NY Daily News
68,,Democrat,"Beware those scientific studies -- most are wrong, researcher warns"
69,,Democrat,"Rep. Maxine Waters owed an apology from top Dems, 200 black female leaders say"
70,,Democrat,"Ocasio-Cortez cheated her co-workers out of tips, as a waitress."
71,,Democrat,Happy?
72,,Democrat,"RI State Rep. Walsh 'furious' to lose Democratic Party endorsement to Trump supporting ""ex""-Republican"
73,,Democrat,Voting Democrat!
74,,Democrat,HILLARY WANTS THIS DELETED ! Video of RACIST TIRADE Has CAMPAIGN SCRAMBLING
75,,Democrat,Alexandria Ocasio-Cortez lied about accepting only personal donations and no PACs.
76,,Democrat,I voted for Bernie. What happened to our country!?
77,,Democrat,"FBI Agent working child porn finds Huma and Hillary emails on Weiners computer. Agent worried ""someone is trying to bury this""...."
78,,Democrat,TV Poll: 71% Of Liberals Don't Want Peace With North Korea Because Trump Would Take Credit
79,,Democrat,Alberto Fernandez: Reinventing an American International Broadcasting Network to the Arab World
80,It's totally obvious the only people who post in this sub are republican trolls. ,Democrat,This sub is a fucking shitshow
81,,Democrat,Gay Americans are arming themselves to stay alive
82,,Democrat,Please this is a great file to circulate to protect the sick
83,,Democrat,DNC member calls WV Sanders supporter a Russian plant
84,,Democrat,California Found to Be Harvesting Newborn DNA For Decades Without Parental Consent
85,,Democrat,BREAKING NEWS: BREAKING NEWS---- An anonymous source familiar with the situation reports that there is potential colllusion with North Korea-- PROOF
86,,Democrat,Early Birthday Celebration for POTUS
87,,Democrat,Just a reminder that a Republican that stays home votes Democratic! Get out and vote this week!
88,,Democrat,"Unelected global governance, open borders, gun control, or speech laws will never be our credo."
89,,Democrat,This is what we almost elected
90,,Democrat,"Kansas Democratic Party can't account for $900,000 from Clinton campaign fund"
91,,Democrat,Happy Birthday Donald!
92,,Democrat,Just an actual picture of Russian Collusion for strategic asset sales to Russia.
93,,Democrat,"Obama Admin Sought To Criminally 'Entrap' Trump Campaign, like a typical communist regime."
94,,Democrat,Democrats Warn That Defunding Planned Parenthood Will Reduce Access To Essential Campaign Donations
95,,Democrat,"Advertisers Shy Away From Samantha Bee,’ Despite Apology"
96,,Democrat,"Professor banned from restaurant for profanity-laced rant against white children, university investigating"
97,,Democrat,UFC fighter will give Donald Trump his title belt upon win
98,,Democrat,"Ben Shapiro bashes Joy Reid for hateful posts, but is guilty of the same thing."
99,,Democrat,"Joy Reid Apologizes for Blog Posts, Appears to Drop Hacking Claim: 'There Are Things I Deeply Regret'"
100,,Democrat,Liberals' worst nightmare: a second supreme court pick for Trump | Law
101,,Democrat,"Publix Puts Its Foot Down, Refuses to Cave to Hogg’s Million-Dollar SHAKEDOWN"
102,,Democrat,"Former NAACP Leader, Who Pretended to be African-American, Charged With Welfare Fraud"
103,,Democrat,Three Arrested in Voter Signature Fraud on Skid Row
104,,Democrat,Trump Says NFL Players Who Kneel 'Maybe Shouldn't Be in the Country'
105,,Democrat,NFL owners pass new national anthem policy
106,,Democrat,New Analysis Finds Blue States Have Worse Opioid Problems
107,,Democrat,Dick Morris: Ghost Voters Keep Democrats in Office
108,,Democrat,The NRA in a nutshell
109,,Democrat,US Congress mulls extending copyright yet again – to 144 years
110,,Democrat,Jimmy Carter at Liberty Is 2018’s Most Surprising Yet Hopeful Commencement Speaker
111,,Democrat,Liberal Writer: I'd Rather My Daughter Date A Member Of MS-13 Than A Republican
112,,Democrat,Are electric cars worse for the environment?
113,,Democrat,Oakland Mayor Sued in ICE Warning to Illegals
114,,Democrat,"Madeleine Albright - The deaths of 500,000 Iraqi children was worth it for Iraq's non existent WMD's"
115,,Democrat,"Clinton on Qaddafi: We came, we saw, he died - we need Bernie , not a $hill"
116,https://www.dallasnews.com/news/2018-elections/2018/02/22/fracking-billionaires-pump-millions-texas-races-pushing-state-gop-even-right,Democrat,"Cut their heads off, and you can earn the name Democrat"
117,,Democrat,Ex-Dem Senator who called for gun control gets 5 years in prison for weapons trafficking
118,,Democrat,"Mueller Indicted A Russian Company That Didn't Even Exist, Court Transcripts Say"
119,,Democrat,Former Democrat Congressman Has 'Given Up on America' After Third Jail Sentence
120,,Democrat,"North Carolina mayor arrested on DWI, gun charges hours after election win"
121,,Democrat,New York AG Schneiderman Resigns After Shocking Report
122,,Democrat,Socialism Is So Bad for Economies That a Video Game's Currency Is Now Worth Astoundingly More Than Venezuela's
123,,Democrat,CDC: 70% of New HIV Infections in Gay Men -- Anal Sex Riskiest Behavior
124,,Democrat,Pocahontas descendent wants Elizabeth Warren to take DNA test
125,,Democrat,Buffalo Soldier monument in Audubon Park vandalized
126,,Democrat,Some Democrats Want Hillary Clinton To Return The DNC's Money
127,,Democrat,"Caravan arrives, Honduran flags flying, middle fingers flashing"
128,,Democrat,What do you guys think of these MAKE KANYE GREAT AGAIN hats?
129,,Democrat,Salt is a way of life
130,,Democrat,How Democrats Become the Conservative Party (2016)
131,,Democrat,Pelosi: “I Don’t See Anything Inappropriate” In Rigging Primaries
132,,Democrat,UC Berkeley must face lawsuit alleging bias against conservative speakers
133,,Democrat,Judge: Bars are allowed to throw out Trump supporters
134,"https://immigrationforum.org/blog/recognizing-americas-children-rac-act-bill-summary/

It looks like a better alternative to DACA, but it seems to be mostly backed by republicans, and I haven't heard a peep from democrats about it. Any clue?",Democrat,Why aren't more democrats supporting RAC? (daca alternative)
135,,Democrat,*insert triggered liberals here*
136,,Democrat,Trump Travel Ban Looks Poised for Victory at U.S. Supreme Court
137,,Democrat,SPLC Pulls Controversial ‘Anti-Muslim Extremist’ List After Legal Threats [VIDEO]
138,,Democrat,DNC Be Like
139,,Democrat,"Rosenstein Told Trump He’s Not a Target in Mueller Probe, Sources Say"
140,,Democrat,BREAKING : GEOTUS informed he is not the Target of Mueller
141,,Democrat,"Dems aren't even trying to hide, disguise or sugar coat it any more, they're just straight out promising money for votes."
142,,Democrat,Is Governor Cuomo corrupted like the rest of the Democratic party
143,,Democrat,WHAT HAPPENED? Hillary’s Popularity at RECORD LOWS After Her ‘Excuses Tour’ | Sean Hannity
144,,Democrat,"HOLY SHIT! Ex-FBI Director James Comey CONFIRMS There Is A 'DEEP STATE'-Made Of FBI, CIA, Military! Says They're 'Okay', Though..."
145,,Democrat,It’s happening. Hillary is looking at some hard time.
146,,Democrat,Hannity: 'Amazing' That 'Army of Lawyers' Hasn't Convinced Comey to 'Keep Quiet' | [Criminal referral on 300 page confession.]
147,,Democrat,The Democratic Party was involved in the largest act of Treason in the history of the United States. National secrets given away to our Enemies by spies hired openly by 1/5th of the Democrats in congress.
148,"Why is it that the South has gone from almost totally Democratic pre civil rights era to almost totally Republican now?

And Civil Rights may have something to do with it I don’t know if it was the massive decisive factor people say it was.

LBJ is quotes as saying “We’ve just lost the South for a generation” upon signing the Civil Rights Act. Well, he was incorrect.

It took the Democratic Party about a generation to lose the South.  I think Jimmy Carter and Bill Clinton did quite well down there, and it wasn’t until 1994 that the majority of congressional seats from down there went to Republicans.

I suppose apart from Civil Rights you need to look at the two parties platforms and see which one lines up most with southern culture.

Which party is it that loves guns, loves Jesus, loves the death penalty, and doesn’t take kindly to foreigners? I guess that’s my answer ",Democrat,What happened to Democratic Party in the South?
149,,Democrat,Poll: Democrats’ advantage in midterm election support is shrinking
150,,Democrat,H-1B visa applications are down again
151,,Democrat,Morgan Freeman: 'Jailing Hillary' Best Way To 'Restore Trust In Govt'
152,,Democrat,"Watch: Dem. Gov. Candidate Freaks Out on Cops, Booed by Disgusted Audience"
153,,Democrat,De Blasio aide busted with gun in car
154,,Democrat,Facebook Class Action Lawsuit Coming: Court Documents Expose Facebook's Bulk Data Dump To FBI Without Warrant
155,,Democrat,The biggest Black Lives Matter page on Facebook is fake
156,,Democrat,Washington State Penitentiary hunger strike continues | The Seattle Times
157,,Democrat,Parkland shooting hero blames sheriff and superintendent for failing to prevent massacre
158,,Democrat,Outraged shoppers threaten to boycott Target after a man exposes himself to a young girl in a store's bathroom
159,,Democrat,"Texas elected official gets misdemeanor, accused of berating a teen girl wearing Trump T-shirt"
160,,Democrat,BET founder: Trump economy brings black workers back into labor force
161,,Democrat,"Liz Peek: Trump gains ground, much to liberals’ horror"
162,,Democrat,WATCH: Black Gun Owner's Epic Rant Against The Government Goes Viral
163,,Democrat,"Stormy Daniels Accusations Boost Trump Approval Rating Among Men, Poll Shows"
164,,Democrat,Opinions on the Sutherland Springs shooting?
165,,Democrat,Still Bleeding: The DNC’s Financial Situation Just Got Worse
166,,Democrat,Anti-Semite Claims Democrat Black Caucus Members Speaking At His Rally
167,,Democrat,Thank God our founding fathers were fighting for our freedom instead of marching for British gun control
168,,Democrat,Bitter Hillary fantasizes about ‘alternative reality’ where she’s president.
169,,Democrat,[ WINNER ] --- Trump election night win compilation video - best one of these yet (!!)
170,,Democrat,Nebraska Gov. Ricketts signs $8.8 billion budget defunding Planned Parenthood
171,,Democrat,"Hillary Clinton’s Foundation Arranged for Chinese Vaccine Makers to Avoid U.S. Scrutiny, World Health Organization Report Reveals"
172,,Democrat,DESPERATION! Mueller Is Asking Russian Oligarchs If They Funneled Money to the Trump Campaign
173,,Democrat,Florida School Ditches Common Core - Soars To Number One
174,,Democrat,"Today's bogus report on the Stone/Assange ""meeting"" did reveal one interesting tidbit. By August 4th 2016, Clinton campaign was already pushing Trump-Russia narrative."
175,,Democrat,"Remember when Sarah Silverman was saying the military would help them ""overthrow the mad king"" Trump and save the cucks from reality? Did that ever work out?"
176,,Democrat,CNN 'deeply concerned' that Trump is delivering on promises made.
177,,Democrat,"Obama State Dept used taxpayer dollars to fund George Soros group's political activities in Albania, watchdog group says"
178,,Democrat,the left has gone silent on the far left immigrant woman who shot up YouTube HQ. we must bring it up nonstop to avoid it being memoryholed
179,,Democrat,Donald J. Trump Tweet: “Still Rising: Rasmussen Poll Shows Donald Trump Approval Ratings Now at 51 Percent”
180,,Democrat,YouTube Shooting Witness Says He Wished He Had A Gun
181,,Democrat,"Trump appears to agree to the Adolf Hitler saying, ""Make the lie big, make it simple, keep saying it and eventually they will believe it."""
182,,Democrat,"Teens arrested, accused in fentanyl smuggling attempts at US-Mexico border crossing"
183,,Democrat,"Science says liberals, not conservatives, are psychotic"
184,,Democrat,Fellow Democrats tell embattled Congresswoman Esty to resign
185,,Democrat,US set to request five years of social media history for all visa applicants
186,,Democrat,DC police officer admits that the March For Our Lives was being planned SEVERAL MONTHS BEFORE THE SHOOTING EVEN TOOK PLACE! These people are phonies. pedes! Spread the word!
187,,Democrat,Woman gets 5 years for illegally voting in 2016 presidential election
188,,Democrat,Texas County Hit With Lawsuit for Concealing Records of Noncitizens Registered to Vote
189,,Democrat,The perfect treat. Taking out those racists one by one
190,"Fuck Democrats. Hypocritical dumbasses. The whiniest chumps on the planet. They throw their bullshit insults at anyone and anything that doesn’t mindlessly go along with their ideologies. They get treated as world class royalty by the media and other libtards, but if you insult them or call them on their shit, suddenly words hurt and “you can’t hurt my feelings, that’s hatespeach” bullshit. Offmychest subreddit, fuck you. Ban me for speaking my mind. Ps, fuck you again ",Democrat,Double standards from the left
191,,Democrat,Fuck you liberal commies
192,,Democrat,36 Hours: From Leading Anti-Gun Violence Rally to Capital Murder
193,,Democrat,Right-Wing Media Ignores Stormy Daniels But Loses it Over Ice Cream
194,,Democrat,Trump California sanctuary lawsuit backed by more than a dozen states…
195,,Democrat,It Begins. Democrat Candidate for Sheriff Suggests Killing People to Take Their Guns
196,"Greetings! Our team is proud to announce that we started a new political debate server. Come exchange ideas us at Discord We have rooms where you can debate with anybody and we have specialized rooms for specific chats for each political group. We aim to bring people from all sides of the spectrum, socialist, anarchist, capitalists, fascists, and so on; and engage in a healthy and mature debate.

Here is an invite like:

https://discord.gg/gJzAPq4.

Feel free to invite all your friends. Come let us keep the spirit of open discussion alive.",Democrat,Politics Debate Server
197,,Democrat,Democrats reject immigration deal as budget deadline nears
198,,Democrat,D.C. lawmaker says recent snowfall caused by ‘Rothschilds controlling the climate’
199,,Democrat,HAPPENING NOW: GOP Uncovers Voter Machine Errors in PA Election
200,,Democrat,SPLC Pulls Three Russia-Related Articles After Challenges To Accuracy
201,,Democrat,Bernie Sanders Joins 2nd Amendment Protest Surrounded By Armed Guards
202,,Democrat,CIA floods democratic party 2018. Save lives don't vote for CIA backed candidates.
203,,Democrat,Warren rejects DNA test idea to prove Native American ancestry: 'Nobody is going to take that part of me away'
204,,Democrat,DACA Illegal Aliens and Democrats Turn on Each Other for Unsuccessfully Passing Amnesty | Breitbart
205,,Democrat,"Donald Trump right on immigration, gang violence, Sweden finds - Wash…"
206,,Democrat,Trigger Warning: CNN Host Says Trump May Go Down As 'Great President.' Internet Goes Nuclear.
207,,Democrat,"President Donald Trump: Trump ""Democrats are nowhere to be found on DACA."" | FALSE"
208,,Democrat,"Mayors Who Harbor Illegal Alien Killers Could Face The Death Penalty, According to Federal Law"
209,,Democrat,Katie Pavlich - Breaking: DOJ Announces Fast and Furious Documents Withheld by Eric Holder Will Be Released
